,output.sentences,education
3,We saw a cute cat in the window.,2
4,We gathered in a crowded room to celebrate the life of our friend.,0
25,THE GIRL WAS SOME DOING,4
28,It was a gorgeous day in Egypt.,5
30,Yesterday we went to visit the aquarium.,4
35,A girl hears fireworks going off for the Fourth of July so she grabs her camera and starts taking pictures of the night sky.,3
42,The new graduates have bright smiles to begin real world experiences.,5
51,"There were lots of students at the party, drinking and having a good time.",0
53,I could not wait to ride the ferris wheel!,4
74,We even did some silly shots.,2
76,Many family members were there and everyone posed for pictures,0
77,"The lead singer did really well, but he was nervous too.",2
90,A plaque depicting the state of Texas above some text.,5
92,Snow will bring things together in such a fashion as making two floors appear as one.,9
100,They brought in some very talented speakers.,2
102,"While visiting on vacation, we decided to take in some of the local historical sites.",0
109,It was a complete mess.,0
111,She thought her brother was scary even though he said he didn't really feel scary in his dress.,5
112,The performance was good.,0
122,The witches hat looked more like a pilgrim hat.,0
123,"But soon, Spring began it's annual thaw, and the railway transportation was running once again.",5
130,It was July when they met in the park.,1
132,They party as if they were drinking for Oktoberfest..,2
144,There were also people walking around in dragon costumes.,2
147,"The first ones to lead the parade were the bands, which played instruments and put all the watchers in a festive mood.",9
164,"Nearby, a Preying Mantis sits on a bent flower stem.",5
166,The pond at the shrine is beautiful.,0
173,The passenger of the oncoming vehicle said his car incurred damage too.,1
176,"Gradually, as people got injured, or tired, the ranks thinned out considerably.",9
177,IT IS A TALL TREE,4
178,They were playing in the local indoor play area.,8
193,The church was ready for Christmas.,0
195,Everyone will go trick-or-treating tonight!,4
196,The spider made an appearance at the parade.,5
202,The low illumination of the lighting made the furniture glow.,4
207,The staff started going through their stuff like safety procedures.,3
217,The train and stage were made similarly.,0
227,It was time to go out partying after the wins.,5
234,Hard hats are required because the structure may not be safe.,4
235,He had a great time on the hike.,0
238,"When it dried, she hung it on the porch.",4
247,Josh and Lucy played strip poker until someone lost.,4
248,And held classes for interested patrons.,2
255,It was strange to be inside this place thinking about all the people who used to be inmates here.,0
261,I caught glimpse of the Queen as her carriage went by.,0
265,Everything is now quiet as I look out the window and wonder (where did the party go).,0
279,This piece of ancient artwork appeared to have been carved from a giant boulder.,9
280,Many moments were captured of people buying food.,0
281,They enjoyed catching up and sharing stories.,0
291,It was a spice girls themed party.,0
294,On the farm there was a hug field.,2
297,"Farms have plenty of animals to look at, and these pigs are definitely getting some attention.",2
298,It was a beautiful day for him.,0
304,Many people arrived in pink to support the annual breast cancer awareness run.,0
312,And was very happy to be in the field.,0
317,Johnny visited the Hard Rock Hotel on his recent trip to Florida.,5
326,He atayed in the lead as the race continues.,5
327,he walked over to the store where there was lots to look at,3
338,I wish I was closer this time to the cars.,5
339,"The winner impressed the judge who as also a cowboy, so we all know what customes didn't win.",3
345,"We set pumpkins on our doorstep, which lets people going by know we are participants in the festival.",9
353,"Yup, they did it, they brought me to the sand.",3
354,who wants to die to.,5
361,this is a couple,3
364,"We finally arrived to our friend place, in the middle of beautiful houses",4
365,"It's so heavy, I don't know if I can move this tree myself.",0
366,The fireworks display is almost over.,3
369,"When the game starts, everyone is screaming rock.",0
373,Today seemed like a great day to go shopping.,5
378,I wonder how much it cost this year.,0
385,IT IS A ANIMAL,4
392,The husband realize that the wife turned his man cave into a office and was mad and wished he told him.,3
394,"Then, we went on a pizza date!",4
403,"Wow, this piece was also yellow.",3
404,We also did keg stands at the reception for the longest time.,4
407,"Some Halloween party goers dressed in simple attire, unconcerned about winning prizes.",5
416,Everyone joined together for memories and to mourn.,3
419,What a beauty! Yes I am ready!,5
425,The church had interesting old architecture.,0
432,It gave me hope that I had friends at the bike church.,4
434,My brother played his guitar.,0
435,the friends and the families are reflected in the dolls,0
436,All the people loved it.,0
440,And was very happy to be in the field.,0
447,His mom was so proud of him.,0
453,Another fire truck came to help put the fire out,3
458,The rest of the vegetables paled in comparison to the leek!,4
459,It was a fine summer morning to go to the beach.,4
474,I think this person dressed a little to old for this party.,5
488,The extra money spent was well worth it as the cake vanilla and chocolate cake was worlds above the average.,4
491,There are so many hot rods.,3
496,I am building a massive Star Wars collection.,4
504,Local artists sang the day away.,4
509,IT I S A IMAGE,4
515,I WAS WALKING AROUND THE SHOP LOOKING AROUND,3
519,We ended up back at the tracks where there used to be a station.,4
521,IT IS A BLANK,4
523,He heard noises from the kitchen.,2
525,The murals on the wall stole the show at this year's exhibit.,2
527,The dog was ready to go.,0
535,the food was delicouldy prepared during the day,0
536,Dan got first place.,0
547,School is finally over and it is time to celebrate guys.,3
550,The location of the tickets were adjacent to the games.,2
554,The people on the boat are only stopping in for a day.,0
567,We went to go see some cool cars.,0
570,He placed it in his coat as he left the store.,4
573,Our town's firework display at the end of the week is something to see.,9
577,Lets move to this antique side of the park and shop.,5
580,"A reward for her service, a woman received an award.",5
593,Each of the performances were excellent.,5
604,"Oh, Mamma, it is so good to see you!",3
605,"A good time was had by all, especially the bride and her sweet daughter.",2
618,The firetruck was a big hit with the kids.,2
621,Where they stayed was spacious.,0
625,A man and a woman sit down a few feet across from each other just talking,2
628,This is a unique pyramid creation.,5
633,That night they had fun dancing,5
635,The little boy is about to go outside with the eggs.,9
643,The racing day was finally here.,5
652,The kids are watching the fireworks get started,5
654,Everyone knows how much I love chocolate cake so they got me one with lots of funky frosting on it.,2
669,My roommates decided to have a party to play video games.,4
675,"The trees where white, all covered in snow",5
679,My dog is ready for the dog show!,4
680,"It was time for my office's annual party, and this year, the theme was having a cookout in the wilderness.",0
686,The dog was ready to go.,0
704,"She sees that they guy before him is doing well, and almost gives up hope for her man.",4
709,there is a sign in gloomy weather,5
715,they have such cute buildings here,9
718,We baked cookies for the three of us.,4
721,Lastly we watched some music performances.,5
724,"Cool, here it comes.",3
725,The young man stands in front of the group and is ready to give his opinion on the latest developments.,5
727,His mom was so proud of him.,0
731,Durring one of my morning walks I found these lovely flowers.,2
741,He bored the students.,5
745,These luscious wild berries looked delectable and tasted even better.,9
747,Singing our hearts out!,5
752,"It took hours to dig out the cars, but few businesses were open anyway.",0
753,The four engineers came to the power plant to check on their work.,4
757,A cup has a leg on it.,0
759,The happy wedding was perfect.,0
775,They were very happy when the helicopter arrived,2
781,The baby was going to have some pool time.,5
784,IT IS A FOREST,4
787,I hope he doesn't think we are going to eat him.,0
801,They spend their male days bonding together.,2
816,How do people even have the storage for all this excess junk?!,9
818,THEY ARE IN BOAD,4
822,"Since we're in CA, we got great views of the water too.",4
823,Every year we get to celebrate our towns pride with a parade.,5
826,THE PICUTRE IS BEAUTIFULT,4
828,"The outside needs a little love, but so much potential.",5
831,The event started in this venue where the chapel was located.,5
838,The trophies were on the winner's table.,5
845,"Randy makes a sensation when he sings his songs in public, because he's good and Gigi knows he will be famous some day.",9
848,Some resembled mythical figures.,5
852,The big cycling race started early in the morning.,0
853,THE BOY IS THE SELPI,4
859,The pose for the picture at the after party was perfect.,2
862,They're confused because they're watching a guy I put inside a jello shot.,5
866,"Batman showed his face as well, scowling at the other superheros... I wonder if there will be a Spiderman VS Batman reenactment.",2
879,The elephants were a hit with the guests as always.,5
886,The best costume was the red priest.,3
887,What do you think thoes new signs posted all over the hotel are for? my guest is as good as yours who knows Ashleyreplied,8
890,THE MAN SOME DOING,4
900,His mom was so proud of him.,0
906,This is where all the major parking will be happening once the park is open.,3
907,"His friends were surprised, but were excited for the king.",0
910,"Yesterday, around this time an interview was setup.",9
914,One of the nicest thoughts she had was that her mother in law was a huge support to her too.,2
920,I wanted to ride the best rides on the lot.,4
928,Today I went to my favorite store.,5
932,Another coach yelled commands as they begun to play,0
938,The patrons enjoyed hearing us play and the restaurants paid us in wine.,4
951,IT HAS A ROAD,4
953,We had so much fun having our cousins over.,5
954,The firemen prepared the vehicle to be towed away.,0
956,One solitary shoe was left in the field to signify the journey of a thousand steps.,9
972,The female sits in a nearby garden.,0
974,There was orange fireworks,0
985,THE PICTURE IS BEAUTIFUL,4
987,We let him cut his own cake.,2
989,a man drinking tropical shake,3
993,The female and male dance along the ice,3
995,THE PICUTRE IS BEAUTIFUTHE PICUTRE IS BEAUTIFULL,4
1004,Fresh flowers to accompany the baked goods.,5
1017,Sitting nervously as I prepare to make my presentation.,2
1019,"Although there are other towers to be seen in the area, this park monument is particularly eye-catching.",9
1044,IT IS A BLACK STONE,4
1046,THE WAS IN MUSIC,4
1052,"With just a little difficulty, they manage to hoist the items into the home.",2
1055,"While walking around the city, the tourists were separated by the police.",0
1059,The bikes are lining up for the race.,9
1060,it broughtout the kids festivities too,0
1063,The bikes were waiting to be ridden,5
1069,With the beer he had a huge plate of food.,0
1076,The dog was ready to go.,0
1086,The kids were having fun and the adults finally got to just watch the time roll by.,3
1090,The fort had construction going on outside.,4
1096,It has a comfortable interior.,5
1107,The picture had been buried in my fathers office.,0
1108,Cindy wrote a poem and made us all read it out loud.,0
1112,The dog was ready to go.,0
1113,"By the end of the night, I was wiped, and it was time to go home.",4
1114,"Another one had this huge Chewbacca statue for sale, but made sure to let potential buyers know that he weighed a ton - they might need some help moving him!",3
1117,IT IS A ART,4
1121,We also went to the playground for awhile.,0
1123,Looks like there's a parade.,3
1132,The dog was ready to go.,0
1136,"While I was cooking, they were smoking and drinking on the balcony.",5
1141,"Then I met the rest of the team and they showed me ho to remotely drive the car there, and I was suddenly no longer bored.",3
1144,There were also panels to ask crafters questions.,5
1150,This was a beautiful landmark viewing.,0
1151,The man was posing for a photo with friends.,2
1158,The fourth of July special was so amazing.,5
1184,His mom was so proud of him.,0
1188,He had a great time on the hike.,0
1194,only the best so we can broadcast,9
1204,The lead singer finished singing.,0
1212,THE GIRL WAS SEEING IN THE BEECH,4
1216,After the parade was over we enjoyed a bonfire on the beach.,4
1219,His mom was so proud of him.,0
1228,We watch cars race around the track.,2
1230,There was one that was unique and hand drawn.,0
1231,The two men painted the wall in their favorite colors for their marriage to each other.,5
1237,The result was a success!,0
1239,IT IS A BOY,4
1240,This flamenco is just hanging out.,0
1245,THE THREE MAN IS THE SPEECH,4
1246,Today is the university graduation ceremony.,5
1252,"Ernie was upset about an issue, and brought up many good points.",5
1255,The guests came together and enjoyed the wine.,3
1257,"We were stellar, and we saluted the group of veterans after our performance.",5
1258,I took a trip to get some sweet treats.,4
1281,The locals in turn would show the toursists how they prepared food.,0
1291,I couldn't believe the colors and textures of the wares.,2
1294,The kids ate macaroni for lunch as they sat outside by the lake.,0
1295,His mom was so proud of him.,0
1297,One friend started cooking meat on the grill.,4
1301,So does her sister.,4
1314,"As he stared into the void he pondered, ""Have I been the turkey all along?"".",0
1317,I always come home with a bag of seashells instead of buying souvenirs.,5
1320,A lot of police were there to make sure that they were safe.,5
1324,"I ended up with a time I felt proud of, but my feet hurt so badly at the end I don't know if I'll ever do it again.",4
1329,Then they visited a Japanese festival to enjoy the festivities.,2
1331,While the couple next to them gets to know each other a little better,2
1333,I washed and drained the canned garbanzo beans.,4
1336,The ice sculptures glistened.,0
1350,my sister sitting on a bench,3
1356,IT IS A BABY,4
1364,Phil was so excited to become a husband and wanted me to take a ton of pictures of their wedding.,2
1373,Some people even asked him for a photo and autograph after the show.,0
1376,We got together at church for my son's dedication.,2
1380,They brought presents to give to the host as they viewed the specialty food available in the restaurant.,0
1392,I also cook cream covered cakes.,0
1396,They were joined by more friends who were excited to share in this vacation adventure.,0
1399,The party was not very fun as you can see by the fact that most of the guests are forcing a smile in these photos.,2
1403,We are all on the court practicing for the big game.,2
1406,Family vacation with the dog along should be interesting.,3
1411,Th accident was pretty bad.,2
1415,It's so lonely out here!,8
1422,They were here to make a statement.,9
1429,I went to church.,0
1434,We went to see firework show.,2
1440,Emily enjoyed licking the choclate frosting off her fingers.,2
1442,She grabbed her sweatpants and headed out into the night.,0
1445,It was easy setting up the tents to sleep at night.,9
1447,IT IS A HOUSE,4
1453,My calendar has different views for each month and this one reminded me of a time I visited the big city.,9
1456,In the crowd wielding away to the trance music with plow up swords.,9
1466,"Yesterday, my grandparents had us sit and watch a slide show.",9
1468,The baby was crying so they stayed low and hidden inside the house.,5
1469,He invited just about everyone he know as well as those he didn't.,2
1474,"At one time, this house was considered modern.",5
1479,The cherry blossoms are the first thing seen.,3
1481,And my daughter had the most fun on the merry-go-round.,3
1487,"After the race, all gathered for the local newspaper to take their photo.",4
1499,These folks seems to be letting loose so he decided he could join them.,4
1500,and her we are today almost finished with construction,3
1501,The person with the best costume will win an awesome prize.,0
1502,IT IS OLD CAR,4
1509,The trophies awaits the winners.,9
1512,It was the next morning when they finally stopped at a nearby pond.,5
1517,The dog was ready to go.,0
1522,They took a lot of pictures.,0
1523,"Afterwards, we have a bonfire at the house to end the day.",9
1526,I just received my diploma.,5
1532,"The show was a huge hit, everyone stared in amazement of the lights.",0
1536,The town gathered for the fireworks.,5
1547,I watched the triathlon athletes.,0
1549,He had a great time on the hike.,0
1550,It was high time I spent a day out with friends.,3
1556,His mom was so proud of him.,0
1563,They paraded around holding huge rockets.,3
1565,Boys showing off in the surf.,0
1568,His family drinks beers plays cards at the kitchen table.,3
1569,It was a great party and everyone agrees they should do it again next year.,0
1572,"His friend was prone to motion sickness, so they skipped the ferris wheel ride, which was his favorite.",0
1576,"The ball swished through the net, bringing home a win, and then he exited stage left with his teammates cheering his name.",0
1580,The event was gathering lot of people,4
1585,The goose pimples raised by the cold air and the fallen leaves are nothing to Sylvia as she pays quiet tribute to her fallen husband with such a huge amount of pride and tenderness and loss in her heart.,9
1589,This is Pete's graduation party.,5
1590,Next we see how much energy is being used.,9
1593,the picture of the beach is perfect,0
1594,IT IS A COLORFUL BALLS,4
1596,IT IS A BUILDING,4
1598,A delicious looking fruit kabob taunts me with its colors.,0
1605,A couple who was full of joy was able to share a moment in time.,9
1614,Looks like there might be a little dancing going on at this party.,9
1625,"The season had come on all of a sudden, when it seemed that nature was still bountiful.",5
1626,The girls loved the strawberries and karaoke.,0
1638,Some of the costumes are grotesque and scary.,0
1643,The thief ran out of the house and off the porch.,0
1650,Hannah was the first in her family to graduate college and everyone wanted to share in her joy.,4
1654,One came down safely with it's red parachute billowing in the wind.,0
1656,A man and woman stands and looks through a glass door.,8
1679,"When the party started everyone, no matter what they wore, had a great time.",4
1685,Telling the school children welcome in Japanese and sign language is something he likes to do.,0
1686,The berries made a nice pop of color against the snow.,0
1692,Through the dancing we met new people and relatives we had not seen in ages.,9
1697,All the players were very good sportsmen,5
1705,A pig plays around at the petting zoo.,3
1711,"The final minutes of the night drew near, but we lingered, snapping pictures we could share later.",9
1716,"Listen to the sound he makes on the saxophone, I think it's jazzy.",4
1725,I thought the finale display was disappointing.,9
1732,At one point I fell down on the mat.,5
1735,We stopped at the local diner for some lunch.,3
1736,Today we had an out door family day.,5
1739,The best players of the tournament received applause.,4
1741,We were glad to not need any gas.,0
1748,There was a guy who had a hard time getting out.,0
1749,"A fun long day for the fans, and a long hard day for the employees.",4
1751,The remaining colors on the list was a rainbow that was lost.,9
1765,The dog was ready to go.,0
1767,"Weddings are often a week of truth telling, but the photographer job is only to capture the happiness of that day.",0
1772,IT IS A BLACK AND WHITE PICTURE,4
1774,"They began to walk across, stopping to wait until the humans finished crossing.",3
1780,Thank you everyone for showing up to the 19th annual park parrade .,8
1785,We are so glad we had the opportunity to make our community a better place.,5
1790,The hopscotch was still there on the playground,2
1792,She then grabs my cat and started parading around.,5
1800,IT IS A MEETING HALL,4
1801,"The smoke kept pouring out, sometimes make it hard to breathe.",4
1806,THE ROADS ARE COVERED WITH SNOW,3
1809,The group of graduates prepared to enter the assembly.,0
1818,"But it wasn't an option, I was determined.",0
1824,The family is arriving for the wedding.,9
1825,Night time is in the air.,3
1828,He actually brought a real girl to the party.,0
1830,He returned to his home later that day and sat on his porch.,9
1835,The marathon runners were greeted with hugs and gifts from family members.,2
1838,the boat is surrounded by historic buildings,3
1845,His mom was so proud of him.,0
1846,IT IS A RAINY SEASON,4
1852,ONE MAN FREELY SPOKE ABOUT WHAT HAPPENED,3
1853,He had a great time on the hike.,5
1859,In the one window we spotted a highly unusual stand of feet.,9
1864,The girl notice a cute male at the party and thought he looked amazing.,3
1868,The proud parents had traveled quite a distance to come to come to her graduation.,3
1874,His mom was so proud of him.,0
1879,The cyclists soared in the air when they hit a big bump.,5
1885,IT IS A TABLE,4
1893,"The water ahead looked very choppy, so they braced themselves.",0
1896,Toy Trainiacs is my absolute favorite store!,2
1898,We heard the water from the sea over the hill and I ran to take a picture.,0
1899,This was a surprise party for the new parents.,4
1909,I took my girfriend to a tennis game.,3
1921,You have to get all the cleaning done and make sure ingredients are fresh.,0
1929,The art was likened to Picasso.,0
1943,The son had fun drinking beer with his father.,0
1944,Be sure to visit the amazing landmark in the city.,9
1949,Their daughter took them out to lunch.,2
1950,The presenter looked nervous at first,5
1954,This man looks awful wearing vertical stripes.,0
1958,Tons of singing was being done by the choir in their costumes.,5
1959,The Hoover Dam gets a lot of visitors each year.,0
1966,The red car was reflected in the other car.,0
1971,Jill was interested in the way that shadows appeared in the landscape.,4
1974,The rooms were all set up like they would have been back in the 1700s.,5
1989,That is one beautiful sky.,3
1993,This future plans shows how people are going to be able to move about inside.,0
1997,We decided to walk along the tracks for a little while,4
2001,Joe wanted to be a professional basketball player and wanted to show his come up.,5
2002,Overall I'd say our summer trip was very successful.,2
2006,"Add the vegetables into the pan with the meat, and sautee all of it.",5
2007,My sister hung a fall wreath on her front door to her new home she recently purchased.,9
2008,They even did a group dance!,5
2009,Train station wagon did not stop,4
2027,I woke up early today to get to my volunteer job.,2
2029,The lights were on and every one was leaving.,9
2034,First came the drums.,0
2036,John was not going to pass on the steak smothered with mushroom sauce.,4
2038,And twists through beautiful fields.,9
2043,"The kids were all excited about the holiday today, it was one of the ones they enjoyed most!",8
2048,the memorial was amazing and very beautiful,3
2057,We talked about the pretty colourful night.,6
2059,I am a games collector.,2
2063,IT IS A FOOD,4
2067,"Time to get our gear together and leave,before it rains again.",2
2068,Time to hug a tree!,3
2072,"However, his honey wanted to ride the ferris wheel.",0
2076,I feel excited when I'm getting ready to eat.,5
2078,"For some reason, the adults start acting like children by playing with toys.",5
2095,On the beach they observed all the natural items that washed ashore.,9
2096,He picks up some orange juice so he can have some for his breakfast.,0
2107,"After we had food to eat, the entire group pitched in to wash the dishes and cookware before going back to the party.",0
2110,It was nice that the police made sure we were safe from traffic.,0
2116,They were ready for the July 4th Celebration.,9
2118,Grandpa was so happy to celebrate his 75th birthday with family.,0
2121,The beautiful interior is so clean.,5
2124,I had so much to eat and drink that I fell asleep on the couch.,0
2130,We were able to watch the cheerleading routine from our seats.,5
2134,a nice old lighthouse that still works,3
2142,A group of white and gold fireworks explode together.,3
2143,"In addition, the view of the bay was awesome!",0
2145,There was a large lot with construction.,5
2159,They carved silly faces in the pumpkins.,5
2160,We had lots of goofy fun that night,0
2163,"Despite withstanding the test of time, the headstones' names weathered and eroded like a forgotten memory, unable to reflect the name once etched.",2
2175,"Contraptions can also be complex, using the newst technology.",0
2177,"We cooks all kinds of things, especially desserts",0
2182,THEY TAKE GROUP PHOTO,4
2193,"His dad set him down, and the little boy ran off.",0
2209,The bride and groom began to state their vows.,9
2217,"My hubby and our new son, Michael.",2
2224,She dreams of someday sitting on the sidelines and watches as he runs on the field. Her worst fear is him resigning.,0
2227,Games and homemade attractions were a very central part of the party.,9
2229,The structure towered high over the forest and was evident of an ancient civilization.,0
2231,People will literally buy anything.,9
2232,The man had a friend name Jivus.,4
2237,People are observing the graves of the soldiers.,5
2240,We brought home lots of market fresh foods.,2
2241,"There were foods from others, including finger sandwiches, set next to the cake on the table.",2
