,output.sentences,education
8896,"Tragically, her husband died shortly after.",0
8897,We read a bit about the history of town once we get out of the car and begin walking,2
8905,It is sad to see the goal and net is such disrepair.,9
8910,Time to dig in and enjoy.,9
8913,The lights on the balcony not only decorate it but also serve as a guide to the staircase.,9
8919,At night the males biked together through the streets.,0
8925,We decided to go out for an evening concert.,4
8934,The mourners had a few refreshments and a small dedication.,0
8936,Sprinkles are put on by the kids and involves no effort.,2
8939,"The smaller kids played with trucks and blocks, the older ones played board games.",9
8942,"Flashing the group's symbol for ""you will be dead in 2 minutes"" the happy inductees were ready to embark on their final adventure.",0
8955,"Tourists can also enjoy water skiing, which can be fun or scary.",4
8960,IT IS A WAVES,4
8963,IT IS A BUILDING,4
8972,Once the team left the ground it was time to play.,5
8977,The soldiers represent individuals who overcome division in their communities.,1
8978,"Drawn to the water, the couple traveled for many miles to view the falls.",4
8991,A woman was so annoyed with everyone that she decided to take her mattress somewhere private .,3
8999,Police closed off the roads for the procession to begin.,2
9006,They read their vows to each other with nervous emotion.,0
9014,THEY SING A SONG,4
9021,The female had a great costume.,0
9033,Here comes the bride!,1
9036,Fluffy loves to lounge on the couch all day,0
9037,And was very happy to be in the field.,0
9038,Today was my little girls Happy Birthday.,5
9044,I really like the face that I carved on this pumpkin.,2
9047,During our trip we walked into this restaurant.,4
9065,Everyone loves a good wedding,5
9077,There are a lot of pictures of mom.,5
9078,The band played festive music.,5
9083,THESE ARE CLASS MATE,4
9085,BROTHER FRANK IS THE LIFE ALL ALL FAMILY REUNIONS,2
9090,The woman is finally finished and this has to be her favorite decorating she has done.,3
9097,And tried his best to convince everyone to buy in.,2
9101,And was very happy to be in the field.,0
9105,Sharing some smiles in this moment.,2
9108,I helped with this section.,0
9120,IT IS A ADD,4
9123,Exhibitors enjoyed showing off the engines of their cars.,5
9126,The live music set the stage nicely.,3
9127,Let the party begin!,3
9129,Wedding love is happening down on the beach.,3
9136,Everything was so colorful that day.,3
9139,The grounds are neat enough to play golf on and the area has lots of walking trails and places to picnic.,9
9149,The kids to not miss school and are having fun outside.,0
9153,The soldiers received plenty of praise and honors.,9
9156,A man drove alone in the very early morning so that he could earn a living to support his son.,0
9166,Each had a story of a snow globe.,4
9167,The motorcycles bikes were all ready.,0
9170,The annual festival was already underway.,3
9173,To conclude our visiting day at the school all kids received well deserved special trinkets and treats.,9
9174,I'm having a special night out with my hubby.,4
9175,This is the head mover for the town.,2
9180,IT IS A CYCLE,4
9182,THEY PEOPLE IN ROAD,4
9191,Glad you guys all came.,3
9202,IT IS A TABLE,4
9205,They visited the jelly as they were leaving.,0
9206,They drove down the country road.,9
9207,"As I walked past the train, I understood the meaning of life.",0
9208,IT IS A BOY,4
9210,He had a great time on the hike.,0
9219,The dog was ready to go.,0
9222,He had a great time on the hike.,0
9237,"We spent the day together and enjoyed my prepared meal early, after which we went out to a concert at night.",9
9245,High school sweethears were getting married.,4
9246,And that's my beautiful wife whom I have loved for the past 16 years,3
9265,I watched how they handled the flag in a careful way during the unfolding ritual.,3
9266,There was a fake smearing of blood.,5
9272,A group of three people stand around posing for the camera while smiling.,3
9273,This week we are taking a vacation to another country.,5
9280,The dog was ready to go.,0
9284,We prepared for the opportunity by setting up a camp to wait for darkness to come.,0
9293,This was his look on how he felt about the car.,5
9297,The keyboardist focused on the keys as he was playing.,4
9300,Everyone took care when teeing up for their turn.,0
9304,I got to try some local specialties as well,5
9310,She tried to recycle as much as she could.,0
9312,With their hat store money they could go on expensive trips.,2
9321,The weather is warm enough for the clowns to bring out their unicycles.,5
9323,They had their tickets for the day.,0
9325,They're also lovely yellow tulips,1
9327,Everyone finds their place and settles in.,3
9328,The falafels we made were delicious in the pita bread.,4
9335,We explored the fun house.,9
9338,We went to the golf game,1
9340,He had a great time on the hike.,0
9341,THEY BABY WAS SEEING,4
9350,It was fun with people on the sidelines cheering us on.,2
9356,The party started when we walked in.,5
9359,There were students from around the world who would transition from student to professional.,4
9367,THE PICTURE IS BEAUTIFUL,4
9368,Everyone was signing the poster with the school pledge.,2
9383,We always have fun together,0
9385,IT IS A BIRD,4
9386,IT IS A BUILDING,4
9388,IT IS A MEETING HALL,4
9389,It was a hot summer day.,9
9393,It was a good day.,5
9413,The newly weds took the dance floor for their first dance as husband and wife.,0
9419,The child face is painted as he sits on his father head having fun.,3
9426,The mascots are leading the crowd to the stadium.,2
9428,I can't find my brother on this snowy day.,5
9434,IT IS A SNOW TRAIN,4
9439,Mom was so happy to celebrate this milestone.,0
9442,IT IS A BUILDINGS,4
9443,The guys were all dressed up for the wedding,5
9444,IT IS A BUILDING,4
9458,The task of the baby shower cake was named mine.,9
9467,Today was all about celebrating.,3
9472,He was hoping to run a lot of laps because it would mean he raised a lot of money for charity.,2
9478,"Since we were bored, we took a lot of pictures.",3
9479,He had a great time on the hike.,0
9480,They walked in the sand which was an awesome experience.,0
9481,The dog was ready to go.,0
9487,It is really a prime location on the river.,0
9491,The robot was in the parade.,5
9493,The neighbors helped each other out by digging out cars.,0
9494,More artwork around the city that I could not go without seeing again.,0
9495,there was a funeral in NYC,1
9499,Everyone's sadness was noticeable.,1
9512,IT IS ALSO A PEOPLE,4
9516,THE BOY WAS SOME DOING,4
9529,I went to the beach to get some shells before the wedding.,2
9535,The sky was so blue as we watched our kites flying,0
9538,We went back to the hotel and discussed our exciting day.,5
9546,EVen then there were some people who were waiting to get in as the secret service had to screen one by one to be certain all was secure.,3
9548,"This weekend, we watched the Mardi Gras Parade.",0
9551,They took picutres next to an unique structure,9
9555,"It was tiring to have to carry him the entire time, but it was worth it.",8
9561,They cleaned the floors very well before they moved out.,5
9562,Everyone left the commemoration feeling very sad.,9
9563,A couple of the hippies hung to the back and smoked a joint.,5
9571,"The fireworks were beautiful, and there was a visible glow on the monument.",9
9574,A couple of friends were invited over for the party.,9
9575,The mime and the crayon's were ready for the parade.,9
9577,The group was amazing together.,0
9583,Everyone in town loves the lighthouse,0
9585,Graduation at PennState is a big event.,0
9587,IT IS ;A SEA HOUSE,4
9588,IT IS A HOUSE,4
9590,"""Is this a statue once worshipped?"" They ponder not knowing it is an old chess piece.",3
9593,Moving on the next exhibit was of body pars and bones--perhaps more conventional.,0
9596,I decided to head to the subway to wait for the train.,9
9615,I tried making Tracy jealous of my perfect boat trip by telling her about the sexy male that sat next to me but it would have worked better if I had snapped a photo for proof.,2
9617,Birthday morning and time to open presents.,0
9619,During my walk I pass by many buildings.,9
9627,"Then we saw colorful, somewhat bawdy, advertising from Japan, or some other country that uses characters instead of an alphabet.",4
9630,John was displaying his art at a art show.,5
9638,But later we began to appreciate the view of the lake and the nearby village.,4
9639,His mom was so proud of him.,0
9641,Everyone there was wearing white.,1
9646,They posed for pictures as a group.,9
9647,Babies make strange faces for no reason.,5
9660,We have planted nice plants along the side of the trail,0
9664,Dogs can be excited.,5
9670,"Meanwhile, Minnie is laughing behind Donald's back.",3
9672,The dog was ready to go.,0
9680,"The trees covered in snow looks like a Bob Ross painting, it's beautiful.",5
9689,The speech the lieutenant gave today was motivational and funny!,9
9691,"Considering the bumpy ride, we were very glad that the traffic was almos non-existant.",9
9693,IT IS A TIGHER MAN,4
9694,Off we went to the local park to try to fly our kite.,0
9700,They also went for a relaxing stroll along the mountain side.,5
9702,This sign is for a casual restaurant.,5
9703,In the end of the race everyone smiled for a picture,5
9714,"All this activity was too much, so the android sat on a park bench to rest.",0
9722,"At night, the shops are fun.",5
9726,I had so many options to pick because there are hundreds of characters,0
9729,Their friend had a kid that  wanted to go too.,9
9734,The trees were growing slightly slanted with their roots submerged in a stream.,4
9737,THE MAN SING A SONG,4
9738,The funeral will be held at the local church.,5
9747,"At the river, we sat and waited.",5
9755,"He wasn't the only one hard at work, of course, as Johnathon was engrossed in his career before him, readying himself for his own soon-to-be meeting.",3
9758,I so sleepy that bridge is nice.,0
9767,Her barbecue was a big hit.,5
9770,They went shopping yesterday for sunglasses.,2
9771,"Then devil eggs, or devild eggs if you want to try and make bad puns your costume.",2
9774,It was very quiet and no one else was around when we got to the building.,5
9779,Off guards are the best times to capture genuine beauty.,3
9781,But it is kind of lonely on the big farm without Duke here.,3
9783,The metro inside made us confused.,0
9785,My friends and I decided we should attend the rally this week.,5
9798,First we'll plan our trip.,5
9805,The end of the day they met at the end of the trail.,2
9807,These are a few of my weekend pictures that I sent to my parents.,3
9809,There were many buildings on the seashore.,0
9811,The aliens tried to decipher the graffiti on the buildings as though it was a local language.,4
9816,The quarter back was starting to hup the ball.,9
9827,Lets have a parade for graduates for some reason.,0
9832,"I was sitting between these two ladies, then suddenly, I disappeared!",5
9833,It was finally time for the fair.,9
9840,Starting out was tough due to a steep incline included as part of an endurance check.,3
9842,Papa smurf became fully engulfed in flames.,5
9844,I had a wonderful teacher who was special as making friends,3
9846,They should have stuck with a math game because it's hard to do an impression of smythe if you don't know what it means.,2
9851,It was a daily struggle for the citizens to breathe.,0
9854,The mural featuring a snack brings contrast to the room.,0
9862,I really enjoy to travel this way.,9
9869,Supporting spectators lined up near the runners and kept cool with manual fans.,0
9890,His mom was so proud of him.,0
9902,The hotel is located in a prime area for sightseeing.,0
9905,The band is ready to rock and roll.,0
9907,It is good to eat in jumbalya.,2
9908,"Their son, Jon, expressed his gratitude.",0
9914,My friend I met that day at the concert stage.,2
9922,My friends posed their children on the inside of the machine.,2
9936,we saw some old buildings,1
9937,The flowers lain all around his mother's grave were a bright contrast to the sadness he felt.,5
9940,I also enjoyed the old advertisements they had on display.,9
9946,The dog was ready to go.,0
9947,At least there's no wind piling up sand along the fence.,3
9965,My little sister is grandma's favorite.,2
9970,The couple laid casually between the beautiful field.,4
9980,This gentleman came in first.,4
9992,This builiding looks like its closed.,5
9994,Night time is the best time for an office party.,5
9996,They have a big house with a big backyard.,5
10002,There's nothing we love more than to have a friend get together.,5
10007,this is a catapiller,3
10014,People come from all over the country to see and travel this gargantuan of  dam.,3
10016,"At sunrise, we visited this farm.",5
10018,"Even though I was a bit fearful, it looked fun.",4
10022,"The band comes together to practice,",5
10026,The skirts were a pretty neon.,5
10027,THE ARE ALSO SOME DOING,4
10028,Camped at this site on Sunday.,2
10031,She won a spot on the choir.,3
10036,The dog was ready to go.,0
10037,He hopped onto the dance floor as the excited crowd accepted him gladly.,0
10038,The retreat was phenomenal fun filled with lots of activities for everyone.,5
10043,He had a great time on the hike.,0
10044,Some of the sayings on the shirt are funny some are more serious.,5
10046,Meetings are held at the local park,4
10048,We ran into a horse mask while walking under the lights.,0
10050,I wasn't the only one to stop and stare at the architecture.,5
10051,I can honestly say they are both smart and the cutest couple.,5
10062,"And then comes the The moment everyone's been waiting for, the Bokay toss.",3
10063,"He enjoyed the older buildings,marvelingat how architecture had changed over the decades.",2
10067,There once was a young girl who lived many years ago.,5
10075,"The sun was risingand yet, no one had been caught.",3
10079,They had fun being silly and cute,3
10086,The dog was ready to go.,0
10088,IT IS A BLACK STONE,4
10112,IT IS A BLANK,4
10118,Next they all got food and cake at the buffet.,5
10124,This week they spent time getting ready for the halloween costume party,5
10125,"I had my eyes on the countryside, with the coming of spring.",1
10128,The project was really cool.,0
10130,And gather on the couch while having some drinks.,5
10135,saw some people on a nice hill framed by the sun,3
10146,The ladies favorite item were the grapes.,0
10154,"Katie rode the bumper cars, which were painted with flowers and looked like original Volkswagon beatles.",9
10163,"His baby brother was happy, too.",0
10170,We saw a cute cat sitting on a window sill.,4
10175,"Once night came, the fireworks started.",5
10178,Many friends gathered to see the beautiful union.,2
10179,every day i see to my sons go to the school,0
10186,The players went on the field in formation.,5
10192,"Jonathon was silen when he was handed his papers, as it meant so much to him that it was now official!",3
10208,His mom was so proud of him.,0
10228,The people in charge of the fireworks never disappoint with the fireworks show.,2
10229,St. James watches over the pulpit day and night.,3
10234,The invitations are something I will save forever.,5
10237,This one took 2 years to finsh.,0
10241,I want cake now!,4
10246,Halfway on the trip I met this awesome male.,5
10256,In celebration of the Olympic event the hotel had specials for this holidays.,9
10260,It is time to watch the guy prepare dinner.,9
10268,We went to a restaurant Bill and John had a hamburger competition.,3
10273,My sister ans I hung out in the kitchen,3
10296,Sharing the wedding cake is always the best party and this couple was excited to get down to business.,8
10297,"Shortly after 1pm, a fight broke out.",2
10299,The music was lively and included folk tunes.,0
10304,He would not let go with the boy and keep dreaming this is his own son.,4
10305,IT IS A SNOW,4
10315,he then goes outside and sits with his parents on the back porch.,0
10316,The parade was ready to start.,0
10324,His mom was so proud of him.,0
10328,THEY PLAY THE SONG,4
10334,My mom enjoys cooking.,0
10338,The girls called were so honored to be picked for a very selective award.,2
10349,He had the attention of the entire room,5
10360,Christine ran over and surprised Josh!,5
10373,He decided it didn't matter because he could do both and it would be kosher.,2
10380,Maybe I'll take a swim under this one.,3
10389,I really hate my cheesy smile here.,3
10390,I took some pictures of the front and it seemed to me the place was dirty enough to need some help.,9
10391,It was pictures of people she had met throughout her life.,9
10395,But their favorite terrain is of course the glorious mountains of home.,8
10397,"As the dinner event started, Bill made sure to get a shot of the table setting before anyone moved a thing.",0
10414,IT IS A STATUE,4
10418,I have always lived in Canada.,2
10422,"While we toured, I got to snap some pictures of our time out here.",5
10433,Roller coasters were the most popular activity.,5
10439,Going to the market we passed a pet store and decided to go inside.,9
10454,At the beach there were telescopes to see the mountains on the other side.,0
10455,"Last weekend, we visited a local television station.",0
10460,He loved the snow.,5
10463,This guy looked like he tripped as he dove in,2
10464,The bikes were all lined up along the pond because it was such a beautiful day outside.,0
10465,So many kids were experiencing the wonder of flight for the first time.,0
10466,Then some ugly guy gave a boring impromptu speech.,0
10475,"Seated in a water craft with their parental units, the two children begin to enjoy the experience.",9
10476,First stop for the walking tour is the central square statue.,0
10480,The vastness of the ocean was fascinating.,0
10483,Here you will find lots of really good fun activities,3
10491,The original plan was to plant in the outdoor setting,3
10493,"Even though Becca and I had picked our favorites, the photo she took of the tower is the one that earned her photographer of the year.",2
10496,Here are photoes of dad and his friends,3
10497,My team posed for a photo that Dad snaped.,0
10508,I thought we raised him better than that!,3
10512,there was plenty of walking distance from the parking spots.,5
10513,The clock tower stood tall with a flag representing the nation.,5
10515,"She returns to her home and finds a note from her daughters saying, ""Remember the show is at 8:00 PM.""",9
10516,The kids were enjoying playing in the bounce houses.,5
10521,People stand and applaud the band after their performance,0
10523,We made it from the middle of the forest to the factory.,5
10532,The resort will have to have fantastic view.,3
10535,Follow the example of female politicians.,0
10541,The road will take you to a building with many windows.,5
10562,There was even a gigantic chess set laid out on the lawn for entertainment.,2
10577,"We went to the cemetery, were there are a lot of tombstones.",0
10589,"Step four - when no one is looking, make your move!",5
10592,Christmas lights brighten the night sky.,0
10593,spend a fun time with computers,0
10600,Harvesting isn't so bad and is usually a family event but this year our son decided to be lazy relax by the sea.,2
10602,We had a 40th cake for him.,0
10604,The red colors contrast with the yellow colors.,0
10606,The party lasted late into the night,4
10610,My favorite costumes were the star wars themed costumes.,9
10614,They took so many funny pictures!,3
10617,When we got closer we noticed there was a whole family of ducks.,9
10623,"First, we do some preflight checks before getting it in the air.",2
10625,My boyfriend and I hit the pool to relax.,5
10626,I went to local fair,3
10627,There were many nice people there.,4
10632,We clapped as the trombones passed with all the musicians.,0
10633,It is starting to get late.,0
10641,"Its kind of cold outside, but whatever.",0
10643,The bird landed on an empty dock surrounded by nothing but water and trees.,0
10648,They all gathered to open gifts.,0
10656,He had a great time on the hike.,0
10657,We visited these beautiful mosques.,4
10666,this candle is making cool shapes,9
10667,The battle is over and Mini Mouse sings about how relieved she is that all her friends are okay.,3
10669,A figure of Yoda sat above the door greeting participants as they filed in.,0
10687,People were dancing to the music.,5
10689,They paid their admission and stared in awe at the size of the tower.,4
10694,It's peaceful to travel this way.,0
10701,"After our performance, maintenance cleaned the snow dust off the field.",5
10711,The dog was ready to go.,0
10722,We took an interesting tour around the ruins.,5
10729,Reaching the grocery store he bought the necessities.,5
10730,The waterfalls along the way were absolutely breathtaking.,5
10731,An artificial cow looks on with it's nose covered in a mask.,4
10745,The treasure was the hidden art found in an open field.,0
10747,"Aw, you did not have to buy me anything!",5
10750,They only ever visited to see pictures of my work in the gallery.,0
10753,"We were kind of an unruly bunch,.",2
10755,We couldn't wait to go!,0
10757,The dog was ready to go.,0
10769,THE MAN WAS SMILE,4
10772,"First, Donald and Daisy Duck skated around.",0
10782,Had some extra time so i took a seat.,3
10783,Such a long trip had taken a lot of planning.,4
10794,He went inside and brought his friend some toilet paper.,4
10801,Sadly it fades away and you start all over with a loud and smokey morning.,5
10812,The people who weren't in the race walked to the sidelines.,3
10827,Everyone is Irish and everyone loves a parade on St. Patrick's Day.,0
10835,The party also had a great game of volleyball.,9
10837,The students took the computers everywhere.,2
10839,The cars were tricked out in a variety of styles.,0
10841,We attended a breast cancer awareness fundraiser.,5
10847,The bride talks to bridesmaids.,2
10849,The woman studied the map for her trip.,0
10851,what a great day  over all with the family  Happy Birthday  Mom,3
10867,THE MAN AND GIRL IS THE KISSING,4
10880,I have been looking forward to this concert all year.,2
10894,"Ferry boat, on the waves.",3
10898,a art made by the students,3
10899,HE WAS ALITTLE NERVOUS BUT IT WENT WELL,3
10903,I took out all the ingredients and things that I needed and started mixing up a dough.,3
10910,I know it was an accident.,0
10911,And at the end the Easter panda gave all the kids hugs before they left.,4
10918,IT IS A CYCLE,4
10922,They also visited old roadsters.,0
10923,We all love the fresh smell of nature while camping.,5
10928,We continued to bike to our next location.,3
10929,The devil was attending the slasher party too!,2
10952,"Another raft, with more people on it, was then seen.",1
10962,"At night, we decided to go on a date.",0
10963,IT IS A STONE,4
10968,It was owned by a large family who cared for it.,0
10979,THE YELLOW COLOUR PICTURE,4
10985,Along the way we stopped at the Grand Canyon,9
10988,His mom was so proud of him.,0
10989,THE SINGER WAS ALSO REALLY GOOD,3
10991,but then a break in the waves gives calm waters,2
10992,They were weathered by the ocean's coast,0
10998,"Once the party was over, the new couple left to get ready for their honeymoon and new home.",0
11001,She took a picture with her boyfriend.,0
11002,Even though he wasn't old enough to tell them how terrible olives are on pizza.,5
11003,IT IS A DOG,4
11005,Afterwards his family gathered for a party.,9
11011,"Lights were strewn in the trees, ready for the coming party.",0
11014,THE TAKE GROUP PHOTO,4
11015,The dog was ready to go.,0
11017,And was very happy to be in the field.,0
11019,"Afterwards, he found a bench and rested.",4
11029,The miniature train set had several trains that ran through a trainyard and a town.,9
11038,Through determination and inspiration I made my jump!,5
11041,IT IS A SNOW,4
11052,"But in the city, the birds cover everything.",2
11054,The war with the nation was managed over time.,0
11059,Two recruiters waited for their next interview.,0
11061,His mom was so proud of him.,0
11069,For our safety the trails were closed.,5
11070,But this kid was happy for his zoo birthday party.,5
11082,The military held an awards ceremony.,5
11089,she had a jumping fun,0
11094,A woman is celebrating here birthday at dinner.,9
11107,The fresh mountain air allowed many things to thrive .,8
11116,Even her husband had a great time.,9
11121,We spent alot of time in the pool to relax.,5
11125,We started her journey by finding seed spilled on the sofa.,4
11128,Our vacation started off with this awesome front store view.,5
11133,The couple smiled when his speech was over.,0
11134,They can also be used to help flavor deserts.,9
11136,"As the speakers werent working, th elead had to give out the keynote loudly so every one can hear.",3
11143,I'd do a tremendous amount of work until it grew into the most luscious garden.,4
11144,Search for all types of treasure in this simple land.,0
11146,IT IS A YELLOW MAN,4
11148,We then took pictures of other people who were on the boat with us,5
11151,They both put their personal touches on them.,2
11153,Symbolic offerings for a fruitful marrriage.,4
11154,the kids watched excitedly as the colder coolers appeared,3
11165,Someone on the train turns on a radio for everyone to hear.,3
11166,"Oh no, the opposing team is tailgating right next to us!",5
11168,There is a small town with a lighthouse,0
11174,Jodie loves the back yard.,5
11175,THE ARE IN MEETING,4
11176,We left nothing on our plates and the desert did not dissapoint.,9
11178,The food I ate was just as awesome as the buildings I saw.,4
11180,And was very happy to be in the field.,0
11191,Debra thought how could anyone not want these hideous pink blazers?,4
11200,"Mom dances with her son,",4
11202,Can you believe these awesome lights they have for the music?,2
