,output.sentences,education
15358,"My friends and I got together to study, but it turned into more of a party.",9
15359,This was the most powerful and beautiful song I have ever heard,5
15361,A special band plays in honor of him.,4
15369,THE MAN TAKE PHOTO,4
15370,THEY TAKE A SELFIE,4
15376,The gentleman on the right tried to hide his pizza from the camera.,9
15378,I enjoy going to the library.,2
15381,The morning sun begins to creep over mountains.,5
15385,IT IS A TREE,4
15389,EVERYONE IS HAVE A GOOD TIME KAYAKING DOWN THERIVER,2
15404,A lot of the kids had very unique costumes.,3
15406,His mom was so proud of him.,0
15407,The older citizens spent time together and reflected on the good times.,0
15412,The dog was ready to go.,0
15414,It is stressful when a lot of people are coming at the same time.,9
15415,IT IS SO BEAUTIFUL,4
15418,One of my friends accompanied me.,5
15422,IT IS A SKY,4
15423,THEY RUN THE ROAD,4
15428,They threw their hands in the air.,0
15433,lets kill the children for meat.,5
15438,Birds circle as the sun begins to wane.,0
15439,A man was on vacation.,5
15441,WHEN STORES WERE ALL LITTLE TABLES WITH TENTS AND A SHABBY MERCHANT BEHIND IT,5
15442,On the other side of the bridge the cattle graze in the fields of this farm.,5
15452,She's a really cute chick!,3
15453,The goat was outside.,5
15454,Here's a picture of me almost to the finish line.,3
15457,The mom shows her love by touching the baby's heels,5
15458,He had a great time on the hike.,0
15464,I relaxed while watching the horses graze.,5
15467,The head of the organization gave a welcome speech,0
15468,His mom was so proud of him.,0
15474,The dog was ready to go.,0
15487,The peace didn't last long once people started gathering.,2
15488,We spent the day exploring the city and admiring the historical buildings.,0
15501,"It was a long race, and we were relieved to reach the finish line.",0
15504,I took a picture of this tree with this growth on it.,0
15505,She shows her bestfriend her new tricycle.,3
15512,I visited the sites near by.,0
15522,The party was enjoyed by our friends and family.,5
15523,All the food turned out delicious and we had a great time.,0
15527,"You meet interesting people at job fairs, although they can be stressful too.",9
15529,He then comes upon a spaceship like building or object.,2
15549,Dessert was very interesting.,5
15552,We did lots of stuff in the pool.,0
15562,They spent days at the beach and exploring the pier.,5
15567,The water began to rise after the rain.,5
15569,It must be light snow it did not stay on the trees.,9
15577,He posed for a picture in front of a cross.,0
15582,It was a beautiful day for him.,0
15589,All shapes and sizes of dogs compete in the dog show.,9
15594,We spent a lot of time practicing and hours of hard work.,3
15602,Clair loves taking the bus rather than driving so she can look out the window and discover new things.,5
15606,She believed everyone in the world should visit this location and the white building with the tall tower was her favorite.,4
15609,They felt like a sad couple they had seen in a film.,9
15613,And was very happy to be in the field.,0
15625,Let's go take a look.,3
15629,Myself and my friends went to the fireworks during july month.,7
15636,The Indians teamates have a lot of fun together.,2
15640,and enjoying the time with their friends,5
15643,First Christmas as college students!,4
15644,Along the way she came across a falconer boy with a new baby Falcon,5
15645,It's a great piece of property to spend a warm spring day.,8
15648,The party was at night with pretty lights.,5
15650,IT IS A SUPER PLACE,4
15665,We left the Lorraine Motel.,4
15685,I am always so excited to visit ruins.,4
15686,They had many tools on display.,4
15692,Let's lay some petals on the grave.,3
15708,It was nice to relax.,5
15713,"Vegetables chopped up well, will go good with the herbs.",5
15714,End the night with the last dance.,2
15716,I could see the great architechure from a distance and wanted to get closer to this beautiful building.,0
15720,"Janet, a foster mother, decided to take here foster children to an amusement park.",4
15730,The buses run with flags in the windows.,0
15731,A family arrived for a wedding.,0
15736,"oh yes, a quick wedding.",9
15741,Parker did nothing but try to woo random girls.,3
15752,The crowd was excited.,0
15753,"We saw nothing living, and yet the air seemed to pulse with energy.",9
15757,He had a great time on the hike.,0
15758,Even the uptight host of the show ended up having a good time.,0
15783,The people of our small town held a meeting about a new punk that moved into our neighborhood.,0
15784,"One of the girls lips got dry from the drinks, so she used Todd's face to moisten them.",2
15786,The signs cautioned the driver to slow down near this building.,9
15787,We got to pick the kind of beer we had.,0
15788,At the gift shop we found clothes that we liked and bought them.,0
15790,Even t-shirts with the teams catch phrases were a big hit.,0
15801,These were used for religious purposes.,0
15802,The school's mascot was in the rear of the parade.,0
15807,The trail follows the railroad tracks.,5
15813,He had a great time on the hike.,0
15814,While mom is busy at work lets check in on daddy,0
15821,I stopped and picked up a property map so I knew where to go,0
15828,"The pool opened early,and we had a blast",2
15830,It took several hours in total.,9
15847,"The view from the street was excellent, littered with cool buildings.",9
15856,Two children hold balloons and wait for their mom to return.,0
15857,We were successful in hitting the second ball to dislodge the first ball.,9
15859,We took a look at propaganda posters.,0
15861,"Then they go to visit some more animals, starting with the giraffes.",3
15868,Other people did as well.,5
15871,The restaurant had a nice view of the lake.,4
15884,"It  was such a good choice, the waves and the rocks and the sky were all so beautiful!",9
15886,"While escaping from work for a few brief moments, he waits for the perfect moment to cross the street.",5
15892,Tanner is visiting a model train convention.,5
15894,then sara and james arrived,2
15895,They finally let the fire die down.,9
15901,The place was better than any hotel I'd ever been to with beautiful scenery which included some unique plants.,2
15904,Next to the trees and the sherbet shop there stands regal looking building.,0
15905,"My first lunch there, I saw the lake had several ducks about to land.",3
15922,There was so much to see and do.,0
15932,We visit the sheep pen and they're all up and about.,3
15938,The journey was beautiful.,5
15939,It was graduation day at Osan American High School.,4
15944,Inside the kids were sitting around the table talking.,4
15948,IT IS A FATHER AND CHILD,4
15951,"Richard didn't care, as he was just there for the food.",0
15954,This gallery installation lacks the female form because it's a religious statue of the disciples.,0
15962,The couple enjoyed a light breakfast as they watched the surf.,4
15964,The highlight of the visit to the castle was to sit upon the throne of the king.,4
15968,"Green and yellow, like so many linked Sprite cans.",0
15970,I love mountain climbing and being out doors,3
15971,THE GIRL WAS SMILE,4
15972,From water ambulances to do it yourself moving companies.,2
15976,"They decided after 60 years together, they were going to get married again!",3
15979,"Two women, who had recently joined his friend group, invited their own friends along, much to Jason's dismay.",5
15980,Suprisingly we were all able to perform the sport well!,2
15986,IT IS A FAMILY,4
15987,IT IS A RIVER,4
15988,The water called to me so I moved out onto the front porch.,0
15998,I love an outdoor concert!,3
16003,I looked out the window that morning hoping that a good view of the city would brighten my day.,2
16022,There are tons of wildlife on the sides of the road for the people to observe as they run.,9
16024,A close up shows the circles.,0
16025,My sister was in the kitchen tasting the cake that was at the party when I was married,3
16027,TWO MANS STANDING UNDER THE TREE,4
16031,IT IS A MAN,4
16032,"But there was the ocean, and it was not crowded, and the water was so blue.",3
16037,I loved the lady who played the guitar.,0
16038,Lets have a toast before you get married!,5
16044,Sheet music was pulled out and placed on the stands.,2
16046,It included all types of ghoulish delights.,0
16047,The Children really enjoyed this ride.,0
16053,"""Okay everyone, it is time for the reception to to end, and everyone say Goodbye to the honeymoon bound couple.""",3
16054,THE MAN WAS STAND,4
16063,"It was dry, taking and reading stuff.",0
16071,The dog was ready to go.,0
16075,Many people took their boats out on this clear day.,5
16079,Afterwords he went to a park to reflect on his day by looking at public art.,0
16082,IT IS A HOLLYWOOD,4
16095,SWMING IN THE WATER,4
16100,Kids played games at the event.,5
16131,A lot of people were going to give presentations about their writing.,0
16135,Joel was shy around animals so his parents bought him a dog.,4
16153,We made cookies last night.,0
16154,She finally wakes up and runs home.,9
16159,SHE IS A BEAUTIES,4
16162,The panda was the clearly the most popular thing at the event proven by all the kids that gave it a hug.,2
16168,It was the little boy's birthday.,0
16171,Royalty probably has visited this local castle many times.,0
16175,The rear of the band was the school mascot.,0
16178,The wooden stations are set up so you can see more than one person at oncve.,9
16182,The finale was so exciting with so many colors.,9
16191,Her favorite picture was of the treeline in her backyard because if offered such great contrast.,2
16197,He's grumpy to this whole thing.,5
16203,Last but not least I found this picture of an unnamed cat which I'm sure never belonged to me.,2
16206,"As the whistles sounded off, dozens of bikers began, peddling with all their might.",3
16209,We could see a steeple on a hill.,2
16218,THE TAKE GROUP PHOTO,4
16220,"On special days, they even take their computers to assemblies.",4
16222,The frisbee was still stuck on the roof.,4
16243,If you look closely you can see everything is stitched together.,0
16248,A pig approached him.,5
16250,They played on almost all the rides and had fun in the playground.,5
16254,Susie was happy for everyone.,5
16261,There were people of all races there.,5
16267,They were now all enjoying a calm ride on the local ferris wheel.,5
16278,This city is beautiful in the winter.,2
16284,So was the groom's brother.,2
16286,"Off in the distance, the mountains looked majestic.",2
16291,The location of this building is downtown.,5
16295,The baby kicks the ball on the field.,9
16300,Families gathered around to to watch in kite carts.,5
16307,Finally got back to the bodega where I met up with my neice and her favorite adopted child for a wonderful cat dinner.,0
16308,Error loading image. Sculptures don't reveal enough emotion.,2
16312,We found a restaurant that serves fresh pizza,0
16314,Don't fall off the pier now!,3
16322,"Cindy, sporting a tiara, came with her boyfriend, Steven, also.",0
16327,He had a great time on the hike.,0
16342,Then we went inside and it was even more scary.,1
16343,THE TOWN IS VERY QUIET,3
16346,The buses run with flags in the windows today.,5
16348,"Then, the grandmother of Samantha also surprised her with a visit!",3
16349,The concert was finally starting.,5
16351,I watched TV on the comfy sofa.,1
16355,We got closer and saw it was still occupied.,4
16367,This kid just brought some glasses from New Years Eve for no reason.,8
16377,On Saturday morning people walked along the street marveling at the cars that were lined up,1
16383,Then I climbed up an even taller hill,0
16405,I stopped at the store to warm up with hot chocolate.,9
16406,Lastly they say the reefs and the fish that live inside them.,0
16407,The long awaited race just started,9
16415,"In WA state, the shop wasn't open yet for the SA.",4
16416,IT IS COLOURFUL GIFTS,4
16423,St. Jermaine is hidden in the back.,3
16426,The dog was ready to go.,0
16430,Yu Yan   told Sean that they should take him to the theater tonight to see his favorite band playing.,3
16434,She did not know the language of the town she was in.,0
16436,"Full of stuffing and cranberry sauce, the whirling commenced.",0
16444,We all waited as we watched our team with friends sitting on the bleachers.,5
16455,This was the view from the top of the hill.,0
16459,Overall they are all so bright.,5
16466,THE CAR WAS ACCCIDENT,4
16474,The follow up act is rehearsing their performance,5
16476,IT IS A LAND,4
16483,The cucumber salad was really good.,0
16487,I guess I've got time to run over to the store.,3
16490,We caught some lunch in a nice tavern.,4
16502,The photographer was taking portraits of couples with different racial backgrounds.,4
16504,"For my mother's birthday, I set up a photo booth with strange props including this puppet.",4
16506,Now that the party is over I hope the couple enjoy a long and happy life together.,2
16508,this is one of my proudest achievements.,0
16509,A lady was talking to my uncle and a male coworker at the grill.,5
16510,THE TAKE GROUP PHOTO,4
16522,The preacher then begins the regular church service.,4
16534,We were warming up before starting the game.,0
16546,"Getting up early for the race, we got there before sunrise.",5
16548,On the street we saw what was the start of the annual parade.,3
16553,"It was a long trip and a long entourage, sometimes the camels and the travelers had to stop.",9
16554,Everyone was so festive and happy to celebrate together.,4
16556,The game was very exciting.,5
16561,A man talks into a microphone.,0
16569,"He was taking a trip into town, he wanted his hair to be in shape.",9
16581,Jonah hated getting ready in the morning.,3
16582,"Their discussion was calm but passionate and their opinions were displayed, without offending one another, coming to a final agreement.",0
16583,We are enjoying a healthy and delicious dinner together.,2
16591,The police were called because the housewarming party became too crazy.,5
16592,The dog was ready to go.,0
16594,THE MAN WAS SMILE,4
16602,It's Halloween and we are having a family oriented party!,2
16604,The view isn't the great but at least I'm here.,0
16605,IT IS A BLACK AND WHITE IMAGE,4
16610,"When they made it to their destination, they were finally able to eat dinner,",9
16620,He had a great time on the hike.,0
16624,This place is for family fun for all families.,0
16625,The ticket seller loaded the cash box so she could make change for the fans who bought tickets when they arrived.,4
16633,I like the bunny banner,5
16639,I love satellite tv.,9
16649,"The shadows were lengthening by the hour as we at last entered the street that went past the still lovely flowering bushes, the one that would lead us to our gate and home.",9
16655,They are very busy people.,0
16656,After eating we went down to the water where I pulled back my hair to get some sun on my forehead.,3
16657,Bride and groom waited to take pictures afterward so they sat and kissed.,5
16676,She liked to have fun with her designs and make weird ones.,2
16678,I have no words,9
16682,During my trip i visited a criminal organization.,0
16689,The whole event was fun fast entertainment!,9
16693,"When a member of the community dies, it is felt by everyone.",2
16698,We visited his memorial grave.,9
16699,Giles wanted to hang out and smoke at the park and asked his friend to bring the beer.,9
16703,There will also be a museum featuring old local artifacts from the days of knights,3
16712,My husband's favorite thing to see at the museum were the planes outdoors.,2
16716,The wedding cake was tasty.,5
16725,"He ran with the kids in  the math class that he teaches, though it was really hard",5
16728,Hailey bought her mouth-watering shrimp casserole and made Zoe and me go mmmm.,9
16729,The people admire the cars that they see.,3
16730,The town has many talented students.,5
16736,THEY SAVE THE BLACK MANS,4
16737,That day they also guarded the hot air balloons.,0
16740,He had a great time on the hike.,0
16741,The Ferris wheel glows in the night sky.,0
16747,The romantic couple poses for pictures.,0
16753,ONE COUPLE TAKE A VERY BAD SELFIE,4
16758,"First, he started with some homemade cake frosting.",4
16763,The couple enjoyed visiting with the president.,0
16764,we went on a bridge,7
16765,I found this homemade recipe and I am ready to attempt it.,9
16767,This was the best time of day to go in the hot air balloon.,9
16770,Besides trees the sights in a forest come in a plethora of shapes.,0
16780,The people races for the mud day.,8
16786,THE FRIENDS ARE COME TO THIS RESTOURANT,4
16787,But sometimes parties end up out of control and someone ends up in a jello mold.,2
16791,IT IS A GREEN COLOR,4
16793,It's always a special night when my fireworks show goes off as intended.,4
16794,The guys were watching the football game.,4
16795,THE TAKE GROUP PHOTO,4
16797,He took a beautiful pictures during the trip.,8
16799,Everyone lined up for the big event.,5
16803,The only proof that I have that it happened at all are these marks on my hands. No one believes me and now my friends call me a conspiracy theorist.,5
16806,these are pepole posing,3
16808,This wonderful organization leaves happy faces.,0
16814,The dog was ready to go.,0
16815,He continued to wait for the police,0
16818,A happy couple commemorate the moment with happy smiles.,5
16826,He enjoyed how they captured the places he knew in real life.,0
16828,"This is the best site to see, as I love snow.",5
16835,The houses docked for fishing boats.,0
16838,The first question came from someone in the first row.,2
16845,"The graphic is of a box, that encompasses a x, so it can be univesally understood.",9
16856,A girl had collected some eggs on the hunt.,0
16864,I enjoyed seeing everyone enjoy their favorite players.,2
16882,The lookout is at a perfect location and the view is incredible.,9
16886,IT IS A BUILDING,4
16890,The skyline was beautiful.,0
16893,Aiden was very proud of his new bike.,0
16900,I'd been told there would be fireworks not far from it and I was excited to see them.,5
16904,"After the speech passed, the military men were given their awards.",5
16917,We were walking down the street in front of the stores late at night.,5
16931,Maybe it it would be better if I went somewhere else.,5
16932,The boy finally arrived at the park with his mom after a long drive.,2
16936,he took a picture with school girls,3
16945,IT IS A ROAD,4
16948,It was a fun sunny day for everyone.,0
16951,The priests discussed the items included in the adgenda.,0
16954,Becky went over to Cindy's house for a Single Ladies Valentines Day Party.,0
16955,It looked beautiful on the bridge.,5
16956,My family loved playing on it during cookouts.,5
16959,The bride and groom had their first dance.,0
16962,The sky showed light bursts of flashes.,9
16970,Red Hollywood signs light up the whole street.,3
16988,He drove his smartcar and parked on the sidewalk.,0
16993,IT IS A SMALL FISH,4
16994,ONE GIRLS OF LAST RUNING,4
16996,Later they went swimming in the pool to be cooled off.,5
16998,We got to see some steamboats as they passed.,5
16999,IT IS A BUILDING,4
17000,Happy couple taking a photo.,2
17004,The sun suddenly was blocked with no light coming through the stained glass window.,0
17005,Some pictures were hard to capture though.,0
17008,His mom was so proud of him.,0
17026,We bought more tomatoes than we expected.,0
17034,The married couple are now sharing their wedding cake.,0
17048,His collection was large and growing.,0
17050,The slide looked fun.,5
17051,"Or it could be based on a plan for a real house, that too could be submitted.",9
17057,They called the first speaker.,4
17064,Some of the mushrooms were cute.,2
17065,IT IS ALSO A FOOD,4
17071,IT IS A LONG ROW OF WINDOWS,4
17073,To finish the great day we all went for ice cream Sundays.,9
17076,Halfway through the trip met a male.,9
17085,He loved to play and played very well.,0
17090,These particular church goers like to see white Jesus dressed like an Arab man.,3
17097,IT IS A COLOURFUL LIGHTS,4
17098,The group of people ran a race near the mountains,5
17101,THE BABY WAS SOME DOING,4
17105,at last it was my turn to graduate,0
17107,Today was a nice day to play a game of lawn darts.,9
17115,The view of this waterfall from above is amazing.,4
17136,"fifty years ago, television antennas would have been perched on the roofs.",2
17138,"Everyone danced and partied until after midnight, maybe a little too much.",5
17140,I'm going to sneak up on her after going to the bathroom.,3
17155,We heard that the wedding cake that would be served was white.,0
17156,This is the first version of sonar.,0
17172,And was very happy to be in the field.,0
17173,"To top it off , we had the perfect cake.",5
17182,"It had a simply, single piece design at the front of the restaurant.",4
17185,The lonely little car was inspired by the black car's victory to keep racing and win his own trophy someday.,4
17194,"He strummed his guitar for hours and hours, never tiring.",5
17197,The decorations were nice,5
17207,The fans love the game and show this by showing the game spirit.,3
17228,His mom was so proud of him.,0
17232,And was very happy to be in the field.,0
17244,"The is the life, the beach is the perfect way to end the day.",0
17253,"Julia was over the moon, when it was time to throw the bouquet.",0
17256,They lit up the sky so much that you could see the bridge.,5
17270,Robin gladly obliged all who asked for her to take their pictures.,0
17273,I took the train home.,5
17274,Next we passed some bison!,5
17276,Many world leaders were gathered to represent their respective countries at such an important summit.,2
17285,next we walked through the park to find violet flowers,5
17295,the three ladies were not impressed reading this letter.,2
17296,They are fascinating with snooping and searching.,5
17300,The front of the building has some interesting architecture.,9
17314,The kids spent the day at Grandma's house.,8
17326,Jill always rememberd that day when she missed her mother.,5
17340,I started my diet and prepared a healthy meal.,2
17342,A man was sitting in a recliner in the water without a worry in his head about if the chair would stay put.,0
17344,"Shoestring fires, my favorite!",2
17346,I had a nice time visiting the traditional Japanese temple.,2
17352,They will see see an interestingly designed building.,4
17353,I always bring my wife there as she is always so excited and waited to watch it all so patiently.,9
17358,We thyought it was very pretty.,0
17360,"Time for a nap, I'm exhausted.",2
17369,The dog was ready to go.,0
17370,Joe met Molly's mother and they all went out together to show Joe the town.,5
17376,We went or a hike and then found a spot on a hgh hill to have an afternoon picnic.,9
17377,these are pepole at the parade,3
17383,The pool was a big hit.,5
17384,THEY ARE WALKING IN THE ROAD,4
17386,"Wow,what an amazing image.Great way to end the show.",2
17389,"Now, the bikers are close to the finish, victory is in sight.",3
17393,"Within the ruins, you could find hidden gems like this.",0
17400,The sign was there to alert all passers to leave nature's beauty alone and we decided to respect it.,9
17405,It learned how to tell time using a sundial.,0
17406,after thanking the players they lstener to the audience,4
17413,It was the fourth of July.,0
17418,His mom was so proud of him.,0
17425,Mom headed the event and planned the meal.,9
17427,"When my sister showed up in her gold bikini, it really started the party.",9
17432,He spoke his vows of love to her.,9
17444,"On my way to my friends Halloween party;love the scary,carved pumpkin at the door.",2
17447,SMILE THAT ALL MEMBERS,4
17448,Everyone was waiting for the boys to finish making the dinner.,0
17453,I play the ukele to make myself unique for some reason.,0
17454,"Long lines not being that fun, we decided to stop riding rides for a bit and enjoyed a snack instead.",2
17463,and two teenagers flirt and smoke in a room out of the way of the main event.,4
17473,The rat regards the city below the bluff.,0
17480,The bride and her guest.,4
17489,we watched a beautiful sunset by the monument while we were waiting.,9
17493,Some students are given honorary rewards as well.,0
17498,Some giant children had dropped peices of a whistle.,3
17501,TThere are only a few ingredients in this simple family dinner.,5
17505,The dancers were young girls that performed to the music.,9
17506,IT IS A SEA,4
17511,"Their family and friends supported their long, difficult journey to find love, reminding them to never give up.",4
17515,It was relaxing to be walking along the pretty scenery along the way.,2
17516,The ranking officers gave a speech.,4
17519,Who is this lady standing next to me?,0
17522,Next we take pictures of some people who are walking down the pathway,5
17529,"Repent all yee, the time of the X is at hand he will save you from nothing the X saves and sees all ha ha ha",3
17535,They go home afterward.,5
17539,It makes me want to set to work the hard ground like the best gardener around.,4
17540,I like to walk in the evening after the temp cools down.,9
17541,"A few minutes later, she drove past her closest neighbor's house.",2
17543,this particular journalist was really on the mans case,3
17544,The seagull flew to the other side of the park.,9
17551,IT IS A CLOBE,4
17558,An old playground stands still in the snow of winter each day.,0
17560,"On the other side of the shallow lake were mountains, first small ones, the larger ones off in the distance.",4
17575,I went to the market because I was so hangry.,5
17590,This couple is being filmed as part of a reality show.,0
17597,So many soldiers lost their lives to save ours.,5
17603,The photographs are so interesting to study. It really shows the era they were taken during.,4
17605,The entire building had a grimy delapidated look to it.,5
