,output.sentences,education
22138,It was a great night of shopping and fun!,5
22139,this version of the memoerial was way larger then i could have imagined,3
22141,The dog was ready to go.,0
22144,ALOT OF PEOPLE WERE AT THE MARKET,3
22146,He had a great time on the hike.,0
22156,Fortunately my friends and I were able to sit together,5
22158,And was very happy to be in the field.,0
22159,Later they all went to the granddaughters graduation.,2
22165,The shot is taken.,5
22169,"After they did eat, they were tired because it was the end of the day.",5
22176,Everyone was excited to finally be graduating,3
22186,Finally everyone started stuffing their faces.,0
22187,"By the night time though, I could sleep peacefully.",0
22190,He was cool about giving me an autograph and now I can chill with my friends before heading out.,2
22206,"This one is the same as the first, only a square with an X.",0
22208,THE TAKE GROUP PHOTO,4
22214,the view was beautiful,2
22215,The souvenirs were fun in the evening when they lit up.,9
22218,Today I bought my first classic car.,5
22221,not many people came to the beach today,3
22222,"This resembles a woman, a nude one but still a woman.",5
22246,The girl researched places to take her friend while out on a trip.,2
22248,TWO BOATS IN BEECH,4
22249,Dave started a campfire.,0
22251,Those who presented people with awards shared their stories with the crowd and recognized them for their successes.,0
22254,"We finally took a picture of the oldest man in the town, but it came out blurry.",4
22255,IT IS A HIGHEST BUILDING,4
22258,Overall it was a good time spent with friends.,5
22263,It started getting dark.,0
22265,I had an awesome adventure that day.,0
22269,Our vacation started with a fun bike ride.,0
22271,It was a perfect night.,3
22273,The little girl was having a great time as well in her high chair.,0
22278,The performers were patient as they waited to go marching onto the field.,4
22280,IT IS A GARDEN,4
22285,You could see alot of compassion on the streets.,5
22289,IT IS A STREET,4
22296,Luckily we didn't spend too much time standing around waiting on the park grounds.,2
22301,They werent expecting a fight.,4
22302,Todd knew he wanted to learn how to play the clarinet.,5
22314,"But one by new things are added, like table cloths.",4
22317,We will check if the wood has rotted.,5
22323,His mom was so proud of him.,0
22334,We rode all of the rides including the big rollercoaster.,5
22347,"All in all, it was a pretty epic day in the city.",4
22351,We got to read to her niece.,5
22352,THEN WE STOPPED AND VISITED A ART EXHIBIT THAT WAS A BIT ON THE STRANGER SIDE.,2
22353,Benji got the perfect piggy bank and we named it rainy.,5
22354,"Even Stella the Dog, who doesn't normally like guests, came out to visit.",0
22357,They watched the sunset at night.,9
22358,The race was very competetive.,5
22365,This room is bright and clean for the bride and groom.,5
22368,Jenna was a cheerleader.,2
22373,he finally caught up on reading,4
22375,Mom was happy to see me.,0
22376,Wang carves pumpkins for most of the day leading up to the contest.,2
22377,Everyone is celebrating and eating,3
22379,Look at all these people in serious debt.,0
22383,THE TAKE GROUP PHOTO,4
22391,We're getting set up at the camp site.,4
22393,Some of the gang ended up driving around until they finally found her car about two blocks away.,4
22394,He watched the sunset with his friends.,0
22396,death makes me like diabetes.,5
22401,Where we sat was warm and inviting which was a relief from the grey outside.,2
22403,we are loving the vacation,9
22404,They were going to enjoy the trails and took time to set up the tents.,9
22409,"In the gallery, the paintings were lovely.",0
22410,Now he has to wait for the next party.,9
22415,Every month there's some new fancy display at the convention.,9
22418,They told jokes about how old was,3
22419,There are many booths for venders.,2
22420,The image of the cliff from the seashore was breathtaking,0
22425,IT IS A HIGHEST BUILDING,4
22434,A glance to the left revealed a new view of the huge bridge.,0
22441,Tonight settles our bet as to which hockey team is the greatest.,9
22450,I wonder what all they they make with this,5
22452,It really was a silly wedding where we drank a lot.,4
22462,Some of the buildings were awesome.,5
22467,We passed several small town with few people living there,4
22472,he was give pose with smile for camera,4
22474,THE BUNCH THE BOYS,4
22476,There were some people who just took pictures and didn't socialize.,0
22478,There were masks on two sisters that were very colorful.,0
22479,"Well, I guess that's the end.",3
22483,"And of course, they cut the cake together!",0
22484,"Occasionally you find something unique, like sunken boats that have washed up along the shore.",0
22487,My parents were watching from the tower in the park.,0
22492,Fred really enjoys the competition,1
22501,Finaly the fire was out and every one was saved but thee was still smoke coming from the burning home,3
22505,And was very happy to be in the field.,0
22506,"After taking some time to spend researching the best store, she decided.",5
22509,IT IS A STONE,4
22519,The cheerleaders got to watch the game too.,0
22520,Some of them even had a few beers -- or maybe more than a few.,0
22533,Before he left he gave a speech.,0
22534,Everyone seemed to be enjoying the reception and getting along great!,5
22536,I was brave enough to intrduce myself to him and he turned out to be cool,3
22539,The dog was ready to go.,0
22540,The news broadcasted the tragic news of a plane crash.,0
22541,"At the event, there were bands who performed songs for the crowd.",0
22543,"Recently, there was a party at the market.",5
22549,The trees were frozen when I looked out the window this morning.,0
22550,All the students assemble a group line.,3
22552,The front of the library was really cool.,5
22553,There was a large squad of people present.,9
22559,When I finally got home I greated my dear cow friend and went inside my castle to unwind from the long walk.,3
22561,We had a great experience.,5
22566,She looks to be partied out for the night.,9
22574,IT IS A SEA,4
22583,"Debby said ""Of, course!"". So she hopped on her bike, and went to Alice's house.",0
22589,The lamp attached to the wall was an interesting shape.,0
22590,The cobble streets are not good to wear heels on.,2
22602,The people had a good time with the wine.,0
22609,this is fake butterfly,3
22619,Up close we could also see ice and spiders webs.,5
22622,It was a beautiful day for him.,0
22627,"Sam & Linda were so happy with what they saw, they are now planning a second trip!",2
22642,His mom was so proud of him.,0
22656,I'm making a unique dessert tonight that has a lot of sweetness.,5
22679,The food at the inn was amazing.,0
22682,Being the optimist that he is my husband thinks he will keep the male undertones of the house.,2
22683,The sun went down over the city.,0
22686,Some sells stuffed animals as the sellers just sells pillows.,3
22687,He had a great time on the hike.,0
22688,We didn't stay in the casino very long and decided to visit the surrounding city.,0
22689,"A protester stands, with support from others, holding a sign that says violence.",3
22690,The wooden boxes turned out well.,4
22696,We had a good time on our trip.,0
22698,To celebrate Jim and his classmates took a picture.,0
22700,I loved seeing how great the items lookes.,2
22709,IT IS A COLOURFUL LIGHTS,4
22718,The red colors in the firework were breathtaking.,0
22725,We will eventually need to replace the microwave.,5
22726,Good times sitting and listening to Grandma.,3
22729,Today we visited Sleeping Beauty's Castle.,4
22734,The family had a wonderful time at the reception.,5
22735,I'm going to slip some tongue in.,0
22739,"After some organization, the man's lifelong dream of seeing a baseball game was about to come true.",0
22744,And was very happy to be in the field.,0
22751,It is now for the bride and groom to say their nuptials,0
22752,IT IS A YELLOW CHAIR,4
22758,His mom was so proud of him.,0
22765,I hoped to have time to also visit the museum because such places should be enjoyed on a trip.,3
22768,"After the set it down, every one was relieved by sufficiently out of breath.",0
22771,"As the bicyclists rode down the highway, they remained in a single line to voide accidents.",0
22775,We saw some lovely water flowing down the canal,0
22776,There were finally stories of food.,0
22779,I didn't understand the part about running with the bike,0
22781,The windows showed the group the emphasis on the Saints.,4
22795,We have to be extra careful when handling the fan.,5
22798,We had so much fun on all of the rides.,2
22803,The runners we're all at the starting line.,4
22805,This one is not as good as the others.,0
22807,The fires looked like they had been falling off a cliff.,0
22810,"Later, we decided to sit at the pool.",0
22812,"Yes, my cards are a really good buy for all your needs.",5
22814,I guess I'll go first.,0
22822,It was pretty hot at the concert.,1
22832,I went to the store for some deals.,0
22835,"When we arrived back at the hotel, there were other guests there with classic cars.",3
22836,His mom was so proud of him.,0
22837,"She continued to create new pieces, using the skills and patterns the had learned from all her old projects.",3
22844,The whole college class came out.,2
22854,My kids and their friends had fun.,5
22858,Her favorite ride was the super long slide.,5
22862,"In the afternoon, we toured the rolling hillside.",2
22863,No I don't think so it might be something else.,3
22870,"But regardless, the emptiness never leaves Jarvis' eyes. And there it will stay until his untimely death or incarceration.",2
22883,"At night, snowflakes, snow, and rain pummeled the streets.",4
22886,"While visiting local places, John took a pic of me standing outside of the Mormon visitors center.",3
22887,It was a beautiful day for him.,0
22888,The family went to a casual type restaurant for dinner.,2
22892,There was a themed pirate party.,0
22900,We ended up making lamb shapes.,0
22902,And was very happy to be in the field.,0
22914,I wondered what as in that tunnel,0
22917,"His sister then asked if she could see, and was surprised to hear he had gotten engaged!",0
22919,Outside we could see into the night sky.,0
22922,"Yearly town festival is today, the little girl's bike is ready for her and she is looking forward to meet her little boyfriend.",4
22923,The Rainbow Restaurant was open for business.,0
22926,Some locals were headed out to the comedy club.,5
22928,"Daddy Duck, a mallard with bright green feathers, stayed in front of the children, using his head as a beacon.",3
22929,There was fire amiss the field.,0
22936,It was a very nice day to spend together.,5
22937,The military regime is very organized.,9
22939,His mom was so proud of him.,0
22944,There were hardly any people on the beach at all.,4
22946,the grandmother picked the little girl up and let her view the boat.,3
22948,IT IS A RIVER,4
22949,They had created ugly sculptures in the past,3
22953,And was very happy to be in the field.,0
22978,IT IS A BEECH,4
22979,While hiking through the woods we enjoy the solitude.,5
22988,We found someone offering a ride around the harbor for a small fee.,4
22989,IT IS A FUNCTION,4
22990,Currently at an artist retreat.,0
22994,The musician was interacting with the audience,0
22998,The team fought for the ball and ran in for the score.,2
23004,"Swimming in the pool was the first requirement of the event, then we had to run several miles, on the street.",9
23018,We began exploring the local sites.,0
23022,We met some guys with star shaped cushions.,4
23025,He had a great time on the hike.,0
23026,This was a great festival.,0
23028,wow! look at that setup,9
23044,IT IS A RUNNING RICE,4
23047,Everyone was ready to eat.,9
23050,"It would be a long trek, but the guys all had smiles on their faces.",2
23055,"We couldn't get down, but found a way down to the ocean from a nearby hole.",0
23058,"Then we happened upon tiny, adorable, ceramic pots and I was determined to buy one of them.",0
23061,Jerry spent even less than that.,2
23068,This is uncle jack who makes all of the food from the festival every year.,5
23069,I took another selfie with some friends!,1
23070,The view from tent side looks like the crowd is coming together,5
23071,Some wear traditional garments or dresses.,0
23074,"Her lead dog, Malmomet, gave the vet a big kiss after he declared her fit to race.",0
23079,He had a great time on the hike.,0
23090,His mom was so proud of him.,0
23091,My Mom prepared a huge cake for the party.,6
23092,Thats my co-worker that looks like a special chicken.,5
23099,"Then it started to rain, and made a rainbow.",5
23105,We met the artisit face to face,5
23109,IT IS A GARDEN,4
23115,The seniors are running.,0
23120,Tons of people were running in this race.,9
23121,The drunk man crashed his red truck on a big tree.,4
23130,You can tell he takes good care of his car as Tim opens the hood to show off the engine before the race.,2
23148,"Some were tall, skinny and white",2
23183,His mom was so proud of him.,0
23188,This wheel looks very old an antique.,3
23192,IT IS A STREET,4
23204,He also needs to see if he can get his phone repaired.,9
23220,THE GIRL WAS SMILE,4
23221,Typically the wanted to see the Sphynx and a pyramid but today the bird was the attraction.,4
23228,Our team did well in the tournament and played two different team.,0
23229,The girls were happy to graduate.,5
23230,Went on a trip to the country's capital.,2
23231,The kids dressed up for Halloween.,5
23234,She also saw dead plants and she went back to reading,4
23246,The man in black ran ahead of the pack.,0
23248,I looked at an old photo and was inspired to discover my family tree.,5
23253,Slyly a person from the organization snuck in a camera,3
23256,"However, the cold air makes it difficult for the baloons to lift off.",4
23259,IT IS A POND,4
23261,The two officials examined the ball.,0
23263,They both decided to hide from the rest of their friends.,0
23268,"He shook his head, getting his head back into the game and took his shot.",0
23272,They were taking proud photos.,5
23279,Then they had to leave and go to their own apartment.,9
23282,There's a  man walking through the market.,9
23289,Fixing cars is fun.,5
23290,The passengers passed through an interesting looking archway to see the garden beyond.,4
23308,Some are about equality.,4
23310,I ended my exploration on a happy note at a small petting zoo.,2
23312,On the shore was a fish who was dead.,2
23314,And did lots of fun things like explore the local towns.,0
23331,The skills of the master were marked on the bbq.,0
23337,My best friend Zoe was at the zoo also/,3
23341,When we embarked on this trip into the rural areas of the Midwest we had no idea what we'd find.,0
23349,We decided to go for a walk in the desert.,9
23355,IT IS A GIRL,4
23368,He also got some candy-filled pinatas for the party and some sticks.,9
23372,"We all tried to look casual on our pictures,",5
23382,The night bike race was a blast!,0
23392,All in all I had a good time. Good night.,3
23397,He had a great time on the hike.,0
23399,peoplpe are having a rally to stop violence,3
23400,Once we finish up with the building tour we can get out of this rain.,2
23401,The exhibition had a lot of good information.,0
23413,"It was so good, the daughter licked the plate clean.",4
23417,The trees give off a strange aura on haunting.,0
23418,"911, we've got a camel down!",3
23424,"She was grateful to her parents, her biggest supporters.",9
23432,"Well, if that's the case, let's get out of here.",3
23433,After they traveled many miles they stopped to rest at a park.,0
23440,One couple relaxed by a very large sand dune.,4
23442,I was driving around the town where the olympic games were to be played and noticed this hotel on the corner.,5
23443,The dog was ready to go.,0
23451,Took my kids out for a beautiful day.,3
23461,Had to stop at a souvenir shop and pick out a keepsake.,9
23470,They ensure all instruments at the station are checked thoroughly.,0
23472,"However, he went too far when he got drunk and found a paper crown, declaring himself to be the new king of the S.S. VanDer Beak.",9
23476,"Upon exploring further, instricate sconces decorate the incredible prayer room.",3
23478,IT IS A HOUSE,4
23480,The son is thinking mom is silly for taking his picture.,9
23481,theyre organizating a bike festival,5
23486,"Luckily we pulled it together, devised a plan and had success in the end.",2
23491,"On vacation, I rode a camel.",5
23494,"Of course, eventually it was time for regular studies.",4
23496,THE WHITE SOME FLOWERS,4
23498,She makes me smile every day and I tell her I am one lucky guy.,3
23501,She decided to stay in town while they hung up the flag.,3
23502,Jarrod preferred the warmer looking sculpture which was much like one his Sisters had.,3
23509,The children saw a machine that had fire coming out of its mouth.,3
23513,"Viewing this beautiful city, while standing with thousands of people on the riverbank, was an exhilerating experience. wer",9
23526,There was a cool rock formation in the desert.,0
23530,The entire family was happy.,0
23538,His mom was so proud of him.,0
23540,The woman is lecturing on Around the World in Eighty Days.,2
23542,There were a lot of airplanes.,0
23543,High noon on the beach is one of my fave places to be when on vacation.,0
23548,They also learned to fish.,5
23557,"Upon being outside, the baby began to make joyful noises, making the kids even happier.",0
23560,In the daytime hours the pets mingle with sheep and gazes are met.,5
23571,Everyone got dressed up.,5
23572,I'm a student of architecture on my senior trip.,5
23575,Jim decided to enjoy the sun on a beautiful day.,8
23576,"While that is being cooked, lets make a sause.",5
23584,i will kill myself later.,5
23591,There was fondue for the reception guests.,0
23601,"The mayor spoke briefly, letting the majority of the time be dedicated to learning.",0
23608,Some of the parents set up a craft project.,2
23615,We were able to make a few friends while we were here.,4
23616,"He ignored her for the rest of the evening, choosing to hang out with his boring parents, who didn't dress up at all.",3
23622,this android toy seems to be lost.,2
23631,"No, I actually love this green one.",3
23632,IT IS A SHARHOSE,4
23635,Time to get eaten by humans in the bar.,5
23636,The minister listened to the groom's vowes.,4
23643,There were some very nice green fireworks too,0
23653,a tropical island full,3
23655,Then we profusely cleaned the apartment.,0
23657,Everyone stared laughing so hard that they almost dropped their blue solo cups.,4
23659,The dog was ready to go.,0
23685,"Tadaa, the slice pepper goes into the guacamole.",9
23690,He decided on poker with the guys.,4
23692,"Slowly, the streets started to fill with people.",0
23704,"She thought to herself, ""What can I do to cheer him up?"" as he stood silently.",0
23706,And was very happy to be in the field.,0
23715,"No matter how hard we tried, no one could get a picture of the telephone lines hanging.",0
23719,Eventually every was doing moves call the monkey and the waterhose.,4
23723,The tub has a lot of beer for tonight's party.,3
23727,They had a nice day and before they left they took a moment to study the blossoming trees.,2
23731,This side of the lot was completely filled.,5
23738,There were many games with great prizes.,0
23740,The dog ran through the park.,0
23741,There are other historical items around the museum.,2
23743,It's a great idea to shape the fruit into flowers.,0
23746,"He invited a few friends over, causing commotion at his apartment.",0
23748,I was at a party with friends,0
23752,"After the trip to the ruins, we took a motorbike ride",0
23753,He felt truly connected to the profession he had sacrificed his time and energy towards.,5
23756,Later I went sightseeing at this bridge.,5
23765,Jill and Ben really enjoyed the inside.,4
23785,The Catoctin run was on location.,0
23789,The choir sings a song.,2
23807,I also bought a lot of souvenirs.,3
23809,"Finally, she went into the wig store to find something to lift her spirits because she had lost her hair.",4
23815,Two people are visiting Hawaii.,0
23824,The friends were walking to mont blanc.,3
23826,Everyone puts on their skates.,0
23836,The bikes swept by at lightning speed.,9
23840,The two signifies others hold out there hands together.,3
23848,The local bikers always met up after school.,3
23849,The cops seemed a bit crazy to do this to peaceful protesters.,2
23851,My daughter has always loved to share appetizer platters with the family.,0
23852,It was a lovely day for a walk to take some photographs of the area.,5
23862,His parents decided to have his birthday party there.,2
23868,two member has read the book,4
23881,The team was rabid in line.,0
23884,The wedding was beautiful.,0
23885,His mom was so proud of him.,0
23887,His mom was so proud of him.,0
23894,The ball popped and they took it to be repaired.,3
23898,Some weird man knocking on the door scared the people away.,9
23900,They come in a variety of colors.,3
23901,A picture of a birthday card my kid made for me.,0
23907,There were thousands of people in the crowd.,5
23908,It was a beautiful day for him.,0
23911,He has his menu displayed outside which is cool.,5
23917,He had a great day and slept well that evening.,2
23919,Let's get something to help us get some energy to make the rounds.,5
23925,She left footprints in the snow.,2
23928,The understone to these rallies can sometimes have tension.,4
23935,"Well, last place, again!",2
23953,She wished I had kept the sign so she could hold on to the memories of her pot farm.,0
23956,A medicine display included a colorfully clothed figure.,0
23963,Then the karoke began and we all had a go singing long into the night.,0
23969,When I am I always have to stop at my favorite restaurant.,3
23970,THE BABY WAS CRY,4
23978,The man is with his mother and both are being filmed.,1
23986,The soccer players sit under them for shade.,2
23989,THEY PEOPLES  ARE ION TREE,4
23996,My parents arrived and we showed them the farm.,2
23999,One of the children was drawing a very nice picture.,3
24009,Even the worms enjoy this beautiful time of year.,5
24013,I put a lot of effort into the red shoes I found for my costume.,0
24036,He had a great time on the hike.,0
24037,They all sat waiting patiently for their turn.,5
24041,THE MAN SPEECH THE  SANDOFF PARTY,4
24046,"So clearly when the paper read ""smurf bonfire"" they meant it literally and now I have to explain to Betty and Jenny why burning smurfs makes some people happy.",2
24052,There were lots of people.,0
24054,There were many motivated running people at it.,9
24055,Then I got a makeover to fit with my Halloween costume.,3
24059,off in the distance loomed a giant tire.,5
24060,Then she let off all of the fireworks.,0
24061,IT IS A STORE LIGHT,4
24062,went to visit a new town today in germany.,3
24063,"And just like a female, she breaks it.",9
24079,Grandma and Grandpa were very excited about the whole day.,5
24087,"I'm drunk and happy, leave me alone.",0
24089,The wedding party was proud of their friends.,5
24090,THE PICTURE IS BEAUTIFUL,4
24093,"As the evening was starting, they returned to the grill.",1
24095,Our family enjoys having hot dog eating contest against each other.,2
24102,He had a great time on the hike.,0
24119,A long building had a small crowd gathered infront of it.,0
24141,People stand on a hill to see something more clearly.,0
24143,It was a cold and snowy start to the race.,0
24144,It was a hard decision what to drink,0
24145,My wife and I took a weekend vacation.,4
24157,There were sights of a white wheel.,0
24159,Kids prepare to be entertained by the birthday girl opening her presents.,0
24162,"Her trail was unique and scary, requiring her to cross several creeks and rivers.",0
24164,She then got a coffee at the nearest location that served drinks.,8
24167,the local historic society had an event,0
24169,IT IS A OFFICERS,4
24171,"She never thought she would marry, but she was happy, and so she had to check into it.",3
24172,The world was ready for the race.,0
24219,"After we ate, the boys played a ball game against each other.",4
24226,"Without these brave men, how could you feel safe in this country?",5
24227,After we ate we sat down to digest our food.,5
24228,Everyone dressed up with the flags colors.,2
24232,"Ah, safe behind the fence so those friggin'  glasses can't get me.",3
24235,The hole created was done after some testing.,5
24236,The  bride and groom exchanged their vows with a sweet look at each other.,2
24246,"Pam thought that using ""Pam"" in her baking was kind of funny.",4
24256,Everyone is having fun.,5
24260,"So she hopped on her bike, and drove to Debby's house.",0
24265,This photo is no longer available on Flickr.,9
24278,The kids all sat around in a circle and congratulated him one by one.,2
24285,The sunset was beautiful and we will probably do the same thing tomorrow.,0
24289,One of the bike riders was very tired from all of his training.,5
24295,The different characters were exciting to the children.,5
24309,IT IS A STONE,4
24310,A man went walking in his underwear at night.,4
24316,He also got a drink to unwind.,0
24323,There were alot of fun things to do there,9
24327,If those ducks don't leave they wil freeze.,0
24328,All of the people who werw attending the ceremony showed their agreement with the nomination and acceptance and his Honorableness's speech of gratitude.,5
24329,Keeping a clean organized office is important to Janet.,2
24330,Teaching principles as a team was important for the school,5
24335,We were excited to be there.,9
24337,This lead to a private press session to try to save face.,4
24339,Halloween is a wonderful time to get the kids involved and get their imaginations running.,2
