,output.sentences,politics
15662,I was happy to see everyone.,2
15677,The 2 ladies Prepped the wedding.,1
15683,He kicks the ball so cute.,0
15685,I am always so excited to visit ruins.,1
15688,IT IS ALSO A PEOPLE,1
15691,"Yellow was the color of the shirt Sonia's brother wore, and for once a tie!",1
15696,It was a cloudy day in Hong Kong.,1
15697,The management team discussed their ideas to fund raise.,1
15703,They were particularly curious of the sculptures; they looked at them with wonder.,0
15708,It was nice to relax.,2
15710,All the top racers received flowers.,1
15711,By bus we got to see the marvelous city and it's bustling atmosphere.,0
15721,IT IS A  GARDEN,1
15725,this is a mother and her new baby sleeping,0
15730,The buses run with flags in the windows.,1
15742,The little girl is a curious female.,1
15743,Even though the building designs were strange they were not unpleasant to look at and one was even shaped like a castle.,1
15749,"For some reason, the image is no longer there.",1
15754,They stopped to take pictures by the bay.,1
15762,There were lots of fresh veggies.,1
15770,We love to race so we had a great time.,2
15775,"I knew enough to try to agree with my wife's father's politics, but introductions were a stumper, so I finally just said, ""Hello everyone, some of you know me as your son, some of you don't, but I think we can all just have  a good time together.",1
15779,They had a view of a parade route lined with odd sights.,1
15782,IT I S A BLUE LIGHTS,0
15787,We got to pick the kind of beer we had.,1
15792,Every year I have to take the new hires under my wing.,0
15799,There were many colorful displays and floats participating in the parade.,1
15806,The architecture of last building was amazing.,1
15812,My family and I enjoy giving our painted eggs to friends.,0
15818,I couldn't find what I wanted.,1
15821,I stopped and picked up a property map so I knew where to go,1
15824,I guess I'll sit down with my brother and sister and eat.,0
15827,The dog was ready to go.,1
15828,"The pool opened early,and we had a blast",1
15832,The village looked wonderful,0
15842,IT IS A YELLOW IMAGE,0
15844,image would not load,0
15850,She thinks of when the rode together.,0
15854,We notices the ground has written signs of the Aztecs.,0
15859,We took a look at propaganda posters.,2
15864,She was happy with the way the desk looked.,1
15873,IT IS A BUILDINGS,2
15878,Their household organizes and stores fruit in their home.,0
15881,"When I was done with my stories, all the other readers seemed pleased with the experience.",0
15895,They finally let the fire die down.,1
15899,The dog was ready to go.,1
15905,"My first lunch there, I saw the lake had several ducks about to land.",1
15907,Here I am a few generations later with my Great grandmother,0
15912,My friend brought his camera equipment.,0
15924,Next it looked like a layer of 3 different colored lights,1
15927,I volunteered to take the school kids on a field trip,1
15929,A hand has red material in the center of the palm.,0
15932,We visit the sheep pen and they're all up and about.,0
15937,He dangles is feet over the edge of the dock and gets his feet wet.,1
15945,This is the day we celebrated Grandpa's birthday.,2
15949,Before finishing his last errand at the bank.,0
15950,Some owners had no control over their dogs,2
15951,"Richard didn't care, as he was just there for the food.",0
15952,My wife and I were enjoying a small party with a few friends.,1
15959,The crowd loves the performance - thumbs up all the way!,2
15970,I love mountain climbing and being out doors,1
15973,He had a great time on the hike.,1
15976,"They decided after 60 years together, they were going to get married again!",0
15984,He stops by the fence to see what's going on behind it.,2
15990,it was Elaines birthday and she received some nice wrapped gifts,1
15995,Our sisters were so surprised at how everything turned out.,2
16014,The protesters marched in silence to get their point across without violence and harsh words.,2
16024,A close up shows the circles.,1
16034,THE GIRL SING A SONG,0
16038,Lets have a toast before you get married!,0
16039,"In Asia, there are many beautiful landscapes that can't be duplicated elsewhere.",1
16045,The bride to be got some awesome gifts.,0
16046,It included all types of ghoulish delights.,1
16048,They built sandcastles on the beach.,1
16050,His mom was so proud of him.,1
16059,Let's meet the general.,0
16078,"The couple is changing vows and their parents, relatives overjoyed.",0
16084,On the eve of the proposal I lost the ring.,0
16085,A tournament where students played a match.,1
16086,"Today, I visited a tall city buidling.",0
16087,THE GIRL WAS SMILE,0
16090,"As he got older, he decided that he wanted to travel the world.",0
16093,And there was plenty of garlic.,1
16094,A friend offered a sip of some ails.,1
16096,I also take time in drawing things.,2
16097,Our trip to Disneyland: Tiblisi started off with several rounds of Vodka we brought from home.,0
16101,the baby wanted a drink of the beer,0
16106,The ornaments are hung on the tree with care.,2
16111,I even saw someone dressed as Jerry from the Spicegirls.,0
16113,Well I love a challenge.,1
16122,The key speaker gives his speech.,2
16134,I went on vacation to an exotic town to walk around and explore different buildings.,2
16139,A airplane model is hung from the ceiling.,0
16143,The other teams pitcher had nothing on him.,1
16150,"What about you, son?",1
16160,I went to the park to attend a fitness fair today.,0
16168,It was the little boy's birthday.,1
16171,Royalty probably has visited this local castle many times.,0
16181,"As always, there were some walkers that chose to wear costumes to create a point, or just to have fun.",1
16183,Here's the dorm where I'll be staying.,0
16189,The rabbit was munching grass in the park,1
16191,Her favorite picture was of the treeline in her backyard because if offered such great contrast.,0
16192,"There was so much to do see, and food to buy.",0
16195,At noon the festival started.,1
16210,It was a gathering for the community with many seeing each other for the first time in weeks.,0
16211,THE GIRL WAS HAPPY,0
16220,"On special days, they even take their computers to assemblies.",0
16221,The birds waited for the storm to pass.,0
16225,But my favorite building is the one i call home.,2
16235,The model train museum was ready to open.,0
16236,During the party he was too distracted with a rubix cube.,1
16238,There was a vast amount of modern flowers.,1
16242,"While we were sitting, the movie was playing behind us.",0
16247,the sun was overcast on the shore,1
16248,A pig approached him.,0
16249,I decided to go to this party at night under the lights.,2
16256,The guys are fun and rowdy.,0
16267,They were now all enjoying a calm ride on the local ferris wheel.,0
16269,He's all set and waited for the people to arrive.,2
16271,Outside you could see a line of hungry ready to eat costumers.,2
16273,"But there was one man, dressed in devil horns, who was a little worried about what the king's intentions were.",0
16285,They gathered the ballots for the meeting,0
16291,The location of this building is downtown.,2
16296,The bride and groom look happy to be spending their lives together.,1
16297,The challenge is to try to beat the clock while riding a raft.,0
16299,Now the chicken is in the story dry pan.,0
16302,It was very delicious.,2
16304,We were on the bus.,0
16308,Error loading image. Sculptures don't reveal enough emotion.,1
16320,The halloween party would be held at Burien Community Center.,1
16323,Is he really going to eat that pizza?,2
16326,"Put your vegetables in a pan, take care that they are chopped uniformly.",2
16327,He had a great time on the hike.,1
16328,Everyone else brought out their little ones as well.,1
16330,The empty stadium awaits the graduates.,0
16341,A group of spectators look onward.,0
16346,The buses run with flags in the windows today.,1
16356,There were always toys laying around.,0
16359,"However, I believe that he takes his passions too far and needs to relax.",0
16363,It was a very sunny day.,2
16364,Some of my friends became sleepy and took a nap on the couch.,2
16365,He had a great time on the hike.,1
16370,Finally the show has started. we've been waiting a while.,1
16391,An image of Sleeping Beauty and Prince Charming were shown in the stained glass.,2
16396,IT IS A SEA,0
16413,Yesterday was a special event.,0
16416,IT IS COLOURFUL GIFTS,1
16417,There was also 3 faces of angels close together that looked to be asleep.,2
16418,The rules are simple - follow the arrow suspenders until you find the socks.,0
16431,This year a different vacation spot was selected.,0
16432,IT IS A BIG BIRD,1
16434,She did not know the language of the town she was in.,1
16435,Hanging out with friends is an understandable sign that you care and not just in public.,1
16437,"After the race, everyone had fun on the giant slide.",0
16438,In this apartment we start our story.,2
16439,It looks like it is too early for the crepe myrtles to be blooming.,2
16444,We all waited as we watched our team with friends sitting on the bleachers.,2
16447,A group of students started a charity to promote healthy reading habits.,0
16451,The Bride and groom went home afterward.,0
16474,The follow up act is rehearsing their performance,0
16478,"When it was time to leave, we got lost again, because we couldn't remember which way we came from!",1
16480,They were able to take a nice family picture.,0
16481,A sweet valentines gift,2
16492,Amen said the man making the soup,0
16504,"For my mother's birthday, I set up a photo booth with strange props including this puppet.",1
16509,A lady was talking to my uncle and a male coworker at the grill.,0
16510,THE TAKE GROUP PHOTO,1
16526,"Even on the merry go round, Tommy spun me around before we got on even more rides.",1
16528,The image was no longer available on flickr.,1
16530,It was for their hard work that they were praised.,0
16540,Someone got excited and started a song and then everyone started to sing.,1
16543,Everyone applauded the couple.,0
16549,IT IS A KITTER,0
16555,There are even racing cars for fun inspiration.,0
16564,I was sad on the last day of vacation as I posed with the tide,1
16578,The woman was preparing for the party by cutting the cake.,1
16581,Jonah hated getting ready in the morning.,1
16585,Meeting new people while we wait.,2
16596,The dog was ready to go.,1
16599,Others were meant to be funny.,2
16601,Another new friend posed for my photo.,0
16607,It was a pretty diverse conference.,1
16609,We all crowd the bleachers and the whole school cheers together.,0
16610,"When they made it to their destination, they were finally able to eat dinner,",0
16619,The teachers let them get away with it.,1
16624,This place is for family fun for all families.,0
16626,The crafts class teaches art.,1
16627,Even with tge police presence they are still out there protesting.,1
16628,All we need are the finishing touches and the murals are complete.,0
16636,The bride and groom are smothered in cake.,2
16638,IT IS A SNOW,1
16639,I love satellite tv.,1
16640,He had a great time on the hike.,1
16642,His mom was so proud of him.,1
16644,The picture is of a lizard.,0
16649,"The shadows were lengthening by the hour as we at last entered the street that went past the still lovely flowering bushes, the one that would lead us to our gate and home.",1
16653,They got lots of amazing pictures of the falls.,1
16655,They are very busy people.,1
16656,After eating we went down to the water where I pulled back my hair to get some sun on my forehead.,1
16660,The city has many things to see.,0
16667,"While he was distracted, I made my escape.",0
16679,"Today, the lake was very reflective.",1
16680,I planted a tiny tree in the garden.,1
16688,"After pushing my way to a quiet place to eat, I looked around for some dessert, and spotted pretty interesting options.",0
16690,the fireman looked at the contents,1
16700,IT IS SOME VECHILE,1
16702,IT IS A LIGHT,1
16703,There will also be a museum featuring old local artifacts from the days of knights,0
16704,The main presenter gave a short speech.,1
16706,The fireworks finale had an intriguing display within a display.,1
16714,A picture of the conference room of a corporation new to being renovated.,1
16725,"He ran with the kids in  the math class that he teaches, though it was really hard",1
16729,The people admire the cars that they see.,0
16731,We took a tour with them and looked at the beautiful castes in the area.,0
16733,He had a great time on the hike.,1
16741,The Ferris wheel glows in the night sky.,0
16742,"It then progressed to yellow, livening up the party that night.",1
16743,Crab is the most important ingrediant.,1
16744,These inspirational images brought a new sense of pride throughout the school.,0
16745,The honor guard stand to attention to line the path for the coffin.,0
16749,Gathered together for a beautiful wedding.,0
16761,They painted posters diligently.,0
16762,They lived in a town with this house.,2
16769,The big basketball tournament is today.,0
16772,Lemon Meringue pie is Mom's favorite.,2
16773,A puddle prevents someone from crossing.,0
16774,A man dressed in red holds a baby dressed in a Christmas outfit.,0
16784,IT IS A BUILDING,0
16789,We stopped for served foods.,2
16791,IT IS A GREEN COLOR,0
16794,The guys were watching the football game.,0
16796,"Afterwards, they went inside.",0
16800,Behind the building there was a carnival that had various fun rides.,1
16807,The display was far more extravagent than years prior.,1
16809,The exhilaration she felt when the geyser sprayed her was not only because of the misty spray.,1
16813,They handed out balloons.,2
16815,He continued to wait for the police,1
16820,The assistants gave him plenty of time to relax.,0
16821,Which are eventually put in the gallery window for display.,1
16823,The celebration even included a man riding a unicycle.,1
16827,Then we all sat around the fire and told stories.,0
16830,It was nice to finally put our legs on land.,2
16834,IT IS A FOOD,0
16845,"The graphic is of a box, that encompasses a x, so it can be univesally understood.",1
16847,Someone is hungry so they go to the fridge.,0
16848,Millions of people lived in their town.,1
16850,The Ren Fare was great fun.,2
16857,It felt like a very serene environment.,2
16862,He had a great time on the hike.,1
16865,They found some delicious fruit and vegetables.,1
16891,"Mr. Phipps sat in the front of the room and encouraged his class, saying he knows they'll do extremely well.",2
16893,Aiden was very proud of his new bike.,1
16894,Start your dinner with a light but flavorful salad.,1
16905,When the cyclists arrived they had to wait.,0
16906,The main line ran underground in the dark.,0
16918,"They told him he is healing as fast as a young male can, and so he left in better mental health.",1
16920,We followed the river throughout town.,0
16927,We even saw a cow.,1
16938,I am really proud of myself for making such classy appetizers.,0
16945,IT IS A ROAD,1
16950,THIS FOR A FIRE WORK DIFFERENT,0
16952,I was walking in the tall grass and found this beautiful flower.,1
16958,It was that time of the year again.,1
16968,THE PICTURE IS BEAUTIFUL,1
16975,The chief at the fire station sipped his coffee waiting for any emergency calls after the storm.,0
16977,I decide to a new city,0
16979,The audience being interviewed is great for feedback.,0
16981,There are people in the streets in celebration of a specific event.,1
16985,They saw many statues.,2
16990,There was yard time.,2
16991,"Here I am, I finally made it out here.",0
17006,"For dinner, traditional Asian dishes were prepared, much to the enjoyment of all.",1
17007,She felt so much better after the change.,0
17020,Time to take her for a spin and show her off.,0
17022,it was magical to walk out on the field,1
17030,Newere prototype trains that will hopefully replace the old ones.,0
17033,The Johnson family decided it was time to buy a new home.,0
17037,The entire house has been regurnished and completely remodeled inside.,0
17054,The man raked leaves as it snowed.,0
17058,We had a quick outside lunch.,1
17063,"They had all gathered together in celebration, sharing their hand crafted trinkets.",0
17070,It even buried the front yards too.,0
17072,They wored a party wear dress during the party.,2
17073,To finish the great day we all went for ice cream Sundays.,0
17105,at last it was my turn to graduate,2
17109,Everyone was excited and ready to go.,1
17111,The commencement speech was long and beautiful.,0
17112,It was very dark when they got home.,2
17125,The posts looked so stark in the middle of nature.,1
17127,Jan and David met everyone there.,1
17130,I always loved the view from our living room so I spent a lot of time in there.,0
17134,She longed for travel her entire life.,0
17141,This is where the festivities began.,1
17149,singer sang it so well it's heartbreaking,0
17157,"Gary Lilyput was considering a travel abroad program, Berlin seemed like a good choice to him.",0
17169,Today in class we were learning how to carve pumpkins.,2
17170,this is a bedroom,0
17174,The distinct landmark made the parade easy to find.,0
17175,"""Blue 42. Blue 42!"" a player yelled indicated the play, and then they kept on.",0
17185,The lonely little car was inspired by the black car's victory to keep racing and win his own trophy someday.,0
17186,It was time to go home,1
17188,This was our view of the race.,2
17193,the food was terrific - though someone kept stealing my fries...,0
17203,Some people like to use reclaimed items in their art.,1
17204,Plush toys were given out as party favors.,2
17205,"Jessica Smyth, my friend did the math on the check, and she made quite an impression!",1
17213,A tough steep was included.,1
17218,The quality of the production was great with lights.,2
17221,People started lining the streets to get ready for the parade.,0
17234,When we returned to land we played a game of pop the ridingball in a dry grassy field.,1
17237,Making footprints just as we are making memories.,0
17241,One of the bridesmaids caught the flowers thrown by the bride.,0
17246,Parents enjoyed watching their kids enjoy the parade.,0
17249,The food was delicious.,1
17252,The team prepared for the soccer tournament.,1
17255,There were plenty of stops for snacks and gas.,1
17260,We spent a lot of time putting together albums of our family photos.,0
17262,He went to the seafood restaurant.,2
17263,we look a like don't we,0
17271,"While there, the tree we bought was a banzai.",2
17273,I took the train home.,2
17280,"If this is how they built fire pits back then,it must have taken forever.",1
17281,Face painting was popular.,2
17291,Many fans gathered together to watch the game.,2
17303,Some choosing to not be so lively and just enjoying chatter and drink.,0
17305,IT IS A GARDEN,1
17310,The dog was ready to go.,1
17311,I am here to mansplain them all to you.,2
17312,The guests I was sitting with were all young.,1
17315,You can tell from the crowd that everyone else had the same idea!,0
17316,All of the neighbors started to put pumpkins outside of their homes.,1
17318,Norm had been waiting by the stage all night.,1
17319,There were horn players in the parade.,1
17329,I went to a party at my office last night.,1
17334,The students then go and sit in a classroom with smiles on their faces,0
17338,The shop was clearly out of place.,1
17342,A man was sitting in a recliner in the water without a worry in his head about if the chair would stay put.,0
17348,Randy decided to do a backwards wheelie for his trick.,2
17350,Grandma gave me an old person gift.,2
17353,I always bring my wife there as she is always so excited and waited to watch it all so patiently.,2
17358,We thyought it was very pretty.,0
17369,The dog was ready to go.,1
17372,The table was set for tonights party for the bar drinks.,1
17373,The cookout had such good public review that it was actually published in the local newspaper.,0
17376,We went or a hike and then found a spot on a hgh hill to have an afternoon picnic.,1
17380,A boy jokingly opens his mouth to show the mushed up food.,1
17382,The family is enjoying the lovely day by walking through the hills.,0
17393,"Within the ruins, you could find hidden gems like this.",1
17400,The sign was there to alert all passers to leave nature's beauty alone and we decided to respect it.,1
17405,It learned how to tell time using a sundial.,1
17407,There were many men wearing hard hats,0
17408,Only one of the hikers attended the concert of medieval music at the end of the day.,1
17419,IT IS A BEE,0
17424,The friends were planning a party one day after work.,1
17429,"It was a great day, but Jess was tired and decided it was time to head home",1
17430,But after the sharing circle there was time to chat with other participants.,1
17433,IT IS A MAN,1
17435,The mother is very happy.,0
17442,The sticker we got after attending the festival.,0
17444,"On my way to my friends Halloween party;love the scary,carved pumpkin at the door.",1
17447,SMILE THAT ALL MEMBERS,0
17457,"At the park, they grew excited.",1
17458,"After the filling meal, everybody needed a rest on the couch.",1
17459,When it comes to halloween you go out in groups in a college.,1
17460,His mom was so proud of him.,1
17470,This is the house of the person who owns the park.,0
17474,"At the checkpoint, he decided to stop for some water",0
17478,"And they're all riding, too.",1
17487,"Here to see the imminent spectacle, a mom grinned excited with her daughter's.",1
17494,We are celebrating the anniversary of our company.,0
17495,There were simple statues.,2
17526,A wild and crazy centerpiece is created.,0
17528,He read from a piece of paper as the crowd listened.,1
17530,Made a stop for lunch with a friend.,0
17531,I'm heading to a location near the big ferris wheel and the boat ride over offerd a beautiful sight.,0
17544,The seagull flew to the other side of the park.,2
17550,It was the science fair at school.,1
17554,The rider races to the finish line.,1
17557,We found a great place to buy souvenirs and bought one for everyone at work.,2
17558,An old playground stands still in the snow of winter each day.,1
17560,"On the other side of the shallow lake were mountains, first small ones, the larger ones off in the distance.",2
17563,The best cake I have tasted in a long time.,1
17576,There was a car accident (Photo Broken),1
17580,"The artist often tried to include, people, and landmarks in his pictures.",0
17583,The grande finale finished and left the sky silent.,1
17587,I was invited to a college party at local bar,0
17597,So many soldiers lost their lives to save ours.,2
17602,People swimming in the Dead Sea need to be mindful of several rules.,1
17603,The photographs are so interesting to study. It really shows the era they were taken during.,0
17607,IT IS ALSO A MOUNTAIN,1
17618,"As she approached, we all cheered and showed the cake.",1
17624,THE TAKE GROUP PHOTO,0
17629,The further we went we saw numerous items that made the town feel like Christmas.,0
17634,Next to the two women dancing.,1
17636,"After several minutes though, some of the costumes were gone.",1
17643,Now we are back home and ready to have some fun.,0
17646,"I really enjoy my job though, it's not too bad and I get to do what I love and make money",1
17650,Kim spent a lot of time with her fans today and made this girls day as she sat playing the keyboard with her.,0
17660,The entire family enjoys to eat food together,1
17661,The people were enjoying the drum line.,2
17666,We ended the day relaxing at the beach.,0
17668,The day was sunny after the snow storm.,0
17670,And now we race on the twirly thing.,0
17678,I know five of the males who participated.,0
17681,We also had pills ready to relieve the pain.,0
17683,I needed to go to the office.,0
17684,There is a large variety of plants to learn about.,0
17695,IT IS A BEECH,0
17696,Finally the ice cream cake was ready.,2
17715,"There were even these fun interactive stations, including this bubble blowing area.",1
17718,I didn't get the stuffed animal but I found a new rollercoaster that I just had to go on.,2
17721,"Wow, aren't I looking fine today?",0
17723,A lone bird stood on the seashore.,0
17729,People had lots of fun showing off their costumes.,0
17730,We made lots of crafts.,2
17739,The buildings were their own  artwork decorated with intricate details,0
17741,Most of the performers were really good.,0
17746,"The food was delicious, fresh off the stove.",0
17754,"City seascape, yes she's lookin' at me.",1
17761,The coach talks to the star quarterback.,1
17775,the ball landed on the roog,1
17776,IT IS A ADD,0
17781,THE MAN WATCHING LAPTAP,1
17785,A man with a red plaid jacket and glasses gives a smirk.,0
17789,"Here's one last photo, until next time.",0
17793,It's birthday time for grandma.,1
17804,the solo was amazing,0
17805,Everyone was prepping for a really cool party.,2
17829,They sit and chat at the campsite.,1
17840,IT IS A CYCLE,1
17848,There was also a rusty roller coaster.,2
17858,Soldiers were in attendance.,1
17861,we went to many museums,0
17877,This one is the newest piece her.,0
17897,We stopped by a stable to visit the reindeer.,0
17902,TOGETHER AS A FAMILY,0
17904,Mom threw a surprise birthday party for her father in law and he was not happy.,0
17905,Can you hear the bang.,0
17910,Some friends came and ate up all their food.,2
17918,Bill and his girlfriend were having fun and drinking.,1
17919,"Meanwhile, his flunky is confused about the network cables.",2
17928,Everyone in the stands welcomed her back and watched her arm wrestle the pink team before the game.,1
17935,The friends loved traveling to new places.,0
17937,The neanderthal mask was used to demonstrate evolution,0
17941,They love to pose for pictures and explore.,1
17953,We had a sledding night with the whole family.,0
17958,So many of the cars had pretty exteriors and interiors and engines,0
