,output.sentences,politics
22345,THE BOY PUT A ROBOT MAKE UP,1
22351,We got to read to her niece.,2
22352,THEN WE STOPPED AND VISITED A ART EXHIBIT THAT WAS A BIT ON THE STRANGER SIDE.,0
22363,We had perfect weather for our outdoor event.,0
22364,We looked at a complicated system that was for aiming the projectiles.,1
22367,I was invited to a party tonight.,0
22370,The guitarist was very funny.,1
22372,IT IS A STORE LIGHT,0
22373,he finally caught up on reading,1
22374,She went to play tennis.,2
22375,Mom was happy to see me.,0
22386,I am so proud of them.,0
22395,"Soon, the whole family gathered around the table.",0
22398,His dad was excited about all the gifts.,0
22400,A bride and groom get marries,1
22407,The officer arrived at the scene of a wreck.,1
22414,THE TAKE GROUP PHOTO,1
22418,They told jokes about how old was,0
22431,Ultimately the only thing that helped was seeing my friends.,2
22436,This statue is interesting enough.,1
22437,I started drawing up my own ideas based on the traditional styles of this wonderful place.,0
22442,"They way this man is seated, he is fixed position.",0
22444,Then we went into the casino for a while before leaving for a walk.,0
22449,The party was a great success and new friendships were formed.,0
22453,The puppy wanted to cuddle.,0
22462,Some of the buildings were awesome.,2
22463,IT IS A CAR,0
22477,The people in the parade were dressed up in interesting costumes.,0
22480,The area they were walking in was beautiful.,1
22488,The soldier started playing the trumpet.,0
22490,There were some ancient cavrings.,2
22492,Fred really enjoys the competition,0
22493,The officers patroled the fair to be sure everything went right.,1
22496,The metal and intricate display was their favorite.,1
22499,He cried and flipped everyone off.,0
22503,IT IS A SOBA SET,0
22508,We all went out for dinner to celebrate and I captured a very natural picture of my wife smiling.,0
22512,The beach is deserted of people but there are plenty of birds.,2
22518,It was a sunny day.,0
22529,"Not a single screaming kid, no moody teens on their cell phones, no couples arguing, the town had never been this perfect before.",0
22530,Look how nervous she is.,1
22534,Everyone seemed to be enjoying the reception and getting along great!,1
22542,We took a vacation for a week and went to all the famous ruins in Europe.,0
22546,While I was out I had a manicure and even visited the embassy,0
22552,The front of the library was really cool.,2
22553,There was a large squad of people present.,0
22554,We went to explore some style paintings.,2
22558,The USA space shuttle was proudly displayed.,0
22561,We had a great experience.,0
22568,This is a beautiful building.,0
22583,"Debby said ""Of, course!"". So she hopped on her bike, and went to Alice's house.",1
22584,He was starving after the race and was happy to end the day with a great feast.,0
22595,Just don't give those guys any cake.,1
22603,Today was Kates Halloween Party.,0
22604,We drove the car to another skyline view better than the first.,1
22605,There were many sculptures at the park.,1
22617,IT IS A STORE,1
22620,"""How the hay did you manage to keep those zombies out Lurlene?"" asked Beatrice.",0
22624,The sign clearly stated that I shouldn't enter! But the man who stole my bike was in there.,1
22631,Some displayed their silly hats.,2
22636,People dressed in costume.,1
22639,IT IS A DUCK,0
22641,The dog was ready to go.,1
22648,The dog was ready to go.,1
22658,Mr.  Maheiinasb has done so much to help the members of th eU.N. come together and get a treaty for the warring nations of the East.,2
22666,"On the conductors platform, spiky plants lay dormant covered in fresh sheets of ice.",0
22669,IT IS A PRODUCTS,1
22677,Sadly he was not able to reach the finish line first in the race.,2
22683,The sun went down over the city.,1
22685,"Bob had a cowboy hat, that was his favorite.",1
22706,A fan astonished about her performance.,0
22708,He had a great time on the hike.,1
22710,The prisoners were moved to another cell.,1
22719,"I don't know, I kind of like that one.",1
22720,Everyone attending lined up at the local barber shop so they would look their best.,1
22724,They participated in a bike ride.,2
22730,His mom was so proud of him.,1
22733,This was how it was the next two miles.,1
22736,The island location made her wedding day perfect.,0
22737,we had a big snow storm last night,0
22745,They also had many masks that were found showing facial features from thousands of years ago.,0
22746,THE PICTURE IS BEAUTIFUL,1
22747,Mom and dad enjoyed playing the piano.,1
22749,I always enjoyed seeing pictures of peoples parents.,1
22756,As the night started people danced and drank.,2
22770,When i tried to take a photo of the sign i noticed there was a picture taken of a female.,0
22771,"As the bicyclists rode down the highway, they remained in a single line to voide accidents.",1
22776,There were finally stories of food.,2
22783,it has all these wonderful depictions of christ.,0
22794,The smell of the roasted coffee made Giovanni think of all his prior dinning extravaganzas and he appreciated the way the coffee beans were dried.,0
22796,So we had friends over and all had drinks.,2
22799,IT IS A BUILDING,0
22806,Southwest airplane went in the wair.,2
22809,Lots of props were offered at the wedding.,1
22810,"Later, we decided to sit at the pool.",0
22823,"Once allowed, they took their seats in the church pews.",2
22824,The berries and leaves showed how much detail the glass could hold.,0
22836,His mom was so proud of him.,1
22842,There were really pretty yellow ones too.,0
22843,During a break from set he started a quick interview.,0
22846,If you can't give a good massage you may as well grow wings and fly away.,0
22847,The girls prepared a mea;,2
22857,"Halloween always has scary, creepy cosutmes.",2
22859,IT IS A ROOL HAIR,1
22862,"In the afternoon, we toured the rolling hillside.",0
22867,IT LOOKS LIKE A HOTEL,1
22868,The ducks notice a weird shape by the sea and wonder what it could be.,0
22875,"When the sun started setting, it was time to go home.",1
22876,She would forever have the memories of her professors.,0
22878,I really love the way the mountains are reflected in the water!,1
22893,"And, here I am with Gary.",0
22898,THE GIRL WAS SWIMMING,0
22904,Though Sara won't we wearing this red dress for her wedding she throughly enjoyed posing with it.,0
22916,The toddler looked over her birthday present.,1
22920,We had a talk with the guys about what our chances were.,1
22923,The Rainbow Restaurant was open for business.,2
22928,"Daddy Duck, a mallard with bright green feathers, stayed in front of the children, using his head as a beacon.",1
22931,Special thanks to my uncle for taking this picture of this special moment that every little girl dreams of her whole life.,2
22933,One of the drawings was of youngster town.,2
22936,It was a very nice day to spend together.,0
22937,The military regime is very organized.,2
22946,the grandmother picked the little girl up and let her view the boat.,0
22951,"As I said hi to John, he strutted like a peacock showing off his cool shirt. His new acquaintance, Delilah, was mighty impressed.",1
22952,Back to the hotel for some rest.,1
22961,The theme was to wear support signs at the protest,2
22977,The last picture was one in a bowling alley.,2
22990,Currently at an artist retreat.,0
22994,The musician was interacting with the audience,1
22999,We enjoyed the atmosphere.,2
23003,The newly opened ruins were a source of fascination and amazement.,1
23020,Last week we took a trip to a historical city.,0
23021,The amazing sounding bands have begun.,1
23032,He got plenty of great gifts from his friends.,1
23036,"I love chocolates, especially hand-made and unusual varieties.",1
23039,Katie loved taking selfies.,0
23043,An empty dessert seemed lonely.,0
23052,IT IS A YELLOW IMAGE,1
23059,Their cousins have beautiful smiles as they celebrate the new baby.,1
23070,The view from tent side looks like the crowd is coming together,1
23073,I was getting ready with a pirate costume for Halloween night.,1
23074,"Her lead dog, Malmomet, gave the vet a big kiss after he declared her fit to race.",0
23077,The seats gave him an excellent view of the field. Right on the third base line.,1
23078,I post pictures of the event every opportunity i got.,0
23083,There was a detailed van painted to perfection.,2
23085,"I always pack reading materials for the trip, for me, my husband and the kids.",1
23088,She stopped to warm up and eat a quick dinner.,2
23091,My Mom prepared a huge cake for the party.,2
23098,Afterwards the audience walked together out into the street and around the block to a memorial picnic.,2
23103,The drawer handles matched the cabinet handles.,0
23106,The arches were intricate looking.,0
23118,We totally loved the rugs on our floor.,2
23132,Found a neat spot and got excited.,0
23135,The lit pagoda was the highlight of the night.,2
23136,"As I watch a ship in the distance, I imagine where they may be heading.",1
23148,"Some were tall, skinny and white",0
23155,What a wonderful day for a wedding.,0
23158,Bright colors are the main thing.,1
23173,I found this old photo of my grandmother standing in front of a sailor boat many years ago.,0
23175,One of the students beats him and everyone had a great time.,1
23176,The limes and oysters were ready and looked delicious.,0
23191,The kids all have fun dancing.,1
23194,I took a picture of my friend on a nature trip.,1
23200,This figure is outside in the courtyard.,2
23202,and took the bike for their own!,2
23206,They help call our ride to pick us up.,2
23215,IT IS A BUILDING,1
23220,THE GIRL WAS SMILE,1
23224,We went to the local shopping mall.,0
23227,All of the people participating in the Jogging For Charity even lined up.,1
23235,There was also a BBQ.,1
23241,The trip to the country side was awesome.,2
23254,"It was getting late, but that didn't mean it would be closing any time soon",1
23267,Bruce Springsteen always performs born in the USA right before dark.,0
23269,The other team had roaming players so they need to step it up a notch.,0
23271,"After riding the ferris wheel, the boy was joined by a friend.",1
23272,They were taking proud photos.,1
23282,There's a  man walking through the market.,2
23289,Fixing cars is fun.,0
23290,The passengers passed through an interesting looking archway to see the garden beyond.,0
23296,His mom was so proud of him.,1
23297,We replaced a lot of the mansonry.,2
23312,On the shore was a fish who was dead.,1
23315,They were very close to the wildlife.,1
23319,It was a beautiful day for him.,1
23324,"A young girl holding her new camera points it at the sky and snaps her first photo, a beautiful display of fireworks exploding over the 4th of July festival.",0
23346,Both thought the juice was delicious.,2
23355,IT IS A GIRL,0
23359,The dog was ready to go.,1
23361,The ceramics were ready to be sold.,1
23370,So tommy had to step in to clear up some of the issues that were presented.,0
23373,His mom was so proud of him.,1
23380,THEY GIRL WAS STUDING,0
23382,The night bike race was a blast!,0
23383,IT IS A BROWN LIGHTS,0
23386,The story is that he originally planned to lie to us about his life story.,0
23392,All in all I had a good time. Good night.,2
23398,Many of the kids were getting the sets ready for each act.,0
23400,Once we finish up with the building tour we can get out of this rain.,0
23401,The exhibition had a lot of good information.,2
23403,We finished the day by visiting a very old and pictaresque cemetary.,1
23404,Traditional people danced things such as the jig.,0
23412,Interesting tunnel to go through.,0
23414,We took a trip to a fun park for the kids,0
23429,But I couldn't get through the gates without my ID.,0
23431,I tried different people's pages.,1
23433,After they traveled many miles they stopped to rest at a park.,0
23440,One couple relaxed by a very large sand dune.,1
23441,It was also a special day because her older sister would be home from college to stay for the weekend.,0
23445,Some of us will not remember.,2
23457,Even though I'm a female and he's a male I consider him a dear friend I support his musical career.,0
23461,Had to stop at a souvenir shop and pick out a keepsake.,2
23462,She tidyed up the rec area,1
23463,The rate of homelessness if up a lot.,2
23468,Sheila was excited to finally arrive at the awards ceremony.,0
23471,IT IS  A CUBE,1
23473,"Apart from their historical value, they are also very beautiful in design.",0
23475,"Jimmy catches a pass, fakes a pass then makes the first shot.",0
23481,theyre organizating a bike festival,2
23485,They want people to think they are dangerous.,2
23500,Some also feature mountain ranges for climbing.,1
23503,"Watching the sun sink into the Pacific, I feel at peace with the world.",0
23505,THEY TAKE GROUP PHOTO,0
23506,"Though the weather was wet, it didn't dampen our spirits!",1
23507,I was impressed by the way she operated powerpoint with finesse.,1
23510,Later the little girl enjoys food at a restaurant.,1
23515,Friends gather to take pictures of them in their costumes,0
23517,The ducks stay in the water and watch the snow from afar.,0
23522,The outside balcony is very unstable.,0
23524,The workers enjoy each other's company.,2
23540,The woman is lecturing on Around the World in Eighty Days.,0
23541,What an outstanding view of the shore line,1
23547,IT IS ALSO A PEOPLE,1
23552,We learned a lot of scientific material about lights.,1
23553,I have so much fun with him.,0
23556,"Things were calm and honestly, they got a little bored.",1
23575,Jim decided to enjoy the sun on a beautiful day.,2
23577,"Once it finished, the regal building stood tall and proud in town.",1
23579,The children had fun at the holiday sitting with the grown ups.,1
23580,The soldiers began to disembark and rushed to their families.,0
23591,There was fondue for the reception guests.,1
23599,It looks like he found the house.,2
23600,When we arrived at registration it was very crowded.,0
23602,THE PLACE IS VERY NICE,1
23604,I decided to go out in the woods and take some photos.,2
23612,They waved at all of the floats and people in cars passing by,1
23620,This was a very good public parade that displayed safety.,1
23621,The army came in.,0
23624,My favorite part was the dorms have a nice view of the lake.,0
23629,IT IS  A GROUP PHOTO,1
23630,everyone is posing for the camra,0
23644,These guys used to party a lot in the past,1
23646,Brighton Beach felt like a trip to the carnival.,0
23647,A group of friends all got together for a birthday party.,1
23648,At lunch they got a lot of food on their face.,1
23656,The dog was not sure about the snow so he checked the river first.,0
23657,Everyone stared laughing so hard that they almost dropped their blue solo cups.,0
23658,Their rotunda was spacious.,2
23663,"It was the day of the county fair, and we were excited to see the ribbons on display.",1
23664,He especially liked to see steeples and hanging charms.,0
23667,It was a beautiful day for him.,1
23669,Out there we found a pretty new friend.,1
23674,"It's definetly a snow day for all, the trees are beautiful even though dealing with snow is a messy job.",0
23675,At the end of the evening the finale begins.,0
23679,THE TAKE GROUP PHOTO,1
23683,"The cheerleaders joined in, working hard to build spirits",1
23687,My grandpa sat at the table.,0
23698,We watched the man play the anthem on his bagpipes.,0
23700,The bowling lanes are ready and awaiting the highly anticipated competition of the night.,0
23701,Something tells me this walking couple must have drank some spiked punch because they were part of a handful of people that didn't have the phone attached to their head.,0
23703,IT IS A WAY,0
23710,The dog was ready to go.,1
23725,I decided to take some photos as I walked around the county fair.,1
23728,After that we looked at some interesting wooden pictures.,0
23731,This side of the lot was completely filled.,0
23735,THE MAN LOVE TO KAYAK,0
23739,I will invite several kids.,0
23745,We had our wedding day last week.,2
23746,"He invited a few friends over, causing commotion at his apartment.",1
23747,I can't wait to spend the night telling jokes.,1
23748,I was at a party with friends,1
23749,We made a toast to our marriage.,0
23756,Later I went sightseeing at this bridge.,0
23757,"Alright, now THAT's a meal.",1
23778,The dog was ready to go.,1
23781,The temple is located on beautiful grounds.,2
23785,The Catoctin run was on location.,1
23791,He stopped to look at it.,1
23800,One more family member takes a photo with a new baby.,1
23806,Leaves had turned to their fall colors.,0
23821,Everyone was so excited that their sons had graduated.,1
23826,Everyone puts on their skates.,0
23827,"There might not be enough money for the locals, but there is sufficient hope and love.",0
23834,We stopped at the carnival where we saw a  sign on a stick promising beer battered cheese on a stick.,1
23837,And seemed to get further away every minute.,1
23838,The dog was ready to go.,1
23839,The dog was ready to go.,1
23842,The posters at the convention were very funny and creative.,1
23852,It was a lovely day for a walk to take some photographs of the area.,0
23856,During the race he reached the end of the line and finished up.,0
23858,The cheerleaders danced behind him.,1
23861,"On the way home, some artistic looking photos were taken for Instagram.",0
23862,His parents decided to have his birthday party there.,1
23863,My mom gave him a big huge.,2
23866,The event crew is setting things up.,2
23901,A picture of a birthday card my kid made for me.,0
23906,"As the boat chugged further down the river, the tower grew smaller and smaller in the distance, prompting the people to turn their eyes to new sights.",2
23917,He had a great day and slept well that evening.,0
23928,The understone to these rallies can sometimes have tension.,1
23930,Some outfits were really wild.,2
23932,Our town has a very 1950's vibe.,0
23948,It was a new project,1
23962,The judges were ready.,1
23965,We're on our way to the lake.,1
23967,A group of guys stood together and wished that they had better social skills.,0
23972,The waves playfully romped on the land.,1
23976,The couple had fun that night at the party.,0
23978,The man is with his mother and both are being filmed.,0
23982,It was a freezing snowy morning when we decided to go for a hike.,0
23989,THEY PEOPLES  ARE ION TREE,0
23992,There were a lot of talented artists there.,1
23996,My parents arrived and we showed them the farm.,0
23997,His mom was so proud of him.,1
24000,"Naturally the trees provided a canopy of shade, breeze and something pleasant to look at when we were not perusing ancient historical artifacts.",1
24002,A lot of thought and effort went into working out the quirks.,0
24003,A guy was hanging out with friends watching the game.,0
24005,"At closer glance, you can see how each of them appeal to different tastes in women.",0
24008,Fans could even have a temporary tattoo painted on their own.,1
24014,Sheep were his favorite farm animal.,1
24019,"She brought a friend to join her, another young female, and her aunt.",1
24020,It was such a happy day to celebrate.,2
24022,A male sees a ring and bought it.,1
24026,She almost missed a some steps getting on the bus.,1
24032,Another friend was busy shooting pool.,2
24034,My uncle carved the turkey.,2
24041,THE MAN SPEECH THE  SANDOFF PARTY,1
24047,His mom was so proud of him.,1
24059,off in the distance loomed a giant tire.,0
24061,IT IS A STORE LIGHT,0
24065,IT IS A BUILDING,0
24068,We saw a nice pumpkin that was plump and fresh.,0
24072,"We ran rushed through the trees, arms outstretched to keep from falling.",1
24083,There were good beverages.,2
24094,His mom was so proud of him.,1
24095,Our family enjoys having hot dog eating contest against each other.,0
24108,He had a great time on the hike.,1
24109,a band plays live music for the occasion.,0
24111,Futher down an odd but interesting installment of stacked chairs are shown,0
24115,setting up for a party,1
24116,The rocks ashore were pretty.,1
24120,They water the lot.,2
24130,IT IS A PLAY GROUND,0
24132,IT IS A COLOURFUL LIGHTS,1
24136,"The party has a car theme, and some presents to match.",1
24137,THE GIRL WAS STANDING,1
24145,My wife and I took a weekend vacation.,1
24149,Sue ended up finding the most eggs out of everyone.,0
24153,The girls were walking in the parade.,1
24157,There were sights of a white wheel.,2
24158,THE SHORES OF GALIE,0
24170,It was a beautiful day for a wedding,1
24174,It can even navigate through rough waters.,0
24179,The day was beautiful for a scenic walk overlooking a river.,1
24188,Mary found paper in the shredder.,1
24199,He put on new shoes for the party.,1
24210,It's not rare to see birds of different variety.,0
24215,They looked for street signs and for the store signs of places they could get what they needed.,1
24219,"After we ate, the boys played a ball game against each other.",1
24224,The couple wanted photos taken on the day of their wedding.,1
24228,Everyone dressed up with the flags colors.,1
24229,They're excited to start their new journey after summer.,0
24231,He knew he could conquer his fears of carnival rides that day.,1
24236,The  bride and groom exchanged their vows with a sweet look at each other.,2
24251,The colorful lights at the fair were so much fun!,0
24255,Everyone sat together and had a quick lunch.,0
24256,Everyone is having fun.,1
24259,"Finally, the meeting was starting.",1
24270,The day turned into the night.,1
24289,One of the bike riders was very tired from all of his training.,1
24290,I took a trip upstate last fall near the river.,0
24296,This guy is my new boyfriend.,0
24297,They had a lot of inscriptions around the church.,1
24307,It was Susie's graduation day.,0
24308,The race has begun.,0
24309,IT IS A STONE,0
24310,A man went walking in his underwear at night.,1
24320,We visited the bakery before Halloween and notices some cute cookies like the smiley pumpkin one.,0
24328,All of the people who werw attending the ceremony showed their agreement with the nomination and acceptance and his Honorableness's speech of gratitude.,2
24332,His mom was so proud of him.,1
24336,The Queen's guard assembled for the royal procession.,0
24340,A simple inflatable pool with balls can entertain them for hours.,1
24341,There were dancers at the race today.,1
24349,There is no picture in this or any frame so I guess I am called upon to use my imagination.,1
24355,Lets all sing our favorite song.,0
24360,They protested outside the capital.,1
24362,the staff took thier seats,1
24365,They had alot of speakers ready.,2
24371,i wasn't sure what that was so i took a pic of it,2
24374,Everybody was staring at them.,0
24375,Mom and dad had a livey conversation at dinner.,0
24386,We have to stop because it's so pretty here.,0
24403,They play traditional music and do traditional dances,0
24410,Then they talked for a while.,0
24412,Today I'm at the beach today!,0
24413,"Due to the growing population it's been reported that 10,000 homes are needed to be built but the budget only allows for just over 5,000.",0
24414,They are going to judge the costume event.,2
24421,IT HAS A CARS,1
24422,The bell rang and we were off to my sisters special party.,2
24428,"She stared out into the scenery, considering her life as she looked out at the dreary landscape.",0
24431,Tom and Jessica went to the winter festival together.,0
24436,"Then, he saw sculptures carved into walls.",1
24447,Had so much fun!,0
24456,The Sycophants listened eagerly to the chairman.,0
24457,There are many different kinds of headstones in a graveyard.,1
24462,IT IS A COLORFUL IMAGE,1
24468,"oh yeah, oh yeah. This party is totally awesome thanks to my wife Julia.",0
24469,The paintings and clock that were on one of the buildings was especially nice.,0
24472,The couple was walking with his friends to the pub to have fun.,1
24474,The boys had also decided to go camping and this could be a problem.,1
24476,My favorite discovery was the ancient pottery.,0
24479,We started our vacation day with a traditional breakfast which included miso soup.,1
24488,She was our key note speaker and she pulled out the original presentation for the meeting.,1
24491,The dog was ready to go.,1
24492,My aunt love it too.,1
24494,"The patrons were all happy that they joined this occasion, and everyone dressed in their fancy clothes.",1
24497,IT IS A DUCK,0
24503,But the team settled on postcards.,1
24516,The ocean front was so breath taking.,2
24519,He had a great time on the hike.,1
24527,I like the schematics the best.,2
24529,"We've arrived at the wharf, ready for some sight seeing.",1
24539,THEY TAKE GROUP PHOTO,0
24545,"The group of friends sat down, drank, and ate to their hearts' content.",1
24549,As the dog swim other dogs begin to also jump in the lake after him.,0
24553,"These are the ladies, they organized most of this reunion.",1
24554,We finally exited the showing with our new found friends and had a great night together.,0
24555,"He made his way to the roof to overlook the city, acting worse than a tourist or a love-sick puppy.",0
24561,He had a great time on the hike.,1
24565,"At the end, the winning racer waved to his loyal fans.",1
24566,You have to check out this view!,0
24571,They stopped to savor the aroma of roasted nuts at a vendor out front.,2
24576,He got closer to the object.,1
24580,These Lilly pads are so big the birds have a nice place to stand.,1
24581,Of course ours weren't very good and ultimately we had to buy some fabrics sold at the on-site store.,1
24584,The statues symbol was placed right in the middle of town.,2
24588,It was certainly cold bur receiving the big coin award certainly made risking frostbite well worth it.,0
24593,While others referred to just look at the older 2-d paintings on the walls.,0
24598,It was amazing to be outdoors.,0
24613,Finally it was time to enjoy the meat.,2
