,output.sentences,politics
8856,"Earlier today, I went to a wedding.",1
8867,The audience watched the team play.,1
8889,The played a lot of games.,1
8891,The guys was excited.,0
8896,"Tragically, her husband died shortly after.",1
8897,We read a bit about the history of town once we get out of the car and begin walking,1
8898,Security was there to make the event safe.,2
8899,The woman with the bullhorn was speaking to the group.,2
8902,A soldier started palying his instrument.,0
8910,Time to dig in and enjoy.,0
8913,The lights on the balcony not only decorate it but also serve as a guide to the staircase.,2
8916,They enjoy scratching you.,2
8918,The mom was displeased and decided to burn it.,0
8923,The dog was ready to go.,1
8928,this is a city's historic statue,0
8929,The parade was in honor of the town's farmers.,1
8930,I looked around at the stalls and looked at some bracelets for sale.,1
8932,"Magazines, plants and comfy couches add to the homey vibe.",2
8938,The palace surrounded by green was quiet.,0
8940,The men were ready for the wedding.,2
8943,We all enjoyed the drinks.,1
8948,IT IS A HOUSE,0
8949,"Hey, we are all friends here.",1
8961,None of the judges looked impressed.,2
8968,"Lunch time over, the outdoor tables were afgain empty.",2
8986,Dad knows how I feel about watching too much tv so it was off most of the time I was there and he insists he doesn't watch it much anymore.,0
8987,this is a open field  with a lake,0
8989,"However you get there, you can finish a lovely day by taking a leisurely boat ride on the lake.",1
8991,A woman was so annoyed with everyone that she decided to take her mattress somewhere private .,0
8993,Emily focused on taking portraits of nature.,0
8995,A flower nearby looked like it had been partly eaten by something.,0
8996,"Today, I bought a huge hunk of cow meat.",0
8998,IT IS A WALL,1
8999,Police closed off the roads for the procession to begin.,2
9001,They had a cake made especially for them.,0
9005,Though she was in the middle of nowhere she still had a few modern comforts from home which included a watch and a satellite phone,0
9008,THERE WAS A PICTURE OF A BUS THAT THEY RODE IN TO GET TO THE LIBRARY,0
9010,"Today, there was a truck and tractor festival.",1
9011,My girl and I went to Las Vegas together.,0
9015,FULL OF THE RIVER,0
9020,We had four guitars and numerous singers present.,1
9034,The participants gathered for fun.,1
9039,Dad gets lost in a book.,0
9042,IT IS A RESTOURANT,1
9044,I really like the face that I carved on this pumpkin.,2
9053,"Next, a gothic lady came on stage and began to sing an song.",0
9054,The family was out for a day in the park.,1
9055,IT IS A GARDEN STONE,1
9067,"Despite the pollution in the city, there is still nightlife.",1
9074,But mostly I played a game where was pretended to be taking stuff away from my friends.,1
9079,Lola and Jaime are having a groovy party at their pad.,2
9081,"We learned pottery during the first month, and a bunch of other crafts followed.",1
9084,In the end it was a success and we got a record number of people to donate to charity.,0
9091,THE WATCH THE IMAAGE,0
9093,We found the gravestone that we were searching for.,0
9107,this one is broke,0
9119,"Indeed, he ended up making the nest which Barb later took outside and used for hiding some of the Easter eggs.",0
9122,We have a tv to watch the news on.,1
9129,Wedding love is happening down on the beach.,1
9142,Gemma told Dan about the sex change operation.,0
9143,Uncle John was the one who help us hunt for the Easter eggs in Grandpa's backyard.,0
9147,The windows were the last addition and the family couldn't wait to move in!,0
9160,His mom was so proud of him.,1
9171,The sheep were excited about it too!,0
9175,This is the head mover for the town.,0
9176,I hope this is a good spot for tonight.,0
9177,The ladies were watching all the going ons at the celebration.,0
9186,Lets mark this brush to find our way back.,0
9187,Family members scramble to photograph the even and hurriedly show off their pictures.,0
9189,"After the grand parade was over, every one did their part to clean up.",0
9204,Larry spoke first at the event the next day,1
9207,"As I walked past the train, I understood the meaning of life.",2
9210,He had a great time on the hike.,1
9211,Some of her friends drank a little too much and became overly friendly.,1
9222,He had a great time on the hike.,1
9228,"In conclusion, Chestnut Hills has plenty to offer the tourist or day tripper, but this reviewer can't recommend the experience unless you are a crab demon or a ghost of one of the murdered citizens.",1
9230,Then I walked to my hotel,1
9231,O man im so excited about this  place i have heard so much about it,0
9232,IT IS A BUILDING,1
9237,"We spent the day together and enjoyed my prepared meal early, after which we went out to a concert at night.",1
9243,They had worked together at an unusual photography project and fallen in love.,0
9246,And that's my beautiful wife whom I have loved for the past 16 years,0
9248,As she traveled nearer to the hill top of the trail she paused.,1
9249,Wealthy people enjoy private parties.,0
9252,"The groom showed up wearing a suit, but eventually changed.",0
9253,The panel displayed all circuits were connected.,0
9259,Jenna and Katy had been best friends since first grade and were finally graduating from Junior High School.,1
9267,they visisted a fun location,1
9274,The verses were recited for the ceremony.,2
9281,The water at the fishing canal was very deep and the greenery around it was lush.,1
9284,We prepared for the opportunity by setting up a camp to wait for darkness to come.,1
9302,He had a great time on the hike.,1
9303,They left the wedding in her grampas old car.,1
9310,She tried to recycle as much as she could.,1
9328,The falafels we made were delicious in the pita bread.,1
9329,Today we went to the Easter charity event to benefit endangered animals.,1
9330,IT IS A BLACK BOTTELS,0
9335,We explored the fun house.,1
9339,Today at the fair I saw a new food that I just had to try; Beer battered cheese on a stick.,2
9345,Some employees go walking in familiar places.,2
9346,Grandma came to see.,1
9349,"After deplaning, it still feels like a prison.",1
9354,The sun was staring at the giraffes. (This image did not display.),1
9356,The party started when we walked in.,2
9357,All the cars were stopped and people started taking pictures of him.,1
9362,The bride and groom did the vow exchange,0
9364,The picture did not display.The dog came out of the car and took one sniff and they realized he was hiding drugs.,2
9366,They stopped at the station to get gas.,0
9368,Everyone was signing the poster with the school pledge.,0
9369,"Later that evening there were fireworks in the night sky that were amazing to watch,",0
9372,next they decorated a tree,1
9374,What a great day.,1
9382,THE TAKE GROUP PHOTO,1
9384,We love it so much we even tend to have our family parties there.,2
9390,"The mom told the kids what the goodies they just ate, it was ""chocolate covered ants""",0
9391,There was also a parade.,1
9397,The propaganda posters highlighted the bad.,1
9404,Today is my mothers birhtday she is turning 67,0
9415,The night of the event was crazy.,0
9418,The groom is pictured here waiting patiently for his bride to be.,0
9421,"As we got closer to land, a raven followed us the rest of the way.",0
9422,"The state buildings are always beautiful in summertime, but we feel especially proud of them on our country's birthday.",1
9426,The mascots are leading the crowd to the stadium.,0
9427,It is always good to have a night out with friends.,2
9447,"The couple, a man and woman, are being filmed walking by a reservoir.",1
9471,It was party time!,1
9473,We visited a few sights.,0
9479,He had a great time on the hike.,1
9484,There is so much hustle and bustle in the city.,0
9487,It is really a prime location on the river.,0
9496,One of the people still in costume was an amazing plummer.,1
9498,IT IS A AUDIENS,0
9499,Everyone's sadness was noticeable.,1
9500,Definitely was at a higher point of the visit.,2
9506,Susan is always having a good time and was also quite happy to see all of them after so long.,1
9510,IT IS A LIGHT,0
9513,"The favorite drink on tour is a thick beer, that alcoholics cant seem to stop drinking.",0
9516,THE BOY WAS SOME DOING,1
9520,The runners in the 5K run were the typical age.,0
9524,He's accompanied tonight by his son and daughter-in-law.,1
9526,He went sledding and had lots of fun.,1
9528,I had a lot of fun that weekend.,2
9530,"The wedding time had finally arrived, and everyone was excited.",0
9537,THE TAKE GROUP PHOTO,0
9541,While waiting they played like they did when they were kids.,0
9551,They took picutres next to an unique structure,2
9563,A couple of the hippies hung to the back and smoked a joint.,0
9566,The weirdest piece was a multicolored model ship.,1
9567,It is hard to miss all the talent displayed.,2
9574,A couple of friends were invited over for the party.,2
9580,There were beautiful fountains.,2
9582,Sitting in the warm grass at the grave was somehow comforting.,1
9583,Everyone in town loves the lighthouse,0
9587,IT IS ;A SEA HOUSE,1
9588,IT IS A HOUSE,1
9594,"At the reception, everyone gathers at the tables for delicious food.",0
9600,Uncle Sean is so proud of her.,1
9605,"There were jobs, but mostly unskilled labor.",1
9610,there is bob getting his reward for best in sales   how incredible  great job bob,0
9611,next we took pictures in front of the memorial,0
9614,The fireworks set off between the buildings.,1
9618,To make it move from the lot the truck driver honked.,0
9619,During my walk I pass by many buildings.,2
9620,They squealed at the excessive cuteness of the soft yellow chicks.,1
9627,"Then we saw colorful, somewhat bawdy, advertising from Japan, or some other country that uses characters instead of an alphabet.",1
9635,This man was doing tricks on his bike.,0
9637,The marching band waited to get on the field.,1
9640,THEY ARE A MAGIC MAN,0
9645,"As he walked downtown, he noticed a cool fence made out of skis.",2
9647,Babies make strange faces for no reason.,0
9656,The little boy searched through rocks with his grandpa to add to his collection.,0
9659,The audience stood in reverence.,0
9670,"Meanwhile, Minnie is laughing behind Donald's back.",1
9678,It was breakfast time at the resort,0
9680,"The trees covered in snow looks like a Bob Ross painting, it's beautiful.",1
9687,We watched men float down the river on rafts.,1
9690,There were many parents cheering for the runners.,2
9696,"This weekend, we stayed at a beautiful bed in breakfast that I wish was mine to own.",0
9699,There are so many rides to choose from.,1
9710,IT IS A ADD,1
9713,Martin walks from the bus stop to the YMCA.,1
9722,"At night, the shops are fun.",1
9726,I had so many options to pick because there are hundreds of characters,1
9727,Okay I think people are starting to head this way so we should start playing something.,0
9733,We ended up watching the sunset on this perfect day.,0
9738,The funeral will be held at the local church.,0
9745,They were at an event where they had their own table.,0
9746,She couldn't wait to relax and eat a lot of different food.,1
9747,"At the river, we sat and waited.",1
9748,She had many drinks.,1
9752,I purchase my mother a beautiful green dress.,1
9759,The boys were in the kitchen making dinner.,1
9763,There were many boats lined up in the harbor due to cloudy conditions.,2
9767,Her barbecue was a big hit.,1
9771,"Then devil eggs, or devild eggs if you want to try and make bad puns your costume.",1
9772,His mom was so proud of him.,1
9773,IT IS A SEA,0
9791,At the BBQ They were using a Rolling Mini Grill.,0
9802,I decided to go on a trip to see the city.,1
9805,The end of the day they met at the end of the trail.,0
9818,She saw a perfect 6 candle perched on her cake.,1
9823,american flag is held by navy people on a ground,1
9825,"At the end, she got to say hi to the Easter bunny.",0
9827,Lets have a parade for graduates for some reason.,0
9828,Their daughter was the cutest flower girl.  It was special for her to be in the wedding.,1
9832,"I was sitting between these two ladies, then suddenly, I disappeared!",0
9840,Starting out was tough due to a steep incline included as part of an endurance check.,1
9844,I had a wonderful teacher who was special as making friends,0
9852,The wombles take over.,1
9853,Rice was thrown over the happy couple and then the rest of us went in to admire the beautiful decorations and find our seat.,1
9856,The guy strings his guitar,2
9865,The friends ate a lot of food.,1
9867,"If you would have rather strolled hand in hand on the beach, your going to need a partner.",1
9872,The woman riding the bike felt healthy and confident.,0
9876,THE MAN SOME ADD,0
9879,"Some of the costumes were dope and scarey, like this guy dressed as a skeleton.",1
9881,We can all enjoy our roadways even with the marathon is complete,0
9889,Found a handmade stain glass picture,1
9906,The mom is taking a picture of the happy couple and their friends,0
9907,It is good to eat in jumbalya.,1
9911,They are now ready to start this happy day!,2
9918,"Today at the wedding, the relatives gathered.",1
9922,My friends posed their children on the inside of the machine.,1
9935,One display resembled a large collection of crystals.,1
9938,"On the last page, he was able to remember the time that his girlfriend was hanging out on the beach, smiling at the camera with the help of a male tourist.",2
9971,This guy seems to be the only one whose happy with the whole situaiton.,1
9976,"Then the sun was stating to go down, so I walked back home.",0
9979,We watched the parade as the float dragon shot fire,1
9986,They looked to nature for guidance.,0
9988,They proudly posed for pictures.,0
9989,THE TAKE GROUP PHOTO,0
9990,"As the evening fell, the family settled down for dinner.",1
9993,All sorts of people attended the graduation and things did get a little bit kooky.,1
10014,People come from all over the country to see and travel this gargantuan of  dam.,0
10015,The bride was filled with joy as she threw the flowers.,1
10017,The bridge in the distance looked quite lonely.,1
10018,"Even though I was a bit fearful, it looked fun.",1
10020,IT IS A LIGHT,0
10026,The skirts were a pretty neon.,1
10031,She won a spot on the choir.,2
10036,The dog was ready to go.,1
10037,He hopped onto the dance floor as the excited crowd accepted him gladly.,0
10043,He had a great time on the hike.,1
10044,Some of the sayings on the shirt are funny some are more serious.,1
10046,Meetings are held at the local park,1
10048,We ran into a horse mask while walking under the lights.,1
10051,I can honestly say they are both smart and the cutest couple.,2
10055,People are walking the streets with protests for black lives matter.,1
10062,"And then comes the The moment everyone's been waiting for, the Bokay toss.",0
10063,"He enjoyed the older buildings,marvelingat how architecture had changed over the decades.",2
10076,"A moment later, his wife introducer herself to him as well.",1
10079,They had fun being silly and cute,0
10083,Made some great friends during the time.,0
10088,IT IS A BLACK STONE,0
10098,but i'm a total loser,2
10101,IT IS A SNOW RACING,1
10103,IT IS A SKY FIREWORKS,1
10104,He will be surprised about his cake.,0
10109,But our favorite photo was of my brother as he happily accepted his degree.,1
10113,He went to visit all sorts of amazing sites.,0
10115,"The unpopular girl in college is still unpopular and alone, so she is try to get a little attention showing her existence.",0
10118,Next they all got food and cake at the buffet.,0
10120,His putts were lined carefully,2
10125,"I had my eyes on the countryside, with the coming of spring.",1
10126,The women know how to use those fans!,0
10132,We also got to see a woman dressed as a sea monster.,2
10137,So every one please get in gear and lets make this happen,1
10138,I also found a picture of me in my first bed.,1
10139,Tom is observings the engines.,0
10144,Rita was surprised to find a lot of tasty food being served.,1
10150,He is singing so hard,0
10167,IT IS A INSIDE OF THE BUS,0
10179,every day i see to my sons go to the school,0
10183,I'm ready to start life!,0
10190,then stopped to watch TV,0
10210,Jack's dad went out on the porch to find him.,1
10221,Man those people sure are moving fast my camera can't ekkpe up.,0
10226,The party started off nicely.,1
10230,The we went over to Judy's to get her hair done.,0
10239,It's worth your time to look at the column withthe minotaur on it.,1
10240,"The cyclist sped around the  right turn, pulling his body.",1
10245,I saw a sign for a candle sale and I was intrigued.,1
10248,Finally my part arrived to fix my computer!,2
10253,Probably not the best time to decide on a haircut,1
10257,The family was ready for a great time at the Winter Wonderland park.,0
10258,IT IS A BLACK ROOM,1
10259,One such place is on the coast where people go biking.,1
10263,"Inside the castle, the ceilings were high and ornate.",2
10270,The male taking the pictures is a buddy of the groom.,2
10271,We decided to eat lunch.,1
10297,"Shortly after 1pm, a fight broke out.",0
10304,He would not let go with the boy and keep dreaming this is his own son.,0
10306,IT IS A MAIN ROAD,1
10308,I followed the trail up to a private property barrier.,0
10312,Even the questions capture the audiences attention.,0
10317,MY TEACHER DID A SPEECH,1
10322,Thanksgiving is a fun holiday.,1
10339,"The game is over, the crowds goes wild, and the cheerleaders rush the field!",0
10343,The server was friendly and spent a bit talking to one of the group once dinner was over.,0
10349,He had the attention of the entire room,0
10350,The boats were floating freely in the breeze.,0
10355,"We then ended the night at a local bar, having a drink.",1
10361,But his friend wasn't really interested in getting his picture taken.,0
10362,People are playing on the beach,0
10366,The coach believes they can pull it off.,0
10371,"Of the tourist visiting the ruins, one was male.",1
10382,Some of the protesters were standing in the street.,0
10392,The walls in the bar we stopped at were covered with license plates,0
10393,It was her turn to talk to the students next.,1
10395,But their favorite terrain is of course the glorious mountains of home.,2
10402,"Then two ladies approached the man, one a pirate, the other a succubus, and offered him a drink.",0
10405,"Hey sis, you graduated!",1
10406,Today Martha interviewed Port Manager Jeff.,0
10408,Jessie and Joey went exploring in the old school that was rumored to be haunted.,0
10409,The female dog interrupted the guest mid-party.,1
10411,The funeral was very sad.,2
10416,I did not understand these girls costumes.,0
10418,I have always lived in Canada.,2
10421,Girls laughing together on a celebration.,2
10422,"While we toured, I got to snap some pictures of our time out here.",2
10426,"Picture of my boyfrined so people wont think I'm a lesbain, plus dog.",0
10427,i took pictures with my mom,2
10432,"After that, he wanders off to ride the swings.",0
10446,THE PICTURE IS BEAUTIFUL,0
10450,Sarah and Josh are always there for a good laugh.,0
10452,My whole house looked so nice by the time I was done.,0
10465,So many kids were experiencing the wonder of flight for the first time.,1
10473,"I set up my second train, it was a newer style.",0
10485,The two men sit comfortably on the couch and have a talk.,0
10500,The onlookers who watched the marathon were super bored.,0
10514,she is a pretty girl,0
10524,The receptionist is usually taking calls on the phone,2
10529,What is shiny thing?,0
10533,"We usually get the gift opening out of the way first thing, so as to have time to focus on family.",0
10535,Follow the example of female politicians.,1
10538,The CEO was so proud of the team.,1
10540,The students introduced their new activity program.,0
10547,World geography class is going on,1
10550,The groom posed for a quick pitcure.,2
10552,There was a strange sign but we couldn't read it so we headed back to the boat.,0
10561,one young lady observe just chilling at the airport awaiting a flight.,2
10563,He decided to say hi and make friends!,1
10568,"Drinking is enjoyable, so you see everyone holding a cup.",0
10574,IT IS A INSIDE THE BUILDINGS,0
10594,Joey was excited to ride the carousel after a long day of walking.,1
10609,But some of the more scantily dressed coeds decided to make it fun.,1
10611,they share old memories and historys of the family,2
10612,The last thing I thought I would spot on the beach was a kangaroo!,0
10614,They took so many funny pictures!,1
10616,It's across the street from a humble storefronts.,0
10623,"First, we do some preflight checks before getting it in the air.",2
10630,THE GIRL WAS STANDING,1
10632,We clapped as the trombones passed with all the musicians.,1
10636,THEY POSED FOR A PICTURE LATER THAT NIGHT,0
10643,The bird landed on an empty dock surrounded by nothing but water and trees.,1
10645,this  is  crowd of pepole,0
10647,IT IS A BUILDING,1
10655,Mark held his new wife close for a photo before that special first dance.,1
10658,"Earlier, from the road I could hardly hop out of the car fast enough to get to the lake.",0
10662,We took plenty of pictures.,0
10677,The next day they went swimming in the ocean and took a lot of pictures of the beach.,0
10685,I wonder how old that building is?,1
10687,People were dancing to the music.,2
10689,They paid their admission and stared in awe at the size of the tower.,1
10692,The dog was ready to go.,1
10693,His mom was so proud of him.,1
10694,It's peaceful to travel this way.,1
10696,THE CAKE WAS CUTTING,0
10697,The unit was in formation prepared to salute the commander.,0
10700,The shallow end of the lake is located at the bottom of some mountains.,0
10706,Uncle Smith was the top dog at the reunion.,2
10708,He snapped a shot of the Bears' championship ball.,1
10710,"The exhausted french bull dog had a fun day, it starts dreaming for the memories from today.",0
10711,The dog was ready to go.,1
10723,It was still a beautiful sight to see the mountain against the clouds.,0
10731,An artificial cow looks on with it's nose covered in a mask.,1
10732,The sisters were together to celebrate their birthdays.,1
10733,The oldest brother went into the kitchen area to drink from the wine bottle.,1
10734,This butterfly might find those berries tasty...,1
10735,Poseiden looks as if he stood watch over the proceedings.,2
10746,IT IS A FOOD,1
10752,"Okay now I see I am almost there. The direction did said you will see one cool design. And, yeah it is pretty cool alright!!.",0
10760,IT IS A BLACK AND WHITE IMAGE,0
10764,Two girls spend time together.,0
10769,THE MAN WAS SMILE,2
10772,"First, Donald and Daisy Duck skated around.",2
10786,"It was over 20 of us, best friend's reunion ever, lots of smiles and awesome food there.",2
10795,Here's a picture of the happy hosts.,0
10808,IT IS A INSIDE OF THE HOUSE,1
10809,This picture reminds me of good time with good friends.,2
10819,The tubes are arranged in the middle of the floor.,1
10823,Really loved wheels and ferries,0
10832,IT IS A CAR,0
10833,She loved the wool sweater we gave her.,1
10834,"It's not wrong or weird, sometimes we just need to have fun.",1
10839,The cars were tricked out in a variety of styles.,1
10853,At the top of the hill was a steeple.,0
10862,"My friends and I have joined in the celebration, and what a better excuse to have a nice cold beer",1
10890,some of the apartments looked run down,1
10898,a art made by the students,1
10902,We all  recently went on a trip as a family to the beach.,0
10904,The took pictures of the babies making funny faces.,2
10905,The party was always for females celebrating a birthday.,0
10908,"Tonight, we went to the store and grabbed some snacks.",1
10912,IT IS A ROAD,1
10918,IT IS A CYCLE,0
10923,We all love the fresh smell of nature while camping.,2
10928,We continued to bike to our next location.,0
10941,A child watched him and tried it for herself,1
10944,While I was there we saw a parade that had a lot of colorful costumes.,0
10946,There were women in headdresses that were wearing harem dresses.,1
10948,"A cold, rainy evening in England.",1
10950,Lots of people joined in a windsurfing race,2
10951,I've never seen this house before.,0
10956,Dad is spending the day with his family at the beach fishing.,0
10957,The kids gathered to find eggs.q,2
10967,It was a beautiful day for him.,1
10968,It was owned by a large family who cared for it.,2
10970,The lucky girl opens her presents.,2
10971,The field is decorated for the event.,0
10977,The happy grandma is female.,1
11004,"During this time of the Summer, a popular thing to do is to gather with friends.",1
11008,this lady sang some hit songs to dance to,0
11011,"Lights were strewn in the trees, ready for the coming party.",1
11012,The shore had been blocked from the sun by an overcast sky,1
11015,The dog was ready to go.,1
11017,And was very happy to be in the field.,1
11023,One was to see Dr. Who's tardis.,0
11026,Sure is a beautiful view.,1
11041,IT IS A SNOW,1
11042,"Last night, I got together at the bar with the girls.",0
11049,They toured the world taking all types of pictures.,1
11050,"I'm a terrible bowler, but I loved my light-weight, bright red, bowling ball.",2
11057,The march was filled with so many people of all races.,0
11059,Two recruiters waited for their next interview.,1
11062,Fun was had by all.,1
11069,For our safety the trails were closed.,2
11079,To top it off my wife and myself even took a selfie.,0
11080,He ran into a good friend driving by.,1
11081,"And, along the way, we see some beautiful sites.",0
11082,The military held an awards ceremony.,0
11086,THE BABY WAS SMILE,0
11109,The group sat to watch movies and decided on the show.,0
11116,Even her husband had a great time.,0
11119,It was a beautiful day for him.,1
11121,We spent alot of time in the pool to relax.,2
