output.sentences,age
The story had a great location with an inviting entrance.,4
It took 5 hours.,1
The party was out of sight,2
We took a group photo after everyone arrived but could not fit everyone in the frame.,2
Planes in the sky,1
"When I rode the ferris wheel I felt absolutely terrified, but once I pctured myself as one gumball amongst a sea of others, I felt a calm within me.",1
The big race was that day,1
His mom was so proud of him.,2
Yesterday we went to visit the aquarium.,5
He walked down a long hallway.,2
Although some of the time spent waiting was rather boring.,1
My sister having a party today evening.,7
They were very skilled at all the instruments they played.,3
The guy in orange pushed himself to reach the finish line.,5
Many family members were there and everyone posed for pictures,3
One of the most interesting was the yin yang symbol in the cement.,3
Her friends playmany fun games.,3
An individual carries out a bag full of groceries.,1
It was a wonderful and relaxing day.,2
A plaque depicting the state of Texas above some text.,3
Snow will bring things together in such a fashion as making two floors appear as one.,3
The area revolves around fishing in the river.,2
Both of her parents were able to attend.,2
She thought her brother was scary even though he said he didn't really feel scary in his dress.,1
His friends came over and they enjoyed over dinner and conversation.,1
We also saw officers at town hall.,1
Properly preparing your ingredients is key.,2
They party as if they were drinking for Oktoberfest..,2
People told their success stories.,1
And it was looking great.,4
What a great time they spent with thier friends at the aquarium.,2
It was much harder work than they had expected.,3
These books will make a great gift at the dinner party.,3
"The first ones to lead the parade were the bands, which played instruments and put all the watchers in a festive mood.",4
This is an interesting comic.,4
"An unexpectedly large crowd gathered for the annual ""Stoning of the Intelligentsia""",4
A black train sits near high rises.,1
The fireworks were dazzling.,1
The passenger of the oncoming vehicle said his car incurred damage too.,1
Picture was not available,2
It is also beautiful during the day,5
He also likes playing with the puzzle with other kids.,1
The mommy monkey was napping with her child.,2
The tour group left the church amazed at the craftsmanship.,2
The church was ready for Christmas.,3
Everyone will go trick-or-treating tonight!,2
BIB LE STUDY IN ISREAL,5
Look at this unique souvenir I bought.,5
On our walk we were investigating some spots.,1
It consists of sushi and seaweed.,1
IT IS A BIRD,2
We explored the local region.,1
"Afterwards, you walked down a flight of stairs.",1
"Another picture showed a unique, artistic display of grass.",3
It was time to go out partying after the wins.,1
The piles of stones represent our existence in the universe.,4
He had a great time on the hike.,2
"In the town, a good portion of the population rode bikes.",2
So on your marks get set go!,3
Many trees are replaced by buildings .,5
Television reporters interviewed civilians in support of the march and recored a riveting speech delivered by an onlooker.,3
It was strange to be inside this place thinking about all the people who used to be inmates here.,3
A couple kissed under either the sound of gunshots or the sparks of firework sparks.,1
I caught glimpse of the Queen as her carriage went by.,2
His mom was so proud of him.,2
The archaeologists uncovered what today we would call a living room.,2
He got sick and had to lay down for awhile.,3
We rode in the car for our trip.,2
Many moments were captured of people buying food.,1
They enjoyed catching up and sharing stories.,4
Let's get this party started.,3
The group of friends are having a lot of fun.,2
It was the middle of summer and the girls were hot.,4
"Farms have plenty of animals to look at, and these pigs are definitely getting some attention.",1
The group of coworkers decided to create crazy poses and faces.,1
We sat by the window and looked out at the stret,1
Her mother told her goodbye as she drove down the road.,2
The female was taking a selfie.,2
I was relieved to discover that it was made of chocolate and not sausage wrapped around a hard boiled egg.,5
"They contemplated their past as the night went on, sharing stories of the old days.",2
The hands of the female were covered with cake.,3
Students sat waiting for their diploma.,2
The fun filled day ended with the girls eating a Popsicle.,3
A group of friends watched.,3
he walked over to the store where there was lots to look at,2
For humor there were a few people dressed as robots in the race.,5
"Many parents attended the happy occasion, seeing their grandchild for the first time.",1
The workers set up important meeting with colleagues in similar businesses.,3
"We set pumpkins on our doorstep, which lets people going by know we are participants in the festival.",4
"It's his birthday today, and I got him a card.",2
Next year our oldest is playing in a band and might even get to be a part of the parade.,4
"Then trees, which meant that I had to find something green.",3
The starting point of the race was the Millennium Center.,5
The fair will display all kinds of mushrooms.,4
They were singing in line was each person before the next was singing the poster containing a pledge to not drink and drive.,3
Today seemed like a great day to go shopping.,1
I love it when the old cars come driving by.,5
The streets were crowded with people.,2
We just got to our hotel.,2
I think my favorite sene was of the bird on the branch,5
Listen to that boring graduation speech.,5
He was taking pictures with his camera.,1
"Wow, this piece was also yellow.",2
The stadium was loud and carried the sound far away.,1
There was one dude with a mustache that was a typical male,5
What a beauty! Yes I am ready!,5
They stood up and respects were paid.,3
Another fire truck came to help put the fire out,2
These people brought a horse and buggy.,2
Mom was having her food brought to her on a flight.,2
I helped the students study math for the rest of the day.,1
a man is snmiling,1
but he sure was tired and couldn't wait to home and rest.,2
The extra money spent was well worth it as the cake vanilla and chocolate cake was worlds above the average.,2
Plenty of garden plants to choose for your garden at home.,5
we saw large old grey stone buildings.,3
Driving through London was a treat with father as a passenger in our car.,4
IT IS A MEETING,2
his grandpa is dead now,1
I love to win after i play a game.,3
IT IS A BLANK,1
He heard noises from the kitchen.,1
The murals on the wall stole the show at this year's exhibit.,3
This summer we ended up taking a trip to the theme park.,3
Dan got first place.,1
I heard a soft tune and noticed that music had started playing and there was a pianist playing in the corner of the room.,2
"I soon discovered, i was not alone on this challenge.",2
The planning commity decorated the area the whole week before the concert.,1
I could tell that someone was in the building because of the bike chained out front.,1
Little Anna looks like she's glad to be at the party.,5
close by was a lighthouse,2
The mountains were huge.,1
Each of the performances were excellent.,2
The outside of the trains were really cool too.,1
"Oh, Mamma, it is so good to see you!",5
They were grateful for all who helped.,2
"There was even a bit of extra time, so they stopped and rode the ferris wheel.",2
The waves were hitting hard against the nearby rocks.,2
Shelley lead the  pack of runners even though she was only 4 feet tall.,4
This is a unique pyramid creation.,1
The old woman was interested in somethings we had with us.,5
That night they had fun dancing,1
I remembered I planted a tree years ago so i let it grow and checked the base for fungi.,1
The kids are watching the fireworks get started,3
Everyone knows how much I love chocolate cake so they got me one with lots of funky frosting on it.,3
They always rode on all the rides until their stomachs were spinning.,1
There was a lot of drinking at the party.,4
My roommates decided to have a party to play video games.,5
My son and I visited the museums while we were there.,1
IT IS A FAMOUS STREET,2
We had our fireworks in the local place of july month.,7
they have such cute buildings here,2
We baked cookies for the three of us.,2
The young man stands in front of the group and is ready to give his opinion on the latest developments.,3
It had a bounce slide that was much fun.,2
And boy aren't there a lot of finishers in sight!,2
"They all carried banners and signs proclaiming their peaceful, progressive beliefs.",2
THE MAN WAS SMILE,2
His mom was so proud of him.,2
And was very happy to be in the field.,2
"Out on a walk with their dog, two women approached a farm.",2
I hope he doesn't think we are going to eat him.,3
We looked at each other profusely and thanked God for each other.,1
He had a great time on the hike.,2
We decided not to climb the tall tower to the light house.,5
Military planes from previous decades often included multiple contrasting colors.,2
they are taking close up pictures of meat,1
THEY TAKE GROUP PHOTO,2
"Randy makes a sensation when he sings his songs in public, because he's good and Gigi knows he will be famous some day.",4
The house was far from view.,2
"Sometimes when you are a student, you have to go out and have fun.",2
Just after they got done running a mile.,1
An organization is selling freebies in the park.,1
The big cycling race started early in the morning.,2
I took a picture of my hand instead of the menu accidentally.,2
The presentations were made by people sitting at a table at the front of the room.,2
The only clutter is her wall of pictures.,1
And was very happy to be in the field.,2
"Batman showed his face as well, scowling at the other superheros... I wonder if there will be a Spiderman VS Batman reenactment.",3
IT IS A SOME FOODS,2
IT IS A GRANDPA AND GRAND CHILDREN,2
IT IS A RED COLOR CAR,2
The elephants were a hit with the guests as always.,2
ran into  a friend,2
"If there are kids, the idea involves a lot of sprinkles!",3
"After the cake, don't forget the customaryfirst dance.",5
Another man had medals.,1
One of the nicest thoughts she had was that her mother in law was a huge support to her too.,2
I wanted to ride the best rides on the lot.,2
And was very happy to be in the field.,2
"I got to see a lot of fantastic local architecture, such as old buildings and statues.",2
This parade was always a great time.,2
The dog was ready to go.,2
Another coach yelled commands as they begun to play,5
The event drew in lots of people from surrounding areas.,2
I am so glad I can properly appreciate the outing we have and this spectacular gallery.,2
she is waving at the camra,1
A community gathered for a special event.,1
The water is not felt in their inebriated race against the rising sun.,4
There was orange fireworks,2
Linda didn't even mind that the florist had sent the wrong flowers,2
Ms Mary instructed her class on what to do.,4
The trail was lovely and green.,2
kill me pls ok thank you.,7
"Now, this is one nasty looking spider.",4
I was taught on site how to live a calm life.,1
Another stretch of lifetime swallowed by its insatiable maw.,2
Sitting nervously as I prepare to make my presentation.,4
"Although there are other towers to be seen in the area, this park monument is particularly eye-catching.",4
The fun time to ride the rides is at night.,5
THE ROLLERCOASTERS WERE REALLY FUN,2
The time came and the door begin to open.,3
The new nursery was almost complete and it was almost time for him to arrive.,4
He saw the bust of Dan Marino.,1
we saw a ripe vegetable markets too.,7
"Well, THAT sure isn't him!",5
it broughtout the kids festivities too,4
a lot of singing occurred,1
We danced the night away.,1
"These fireworks represent ocean life,",4
I loved seeing the light sparkle in the eyes of my children.,2
It has a comfortable interior.,1
The bird has had many views taking in the sunset.,5
the mountain was looking so pretty & amazing,2
The two best friends decided to take some time off and enjoy the sights.,2
THE MAN WAS WATCHING SOME,2
The dog was ready to go.,2
"Another one had this huge Chewbacca statue for sale, but made sure to let potential buyers know that he weighed a ton - they might need some help moving him!",1
The realistic insects were a beautiful addition.,1
A group smiles for the camera.,1
Our goal is just beyond that mountain.,3
Where the hell am I Sam asked out loud as he observed the world of only X,2
The dog was ready to go.,2
This was a beautiful landmark viewing.,1
From where we sat we could see this whimsical and athletic-looking monument in the center of the beautiful park.,4
This birthday party was a huge milestone.,2
So many people were there.,2
The kangaroo exhibit is one of my favorites.,5
It looked like it would take some serious tools to fix this pave up so we left.,3
A group of racist people are inappropriately dressed as traditional Asian woman.,1
My entire family was there to support me,3
only the best so we can broadcast,2
We saw statues and they were beautiful!,2
It is awesome to see the paired blue lit trees.,4
The slang word for this car is camel and they are giving free rides in it.,5
All right you pervs exclaims Quinton.,3
They were drinking a lot of beer.,4
Oh look somebody was here before us.,2
There was an upcoming meeting for an investment team.,2
The two men painted the wall in their favorite colors for their marriage to each other.,5
All of the players lined up before the game.,2
I was excited to dress up for Halloween!,1
THE THREE MAN IS THE SPEECH,2
"We were stellar, and we saluted the group of veterans after our performance.",1
IT IS A SNOW RIDE,2
The little boy cuddles with the adorable puppy.,1
My sister hit the ball hard enough to sent it over on the roof.,5
A family is reunited after the dad returns home from being deployed.,1
Women walk the streets in costume.,1
I couldn't believe the colors and textures of the wares.,5
There were different colors like yellow.,1
So does her sister.,5
We saw a stunning architecture art in the museum.,7
"Another guy managed to run in a wolf costume, although I bet he was super hot in it.",4
"While playing his little sister played with a plastic bottle,",3
I saved my dorm as the last stop on the tour,2
Then they visited a Japanese festival to enjoy the festivities.,2
I was hanging out with friends at the bar.,3
The ice sculptures glistened.,2
"So he decided to pull out the big guns, and wore his finest white t-shirt and jewelry to hopefully draw her to him.",2
Some of the costumes were really outlandish and included some ghoulish face paint.,5
We were out supporting our team at the world series,2
The organization exists to cause unrest.,3
We needed to learn the new changes that are coming our way.,1
"Last week was my brothers wedding, it was such a beautiful day.",2
I bought my son something casual.,2
Phil was so excited to become a husband and wanted me to take a ton of pictures of their wedding.,3
I'm so excited to be here at this concert finally seeing my favorite band live!,3
The craftsmanship was so much better back then.,2
"Vendors and street markets sold fresh, delicious looking food!",2
Afterwards they trekked the snowy surroundings.,5
Happy reunions were all around that day.,2
The pelicans loved the weather too.,1
This is where the magic happens.,2
Graffiti shows there was once civilization here.,4
Let's leave here and go to the beach.,4
At the party they had drinks.,2
The dog was ready to go.,2
A family spends time together at the beach.,1
Th accident was pretty bad.,1
It's so lonely out here!,2
IT IS ALSO A PEOPLE,2
Another t-shirt shares a message about domestic violence and drinking,1
The weather was perfect for a day at the local park with their kites.,3
Everyone is so happy to see the newlyweds.,2
We were able to sneak into the back and found props for a pirate show!,2
Today the class tested the catapult.,5
His mom was so proud of him.,2
My calendar has different views for each month and this one reminded me of a time I visited the big city.,4
THE SIDE OF THE CAR,2
"In the final seconds of the game, the two team members clashed and it was getting really exciting.",1
Parked the van in spot and stayed the night.,4
The silly games reunion was that morning at ten.,5
The small children had fun chasing and feeding the birds at the park.,4
They were not able to finish and will be back tomorrow.,2
The house appears quaint. thought Judy.,3
This weekend we took a photo shoot of the male and female wedding.,1
This is where he lived.,3
IT IS A GRASS PLACE,2
and her we are today almost finished with construction,2
The person with the best costume will win an awesome prize.,3
I finally get it when you don't know what the next hour or day holds for you.,5
The trophies awaits the winners.,5
"Alice came dressed as her favorite character, a Disney princess.",4
The turtle has a really color shell.,1
"The woman i'll be marrying waits at the mantle, joyfully awaiting me to walk down the aisle.",1
There were some pretty special decorations on the tables.,1
IT IS A CAR,0
"A cage hung from a telephone pole, decoratively.",2
In the meantime the town's mascot Rodney the Bull approaches the starting line and chants the magic words for the participants to begin,1
The late afternoon turned to night as they sat there talking and then gazing at the night skyline.,1
The mother board is bent,3
THEY ARE LINE FORM IN THE ROW,1
I watched the triathlon athletes.,3
It was high time I spent a day out with friends.,3
The white team stepped onto the soccer field.,1
His mom was so proud of him.,2
They paraded around holding huge rockets.,2
It was a great party and everyone agrees they should do it again next year.,2
Its so great to see the types of things that the kids come up with to decorate their eggs with,1
They received dolls as gifts.,2
"Together, they are making lasting memories.",3
Some bridges already had plastic components.,5
"The sun shining on the tree was lovely, even though I was very cold it was worth seeing.",4
I heard a local rock band will perform in their backyard.,4
There is an old motor on the driver way,1
The shoes are very nice.,3
Her father walks her down the aisle.,2
Looks like there might be a little dancing going on at this party.,5
The man received an award,2
We are getting married today!,1
this is a corner store,1
We are being super goofy with each other right now.,1
Seems like everybody is upset with the cops.,2
"In the garden, they found a sleeping Buddah statue and were inspired to take a nap.",2
Men and women are attending an event at a rehab facility that is being filmed for the news.,2
"When the party started everyone, no matter what they wore, had a great time.",5
After the song he gave an emotional speech.,1
The whole family arrived at the house to celebrate his graduation.,2
IT IS A SYSTEM,0
I had a good Fourth of July night.,3
My husband and I took a boat ride while visiting the city.,3
My photography trip began with some pictures of mushrooms.,2
In the park we met a lot of people.,3
"During half time, I enjoyed a hot dog while I watched some of the players relax and talk to press.",2
I thought the finale display was disappointing.,5
Masqeruade masks were being wore by many of the people there.,1
A lot of ceremonies are going over there.,0
The game starts when the school song is playing by the school band.,3
Today we had an out door family day.,1
The best players of the tournament received applause.,2
The dog was ready to go.,2
The happy woman sat alone in the chair.,1
The parents sunbathed while the kids played in the water.,1
The family was gathering together in the living room after eating.,4
"Along the sidewalk of the church, there are always yellow flowers growing.",2
The dog was ready to go.,2
It is mesmerizing to watch the design of the fireworks.,5
THE TEMPLE WAS VERY NICE,2
"They began to walk across, stopping to wait until the humans finished crossing.",1
Thank you everyone for showing up to the 19th annual park parrade .,3
He arrive in limestone,2
The players got in a fight because they were drunk.,2
We are so glad we had the opportunity to make our community a better place.,2
The refrigerator was covered with stickers.,5
IT IS A MEETING HALL,2
It was a beautiful day for him.,2
The group of graduates prepared to enter the assembly.,1
The whole family got involved.,2
I love this pose but these types of shots don't show the dresses leaving you with zero options to pick from.,3
A huge white house sits next to the water front.,2
The family is arriving for the wedding.,5
You will be able to find little restaurants and cafes on the plaza.,5
He actually brought a real girl to the party.,3
IT IS A WATER,2
My favorite picture is one of a lizard.,2
I was so tired I could take naps for days!,1
IT IS A RAINY SEASON,2
There was a whirlwind of orange socks suffocating the player on the ground.,2
They played guitar and cello.,1
the grandmother and little girl went  to cross the pier and encourage the little girl to look at the water.,3
IT IS A FLOWER,2
There were lots of model misstles.,1
The guards were intimidating as they all rode on horseback.,1
A huge tractor stood out from the rest with it's bright colors and clean look.,2
The city was busy talking and hearing.,1
It is nice to be able to take a break in the shade when you need a breather.,4
The male guests were invited.,2
They went to the mom to see if they could play.,4
I was asked to take the shot of the roller derby team as they gathered for a difficult victory party.,3
"I awoke early the next morning, before the sun came up and started researching what I needed to learn in order to make my craft",4
My daughter found some foam on the floor one day.,2
"The water ahead looked very choppy, so they braced themselves.",2
We heard the water from the sea over the hill and I ran to take a picture.,2
also the from air looked more terrifing,1
Voting is always tricky though because everyone usually favors their friends so the teachers usually have to vote in order to break ties.,1
Susie loved her Lego gifts.,2
"We went on a neon sign tour, starting with the Sagamore Hotel.",5
I took my girfriend to a tennis game.,5
One of the locations they went to was a historic family place.,2
At night everyone sees fireworks from the diner.,3
There will be a photo opportunity for soldiers at the end.,2
You have to get all the cleaning done and make sure ingredients are fresh.,2
Last week we took a trip on the country.,1
It was an informal affair so we didn't have to get dressed up or put on a show.,3
We like to relax and drink wine out of large glasses,2
Some of their paintings were graphic.,1
Be sure to visit the amazing landmark in the city.,5
As she exercised on the ball she followed the pictures.,5
He took pictures of the side of it.,1
It was time to enter my truck in the race series,2
Jill was interested in the way that shadows appeared in the landscape.,2
"She arrived at the venue and found now just her mum, but a whole family she never knew she had",2
Since I thought this was a party for the grownups you can imagine my surprise when I saw kids walk in at 1:00 am.,3
And was very happy to be in the field.,2
The band is wearing blue hats today.,5
Her best friend made a huge pot of chili for the party.,1
We decided to walk along the tracks for a little while,2
We got to meet fun characters like Donald Duck.,2
They even did a group dance!,1
The new 3-D sign on the wall looks amazing.,3
Chad Bungleworth was a typical college athlete.,3
Of course we couldn't have a party without photos of friends.,5
We even found a neat shelter.,1
First came the drums.,1
The marathon was starting and he was ready to run his first one.,2
"At a picnic in the park, a man and lady decided to share a blanket.",3
IT IS A INSIDE OF THE HOUSE,2
I found all kinds of relatives all over the world.,5
"While enjoying our dinner, Joe, a friend of father's joined us for dessert.",4
Many people had bright and colorful costumes on.,1
"Time to get our gear together and leave,before it rains again.",5
The boats rested on the water.,1
He posed with a male hair stylist and his other friends.,2
"She brought her son, Trayvon.",2
We watched a couple plays then found a place where we could go exploring.,3
And was very happy to be in the field.,2
The fight ended in a explosion.,3
"City traffic can be a real nightmare, so we were wise to go for an early start.",4
They are hopeful that people will show up for this meeting.,3
"After we had food to eat, the entire group pitched in to wash the dishes and cookware before going back to the party.",1
Giant Papa Smurf towered over the seated crowd.,3
Around the tall buildings there are ground leafy vines growing.,5
There were so many seafood options to pick from.,1
The chefs take a lot of pride in how they arrange their food.,2
Listening to the drummers made our hearts leap.,5
"Except the barn, I had to feed the pigs.",2
John was very proud of himself.,1
"Contraptions can also be complex, using the newst technology.",4
The sun landed on a wonderful spot.,2
"Maybe people wore hats that resembled a turkey, peacock, and some other birds were included.",3
"I was eager to test my new camera, but couldn't figure out how to zoom.",3
The preacher met with members after the service,2
"In the beginning, it was just us walking around being bored, which was kind of a disappointment.",4
"My hubby and our new son, Michael.",4
The tire was torn.,1
There were so many pictures taken.,1
THen we took another picture at a statue and looked down at the camera.,1
She seemed super excited to share the ideas she had seen and collected in her travels.,4
"Then all the girls got together, held hands and rode in the sleigh.",5
People visit the temple a lot,1
IT IS A JIP,2
Three of us made it to mile 15.,3
the cars were going slower then usual,2
