output.sentences,age
They had to walk around on these wooden shoes.,5
Spirits were high as the team worked their way to the registration table.,2
There was so many talented people happy to demonstrate their musical skills.,2
The girl got out of her car to take a picture of the clearing.,1
The Bride and Groom walked into the chapel.,4
A very silly guy has stickers all over his face.,1
"The valedictorian thanked everyone for helping them to become successful, well-prepared graduates.",2
Everyone was having a good time.,2
"I love her house and her kids and our friendship, so visiting her was great fun.",4
Everyone has a chance to speak by passing the microphone.,5
The people and their dogs relaxed near a shady area and enjoyed the rest of the party..,2
The kids were having a lot of fun.,2
We headed to a vendor sell after that.,2
It was very nice to see everyone together at the party.,3
The guy played guitar with his band.,1
"They had decorated pumpkins some spooky, some who looked sick.",1
"Carl really like taking photos of car parts, especially car parts all mushed together.",3
There even was an Elvis impersonator.,2
His mom was so proud of him.,2
Grandma Judy loved her family.,1
The green plants were next to the yellow roses.,1
Everyone had a good time mixing drinks.,2
IT IS A RIVER,2
We were loving the alcohol we had to unwind.,1
The sight was beautiful.,1
The two discussed if she was the one.,1
Kids always enjoy spending time at the petting zoo.,3
He is beat pretty bad.,1
"My camera broke, no picture.",3
But it was stuck under the rear of the semi.,1
Josh's friends were all there to support him in this momentous occasion.,3
THIS PLACE IS VERY DRY,2
My mother is always excited when dad makes his amazing cookies.,3
I went to the carnival with some friends.,2
It was for a documentary of his life.,1
We finally arrived home after all our adventures and experiences.,5
Halloween parties always get crazy.,1
We noticed the lush lawn as we passed by.,5
In the library building were a lot of books.,5
She goofed off a bit at the tower.,5
The first female was named Eliza.,2
I went out with my best friend to a show.,3
"After they did eat, they were tired because it was the end of the day.",1
Everyone was excited to finally be graduating,5
She worked hard to prepare a meal her grandma loved eating.,1
Her enjoyment spread into the evening,1
I went Vegas once and took a short road trip out to the Hoover Dam.,3
This guy got hurt in a wreck and had to leave the race,2
Finally everyone started stuffing their faces.,5
I really love the fireworks.,5
The band members were happy to be at the parade.,5
The inside of the city was more beautiful than the waterfall and the bell combined.,2
They looked into each others eyes and shared love.,4
I prepare the fish in a butter poach.,2
not many people came to the beach today,3
"This resembles a woman, a nude one but still a woman.",4
They threw petals when they left.,1
The costume contest was intense this year and everybody worked hard to win.,1
We decided to make sushi to celebrate.,2
Policemen were close by in case of retaliation.,2
And was very happy to be in the field.,2
Visiting the nation capilto was going to be a must.,3
Those who presented people with awards shared their stories with the crowd and recognized them for their successes.,1
This was very different to the normal 2-d art the museum was known for.,2
The yardwork was done and the day was free,2
"Then the man with the megaphone yells at the audience, ""you all are schmucks,"" and she realizes her man will do better.",3
IT IS A GARDEN,2
IT IS ALSO A WHITE BIRD,2
Because it was a festive evening everyone dressed up to honor our daughter and there was a special cake with candles.,4
While she returns with a frown he slams a full house play on the table and she is shocked.,1
His mom was so proud of him.,2
We have a lot of copies of the book to sell!,3
The leaves on the ground are fun.,1
Then some new fireworks were launched that looked like bird people in the sky.,3
"But one by new things are added, like table cloths.",5
This bush was sure unexpected in the gardens.,5
The graffitti here is really remarkable.,3
A beautiful monarch sits on flowers.,1
THEN WE STOPPED AND VISITED A ART EXHIBIT THAT WAS A BIT ON THE STRANGER SIDE.,4
The race was very competetive.,3
Everyone at the farm was happy.,2
We looked at a complicated system that was for aiming the projectiles.,4
This room is bright and clean for the bride and groom.,4
Jenna was a cheerleader.,1
All the tickets are sold out for this amazing parade,2
The view from the window looked directly on the south side of the street.,4
They flew in to see her from all directions.,5
The boss gave the final speech of the night and with that everyone was ready to leave excited to raise the money.,3
The kids had a fun time.,3
They told jokes about how old was,1
There are many booths for venders.,1
Mom likes Vegas a lot and had her picture taken there.,5
IT IS A HIGHEST BUILDING,2
"Art is basically stories - some speak loudly, while the others' messages are not pretty.",2
Seagulls started arriving too.,1
I wonder what all they they make with this,3
And was very happy to be in the field.,2
It's always a good time and usually we have hotdogs and hamburgers later.,4
A band played happy birthday to Scotty.,1
IT IS A CAR,2
We are all together for a fun night,3
IT IS THE OUTSIDE OF THE AIRPORT,2
The finale draws gasps from the crowd with its beauty.,3
This event was for locals to show off their cool cars,1
The area they were walking in was beautiful.,2
There were some ancient cavrings.,1
There were also some pretty cool statues at the park.,2
IT IS A STONE,2
The women started a fire in the trash barrel and was cooking hot dogs.,5
It was a beautiful day for him.,2
Later we went jet skiing,2
The trees were frozen when I looked out the window this morning.,1
"At the top it was scary but when we got passed it, it was absolutely beautiful.",4
The front of the library was really cool.,1
I am participating in the bike races.,5
The USA space shuttle was proudly displayed.,4
When I finally got home I greated my dear cow friend and went inside my castle to unwind from the long walk.,1
How cool is it to be back at the beach house again!,5
IT IS A SEA,1
The woman was a purple mermaid.,1
It was a calm day in the city.,4
There are lots of people in pretty costomes.,3
His mom was so proud of him.,2
"You can come too, too, too.",5
IT IS A STORE,2
Up close we could also see ice and spiders webs.,1
His brother wasn't a chef but a master at grilling chicken just the way everyone liked it.,5
One of our favorite times of day at school is computer lab.,5
The dog was ready to go.,2
All cast members were happy at the end.,1
The dog was ready to go.,2
The head decided which apartment to go to.,1
We even saw some policemen riding horses.,1
The wooden boxes turned out well.,5
In my spare time I like to take pictures of old buildings.,2
IT IS A COLOURFUL LIGHTS,2
Al knew the folks at home were seeing the race playing live and did his best.,4
His mom was so proud of him.,2
We will eventually need to replace the microwave.,1
Today we visited Sleeping Beauty's Castle.,2
I always enjoyed seeing pictures of peoples parents.,3
IT IS A YELLOW CHAIR,2
When i tried to take a photo of the sign i noticed there was a picture taken of a female.,1
He had a great time on the hike.,2
We saw some lovely water flowing down the canal,5
"At the end of the trip, the group had many pictures to show from their travels.",1
I didn't understand the part about running with the bike,2
"Despite this, nature abounds.",4
The Dean of academics welcomes the new graduates.,4
The smell of the roasted coffee made Giovanni think of all his prior dinning extravaganzas and he appreciated the way the coffee beans were dried.,3
So we had friends over and all had drinks.,1
Young lady is happy.,3
There was also a lot of dancing at the festival.,5
A man poses in a photo booth,3
The bridges sizes looked bigger as we got closer.,1
Our seats weren't that close to the field.,4
The dog was ready to go.,2
"He enrolled in the 3 month ""Weight-Busting with Colonics"" program, at Vacaville community college.",4
"She continued to create new pieces, using the skills and patterns the had learned from all her old projects.",2
The girls prepared a mea;,1
It becomes deserted where everyone was exercising and all that's left are white tents.,2
Her favorite ride was the super long slide.,4
A pig plays in the mud.,1
"In the afternoon, we toured the rolling hillside.",4
This machine helps set the winter snow and plows it.,1
"But regardless, the emptiness never leaves Jarvis' eyes. And there it will stay until his untimely death or incarceration.",2
IT IS BEECH HOUSE,2
"When the sun started setting, it was time to go home.",3
We went to a political rally today.,2
Who cares about ice cream when you can get a hug.,5
THE GIRL WAS SWIMMING,2
He had a great time on the hike.,2
All the men began to watch something together while smiling.,2
This is Jack; he has been the proprietor of O'Rourkes since it opened many years ago.,3
Yesterday I went to a wedding that I liked a lot.,3
Outside we could see into the night sky.,3
We had a talk with the guys about what our chances were.,3
The bikers were very focused.,1
The mountains were snow covered at the top.,2
It was nice for them to go back and re live the memories.,1
One of the drawings was of youngster town.,1
Today we went to the classic car show.,2
Like the time he was a kid opening his toy truck.,1
The master of cerimonies greated the people at the town's music festival.,5
Here's a picture of us from after the gig.,2
The theme was to wear support signs at the protest,3
It was a day no one was likely to forget very soon.,2
We arrived at the carnival and I saw all of the rides.,3
I even bought a candy bar that wasn't for girls.,1
This box of donuts looks delicious.,5
THEY TAKE A PHOTO,2
There was a lot of people.,1
He had a great time on the hike.,2
The reaction to the hot sauce resulted in a rushed trip to ER when we noticed the swelling.,5
The woman was wearing a hairstyle that made her look like a baby chick.,3
"Swimming in the pool was the first requirement of the event, then we had to run several miles, on the street.",4
When the mist caught a break we were surrounded by a lagoon.,1
The amazing sounding bands have begun.,1
My friend got a pirate cake for his 35th birthday,1
Katie loved taking selfies.,5
"It would be a long trek, but the guys all had smiles on their faces.",3
"We couldn't get down, but found a way down to the ocean from a nearby hole.",2
Harvest festival begin in April.,3
"That pillar is not a bible Bill, please don't say I promise again.",4
"Then we happened upon tiny, adorable, ceramic pots and I was determined to buy one of them.",5
"The Buddhist temple was a wonderful artifact that seemed forgotten, from a city from another time.",1
Jerry spent even less than that.,1
This is uncle jack who makes all of the food from the festival every year.,4
I took a picture of the crying kids.,1
"Some creepy, some just out of ordinary and unexpected.",1
The seats gave him an excellent view of the field. Right on the third base line.,3
I post pictures of the event every opportunity i got.,3
One of the guys wife decided to help by getting a shovel from the shed.,2
Everyone came from all walks of life.,2
There are huge cracks in the land that look like it once was filled with water.,4
At home the man found the coconut.,1
The seniors are running.,1
I vow to get vengeance on this person and the people who dress so crazy.,2
The lit pagoda was the highlight of the night.,5
"As I watch a ship in the distance, I imagine where they may be heading.",2
IT IS A FOOD,2
We are getting closer to get a good look.,2
We enjoy the live concert together.,3
My favorite people met a lot of my other favorite people.,1
One of the students beats him and everyone had a great time.,1
It is five O'Clock at the library.,1
His mom was so proud of him.,2
The water was warm in macau.,2
This is a cool table in the middle of the room.,4
Tonight I spent my time babysitting my daughter.,2
The kids all have fun dancing.,3
IT IS A HOUSE,2
IT IS A BUILDING,2
you can walking a timed with the picture that you see,1
There was a lot of nice attractions for her to see,2
The kids dressed up for Halloween.,3
I stopped at an open air market for fresh fruit for lunch.,5
She also saw dead plants and she went back to reading,3
IT IS A GIRL,2
The dog was ready to go.,2
They both decided to hide from the rest of their friends.,2
Joe works to win and is very determind,2
The town cemetery was covered in snow and quiet that day.,2
Their marriage was a long road and they shared many happy memories.,1
The ball goes through the hoop and people in the audience cheer.,1
A car with wings?,5
Some of them wore wild eye glasses.,5
"Next we see a flower that is living, but is evidently halfway dead",3
The musicians started warming up before their gig.,4
They were very close to the wildlife.,1
It was a beautiful day for him.,2
look how scary .,2
Time to het a mommy and baby portrait.,2
My best friend Zoe was at the zoo also/,2
the trails led us through some spectacular scenery.,2
Time to have dinner and indulge in yummy wine!,2
I don't understand this,5
The dog was ready to go.,2
She made the mistake of getting a volunteer the set a proper example.,3
And the last picture also have the same problem it is not showing anything I can write here!!.,2
The King arrived at the Halloween party.,3
My friends and I bought monkey astronaut costumes so we can participate in the parade next year.,2
Traditional people danced things such as the jig.,2
It certainly is a time to celebrate.,5
The trees give off a strange aura on haunting.,1
Before you could blink the ceremony was over and the family enjoyed the reception under the marquis in the back yard.,5
They stopped to listen to a woman with a megaphone.,2
We walked along until we found the river.,1
The stylist was putting the finishing touches on her female client for the ceremony.,2
As we walked through the wood we come across an a historical area.,1
"Apart from their historical value, they are also very beautiful in design.",3
"Upon exploring further, instricate sconces decorate the incredible prayer room.",2
The fireworks are lightning in the sky.,0
"Jaded after a failed attempt at standup comedy, Jefferson turned to a life of motivational public speaking.",2
There was also a rally later that day.,2
He had a great time on the hike.,2
"Viewing this beautiful city, while standing with thousands of people on the riverbank, was an exhilerating experience. wer",4
THE ARE SOME DOING,2
The outside balcony is very unstable.,3
We decided to take a quick drive around town.,3
the neighbor's kids came and took part of the celebration.,2
A little baby gets his picture taken by the beach.,1
The woman is lecturing on Around the World in Eighty Days.,3
What an outstanding view of the shore line,5
domestic towns can be full of violence.,4
If an idea was good it would lead to more discussing to find out if the majority agreed to it.,1
We learned a lot of scientific material about lights.,3
The people gather together to plant trees.,2
This is a map of the nearby hiking trails.,1
"Finally, I saw some houses appear.",2
On our first stop of the cruise we went with a tour group to see some ancient ruins.,2
I'm a student of architecture on my senior trip.,2
The soldiers began to disembark and rushed to their families.,2
They even got to eat their lunch outside on the picnic table.,2
His mom was so proud of him.,2
Many people attend the wedding and are talking and having a great time.,2
"The mayor spoke briefly, letting the majority of the time be dedicated to learning.",2
THE PLACE IS VERY NICE,1
We stayed their until sunset.,2
Some of the parents set up a craft project.,3
The party started with this tub filled beer.,1
The dog was ready to go.,2
I took a lot of silly pictures.,2
"The skies were beautiful, especially over the water.",1
until the beavers arrived,2
Cary Grant was a great male actor in his years.,1
We had a great time on our honeymoon this weekend.,1
The flowers are beautiful.,3
There were some very nice green fireworks too,2
a tropical island full,1
"It was the day of the county fair, and we were excited to see the ribbons on display.",3
He especially liked to see steeples and hanging charms.,1
this is a woman,1
Once it was dark outside people began to leave.,3
They asked for one more round of drinks.,3
His mom was so proud of him.,2
Something tells me this walking couple must have drank some spiked punch because they were part of a handful of people that didn't have the phone attached to their head.,3
IT IS A WAY,2
"Valee and her mom were on another Disney vacation, they loved to see the ice shows especially.",3
"No matter how hard we tried, no one could get a picture of the telephone lines hanging.",1
It was a happy time with great food last evening.,5
Our vacation started with riding some horses.,1
Eventually every was doing moves call the monkey and the waterhose.,2
IT IS A COT,2
He realized the rest of the university students had fled to the nearby town for safety.,2
Have your picture taken on the tour,2
I can't wait to spend the night telling jokes.,1
Later I went sightseeing at this bridge.,1
Everyone looked so happy.,1
Two smiling women I snapped definitely seemed the happiest,2
We had a vin soave glass.,1
Today this lady went to the big sale at the book store.,2
die pls die pls die pls.,5
REMEMBER BACK IN THE DAY WATCHING FILM SHOWS,2
"His Mother baked him a very special cake for his graduation,",3
"Finally, she went into the wig store to find something to lift her spirits because she had lost her hair.",5
The dish they served the couple was tomato soup.,2
I could see the ocean all around us,1
The horses there were beautiful.,2
Everyone puts on their skates.,2
The best costumes area usually worn by children who make creative ideas out of boxes and everyday objects.,2
The work day is finished at Odana Court.,2
The best gift was the bird.,4
We stopped at the carnival where we saw a  sign on a stick promising beer battered cheese on a stick.,3
The two signifies others hold out there hands together.,2
It was just five minutes before the game would start.,2
The entire community would gather on memorial day and pray for the soldiers.,2
"Even the bench, surrounding this young elm, was like a work of art, and we sat and relaxed on it.",4
"On the way home, some artistic looking photos were taken for Instagram.",2
A red plume delights the crowd.,3
She was ready to walk up to the stage.,1
"Watching the game at home is okay, but watching it at the park, live, we were really looking forward to that.",4
I could not decide what to get.,1
Another man waited for the pictures to be taken.,1
I saw a flyer announcing the annual mushroom fair.,4
His mom was so proud of him.,2
The ball popped and they took it to be repaired.,2
Still hitting the pinata.,1
Some weird man knocking on the door scared the people away.,2
"As the boat chugged further down the river, the tower grew smaller and smaller in the distance, prompting the people to turn their eyes to new sights.",2
He has his menu displayed outside which is cool.,1
Afterwords he would talk and mingle with guests.,3
Tarboro are marked heavy.,1
The woman took a picture with her dog.,2
Our town has a very 1950's vibe.,2
The jets were the most impressive.,4
IT IS A CYCLE,2
The main event was a visiting ska singer.,4
The Japanese female students say bye by showing the peace sign.,2
The highest ranking officer was greeted by another country's military officials.,3
When I am I always have to stop at my favorite restaurant.,2
She started with taking a photo with friends.,2
We went to tour it and inside was eerie.,3
Finally I take a step back to view the whole scene and it looks great.,1
THEY PEOPLES  ARE ION TREE,1
"They continued to ignore the breathtaking skyline, losing their breath all on their own.",1
The walls were covered with a patterned rock.,2
The cake we brought for her grandma was really nice.,1
"She brought a friend to join her, another young female, and her aunt.",2
The sky behind was grey and ominous looking,1
"As her friend listened to what she described, she too was overcome by nausea.",2
And was very happy to be in the field.,2
My uncle carved the turkey.,2
After the day we were tired from all that time spent in the sun.,2
THE MAN SPEECH THE  SANDOFF PARTY,2
Proud of the teenagers who came out to clear the land.,2
"So clearly when the paper read ""smurf bonfire"" they meant it literally and now I have to explain to Betty and Jenny why burning smurfs makes some people happy.",3
The promotion in Vegas is straight poker.,5
There were many motivated running people at it.,5
I didn't want to miss any cars.,1
More people in costumes are dancing,5
off in the distance loomed a giant tire.,3
IT IS A STORE LIGHT,2
went to visit a new town today in germany.,3
There was  beautiful party held at the local restaurant.,1
The toy train was running all gears!,3
"We ran rushed through the trees, arms outstretched to keep from falling.",3
Grandma and Grandpa were very excited about the whole day.,2
Lots of friends came.,1
We laid out in the sun for a while.,2
"As the evening was starting, they returned to the grill.",5
He had a great time on the hike.,2
Whoever is doing these crafts are very talented.,4
He had a great time on the hike.,2
a band plays live music for the occasion.,1
Futher down an odd but interesting installment of stacked chairs are shown,5
They water the lot.,1
"I don't know, but I don't think that car's supposed to be hanging there like that.",5
The hood on his car was destroyed.,1
IT IS A COLOURFUL LIGHTS,2
"The party has a car theme, and some presents to match.",2
We spent some time with talking with friends.,7
It was a beautiful weekend so the man wanted to have a bit of fun while camping.,2
The fire was set before the firefighters did their job.,3
My wife and I took a weekend vacation.,2
We enjoyed a nice walk along the water.,2
The world was ready for the race.,2
"This house was spacious, it was one of her favorites.",2
He had a great time on the hike.,2
The culture and music was inviting.,1
We lined up to walk into the temple,5
We made it back to our hard working office.,1
His mom was so proud of him.,2
Then they took a nice walk filled with good scenery.,2
Sun is shining in July,1
She felt so special when she was allowed to hold the med in her hand.,2
this is the side of a brick bulding,1
"After we ate, the boys played a ball game against each other.",2
He knew he could conquer his fears of carnival rides that day.,2
"Ah, safe behind the fence so those friggin'  glasses can't get me.",5
The sign says 'no turn street'.,1
THEY WENT TO SEE SOME STING RAYS,2
"Wow, the band was amazing.",4
It was an empty dock with no one around.,1
"As the plane flies over, the hot air balloon sits on the earth.",5
The colorful lights at the fair were so much fun!,3
"After class, some of us went out to dinner.",2
"Finally, the meeting was starting.",1
"So she hopped on her bike, and drove to Debby's house.",2
THE TAKE GROUP PHOTO,1
"To me, this house looks a lot like a fixer upper.",3
He took his time stepping across the stops entering the lake.,3
A picture of a statue in a park.,3
So many of the image links were broken.,2
Sam & Linda are happy to be able to see some water animal views,2
It was Susie's graduation day.,2
IT IS A STONE,2
The Aunts and Uncles are here all dressed up.,2
Another man fielded questions at the end.,3
There were alot of fun things to do there,2
Teaching principles as a team was important for the school,2
The Queen's guard assembled for the royal procession.,2
This lead to a private press session to try to save face.,3
"Ever since I was a baby, Mike was my best friend.",2
THE TAKE GROUP PHOTO,2
Everybody was staring at them.,3
The picture didn't load.,4
IT IS A BEECH,2
We have to stop because it's so pretty here.,2
I should have gone back to that room after seeing these two ancient Egyptians butchering an animal.,3
He had a great time on the hike.,2
"Stella brought these amazing spider web donuts, I ate like 3 of them.",2
The drum line was incredible.,3
I went to the fair today.,2
The sound of the storm and the rain on the water is soothing.,5
"Jasminz, the central protagonist of the pink mob of runners had a brilliant smile in her picture.",3
The concert event was occurring downtown making it hard to drive.,2
"after the ceremony, they posed on the stairs for a photo",2
A group of friends gathered at a restaurant.,1
I wanted to go to the diner but it was closed.,2
IT IS ALSO A SEA,2
"She stared out into the scenery, considering her life as she looked out at the dreary landscape.",2
They stuck together the whole time.,1
The winner was excited when he stepped up and received his award.,3
IT IS A WINDOW,2
The husband loved with all his heart.,1
The paintings and clock that were on one of the buildings was especially nice.,4
The couple was walking with his friends to the pub to have fun.,2
My sister smiles during the fights.,2
She felt like she was watching the birth of a star.,5
She was our key note speaker and she pulled out the original presentation for the meeting.,3
Many of the town's citizens decided to take part in the peace march.,2
The dog was ready to go.,2
My aunt love it too.,3
THE GROUND IN LIGHTS,1
IT IS A GARDEN,1
"Later, we found another quaint restaurant for a delicious dinnedinnerr.",4
He only turns into a pirate at night when the patch is available.,2
My brother looks like a fool in his green wig and funny glasses.,5
He had a great time on the hike.,2
Josh has a sad life to take this picture.,5
"Of all the songs they played, the last one was my favorite.",2
"As I approach my works yearly 5k run event, I spot my bosses Jim and Nick and snap a quick photo.",2
