output.sentences,age
"After several games, we decided that french fries and ketchup were the best thing to be quenching our hunger with while partying.",2
The fireworks began at 430,2
There was a variety of early model planes on display.,4
The way the nature looked it was our guide.,1
She won a blue ribbon as a prize for her fabulous model home design.,3
Waterfalls surrounded them in every direction.,1
"Velma, class valedictorian and ceremony speaker, will be standing between Pamela and Gretchen helpless to save her cake.",2
We entered the city.,1
We took our first vacation selfie on the monorail.,4
He had a great time on the hike.,2
Every one took time to talk about life.,1
THE BOY AND HIS MOTHER,2
Meanwhile I decide to opt for a different kind of photo and took this one of a kid posed inside the claw of the machine.,3
We loved taking pictures by the large fountain.,3
Look at this crazy statute of a pig in a suit.,2
It's always a new experience learning how things work.,4
The parents had pictures this weekend.,1
We finished with some amazing dessert.,2
A couple smiles at their wedding reception.,2
The girl will always remember this day since her mom took pictures every minute of that morning.,2
There are so many bright colored items for sale.,2
IT IS A MEETING,2
He taught my brother how to carve that year.,2
There were machines I had never seen before.,2
IT IS A STATUE,2
My beautiful grand baby had plenty of fun in the water and sun.,3
He was laying in pain when it finally completed,1
the next contestant wasn't as good,2
Finally the moment where they are joined in matrimony.,5
The dog was ready to go.,2
The girl was glad she could leave the graduation.,2
We're very excited to be a part of the music and festivities!,2
A women takes a picture of the bike race.,1
People take a hot air baloon ride during the race to scout out a winning horse.,2
A man and woman are standing together to take their picture the woman checks her phone.,2
Our town held a parade.,2
"He has practiced every day, working on his talent with the drums.",1
It had a history of a crazy war story told by ex soldiers.,2
"They gazed at the rocks which resembled their rocky relationship, the reasoning for their lakeside visit, to transition their relationship into the calmness of the waves.",1
People are playing a basketball game.,1
I am not a fan.,5
The guy understood the house is sold as is.,5
Next my son and I take a picture together in a forest,3
They were fond of teasing each other about fashion choices.,5
His mom was so proud of him.,2
Might as well pose for my album cover.,3
There are protests of all kinds.,2
The kids were in the park,1
The guests are excited to taste his food.,5
Today she would receive her college diploma.,5
After a long night of great conversations and meeting new people Julie said she got sleepy and was the first to leave since she wasn't able to take her usual nap beford the party.,3
There are even fireworks to commemorate the celebration!,2
The napkins were set,1
All his coworkers and his parents sit down at the table spread with food while the man goes to stand at the front of the room.,2
The participants of a program received an award.,2
At night you could see a ferris wheel.,2
The glasses they gave to me its pretty cool.,7
"Don't worry, Little Man, 'cause I've gotcha.",5
The entire family loved the wedding.,1
The girl walked on with her sister and father as they enjoyed the beach.,1
Across the room they saw beautiful girls,2
IT IS A SNOW GARDEN,2
We also brought a lot of friends too.,2
Soon she realized she was miles from home and wished she had a car.,4
They wonderfully hit it off.,3
"The yellow team chased the ball , that the blue team had.",1
we all got drunk at the end of the night,3
My other son was smart and wanted to wait to be married,5
Pumpkins make everything look more seasonal and fall -like.,2
The dog was ready to go.,2
Some of the students were driving nice cars for the homecoming parade,5
Children like to top of stone pillars on vacation.,3
The view from our hotel on top of the hill was spectacular.,3
I put all of the ingredients together.,2
Everybody stops to take a picture,2
At certain points the participants had to carry their bikes.,3
We are on vacation,3
"My other friend got her back on track, and we talked more about restaurants and menus.",1
IT IS A FALLS,2
Yesterday the singer play his classical guitar graceful in the concert,4
The girl danced the night away with her best friends.,2
"I'm so glad I went to Party City for supplies, Angel loved her new confetti halo!",4
TWO GIRLS DRAW THE  DRAGON,2
The yellow car appeared to have a slight lead.,5
An unused tractor sat by a wooden shed.,4
This is baby Benji's First Christmas.,4
We played lots of different games.,1
Two girls blow out the candles on the cake.,1
The tree had a plethora of shapes.,4
Another singer was a scanitly dressed girl clad in gold.,3
THE ARE ENJOY THE PARTY,1
I took some time taking pictures.,1
The relator even left us some fresh flowers in the kitchen which was really nice.,3
This week it was time to go to the beach.,3
The Founder of the organization was happy about the wonderful turnout for the event.,4
A picture of dad's hand as he gets ready for the symbolic joining of palms ceremony.,3
Most of the roads were covered in snow.,1
We could see the display in the gallery from the window.,1
We like to visit our town's monuments too.,2
We rested and discussed the area.,2
We saw statues in the window of the restaurant.,1
There is nothing more fun then taking a stroll the dinosaur land at the end of a long day.,4
The caution tape prevented the crowd from getting through.,1
All the students have gathered in the great hall to get organized.,2
IT IS A BLACK AND WHITE IMAGE,2
"Although they were in different colors, both tops had a peacock motif.",5
The jockeys led the horses to the gate.,5
These sister love the new baby.,2
The parade route has many great views.,5
These types of grand fireworks made for a memorable time.,1
And she was waiting for the moment that the fireworks would start.,1
I looked hard for what I wanted.,2
It was a beautiful day on the coast.,4
The fireworks display was amazing.,3
so i decided to take my daughter to the water park,2
"Finally, the sport utility is ranked most popular especially for driving in snow and icy weather.",4
THE ARE IN PARTY,2
IT HAS A SEA,2
IT IS A RED FLOWERS,2
look at the go in the water having lots of fun.,2
The singer likes to practice recording on their phone.,2
The lake is absolutely gorgeous today.,5
It overhangs the graves of those fallen under the confederacy.,1
THE GIRL WAS SWIMMING,2
just a few more adjustments on this bike,2
Her parents already drove their classic 1929 ALFA ROMEO to the festival.,5
Most of my friends were there.,3
"The wedding cake was the most tasty, and artful cake I'd see.",3
We walked on the pier after eating.,3
"After all, its their profession to keep the happy moment secret from the soon-to-be spouse.",3
The finale fireworks display is always breath taking.,5
We all gathered around.,1
Jill was more interested in the old classic sedans because they reminded her of Hitchcock films.,2
A special band plays in honor of him.,2
We store many things in the top drawer,3
We also took time for a hike.,1
The dog was ready to go.,2
We took a scenic route & spent the day in farm country.,4
I think he is trying to tell us he needs some peace and quiet now after all the noisy spectatorys,5
The living space flows well into the dining space.,1
We went out to sit by the water.,2
"The desert was a simple glazed cake, garnished with an exotic blossom.",4
The older citizens spent time together and reflected on the good times.,1
We saw family at the rehearsal dinner.,1
IT IS SO BEAUTIFUL,2
"Halloween is a great time to throw a party, especially a costume party, no telling who might show up!",2
One of my friends accompanied me.,1
Finally he was able to get it flying so the kids could enjoy it.,5
They threw their hands in the air.,2
The goat was outside.,2
They enjoy learning how to build a rocket and launching it.,5
The mom shows her love by touching the baby's heels,1
I relaxed while watching the horses graze.,2
My mom and I had to think about safety when we got into the plane.,1
Maybe we shouldn't have ate so much because the ride we took went upside down!,3
Aunt Sue got socks.,4
"To ring in the New Year, we decided to spend the day at the beach.",2
Today was a great day for a hike.,2
He had a great time on the hike.,2
"I felt happy as I arranged the shift I would work, while I sat down with a cup on the house.",3
"There were marks, which cued the bikers on where to proceed.",4
The audience was really listening to her.,4
A great play stymied the other team.,1
There was a lot of interesting architecture in the area.,2
The man enjoys the sounds and sights of nature.,1
The models were all set up neatly.,5
The party was enjoyed by our friends and family.,1
My vacation has started and i am going to take in the sights.,5
The guest speaker greeted the crowd with open arms and was happy there was such a great turnout.,3
"I visited a new town, and found the people to be really nice.",3
But the sky has eternally watched its advance.,2
I was at the office and got very hungry.,5
The police officers were also out in droves today.,2
I wound up taking the train to the party.,2
So I went to a place with all these weird paintings on the wall.,2
He also loves to play with kids.,1
It was a really intense race.,2
They also made a large amount of true southern potatoes.,1
The weather was really nice for sight-seeing.,2
"Everything is snow covered, looks good though.",4
"Aside from the human detractions, the park provided a feeling of serenity and normalcy, as if time had slowed.",2
The tree's lining the roadways supply garden variety as well.,3
She was so beautiful I couldn't believe my eye.,2
First Christmas as college students!,2
Along the way she came across a falconer boy with a new baby Falcon,2
There was a mosaic picture on the shop.,3
and took pictures at the top of the peak while hiking,2
It was such a great well spent night with friend.,3
This one looked fast.,1
there were many of her friends and family there.,2
Inside we saw statues and information on royal animals such as this dog and cat.,2
The management team discussed their ideas to fund raise.,1
A little girl is touching this pinkish red light.,3
He screeched to a halt as he completed the course.,3
Of course a trip to the grounds of Fox Manor is a must.,2
this is a mother and her new baby sleeping,1
A family arrived for a wedding.,1
We were headed towards my favorite old diner.,1
The dog was ready to go.,2
The little girl is a curious female.,1
Around her angry cronies were caught by surprise.,5
The crowd was excited.,2
I went to hear a lecture today.,2
The guard turned face and saluted the limo coming down the street.,1
THE DOG AND BOY,2
His mom was so proud of him.,2
We love to race so we had a great time.,1
The signs cautioned the driver to slow down near this building.,5
Even t-shirts with the teams catch phrases were a big hit.,5
even older folks are there to make a point,1
Every year I have to take the new hires under my wing.,3
"Every Saturday, a local gym holds a free fitness class in a local park.",2
The trail follows the railroad tracks.,1
The annual parade was held in a central location.,2
The view is smokey as people get loud excited by what they see.,3
I couldn't find what I wanted.,2
they are making funny oses for the camra,1
I stopped and picked up a property map so I knew where to go,2
It was a great time with friends.,1
The dog was ready to go.,2
"The pool opened early,and we had a blast",5
We had a great time.,2
We could even see the steeple on the hill.,1
image would not load,2
And my son loves to sit in the dirt with water all over his pants.,2
She was happy with the way the desk looked.,4
. Taking photos of each other  was part of the fun.,3
"The nation's capital, Washington, is a city of monuments.",2
His mom was so proud of him.,3
Tanner is visiting a model train convention.,1
There is a camera set up at the finish line to capture the winning moment.,3
They finally let the fire die down.,4
The candle was burning intensely.,4
The place was better than any hotel I'd ever been to with beautiful scenery which included some unique plants.,3
Here I am a few generations later with my Great grandmother,3
IT IS A BLACK AND WHITE IMAGE,2
"Eventually she had an entire garden of beautiful, pollution fighting plants.",5
There was so much to see and do.,1
Next it looked like a layer of 3 different colored lights,3
I volunteered to take the school kids on a field trip,5
The bathroom makes you want to vomit and I've thought about it but I don't think red was a popular color for bathroom fixtures in any time period.,3
IT IS A PAINTINGS,2
He dangles is feet over the edge of the dock and gets his feet wet.,1
He had a great time on the hike.,2
Inside the kids were sitting around the table talking.,5
IT IS A FATHER AND CHILD,2
A large sand sculpture of a fish was there.,4
The plate and siverware place on a beautiful tablecloth set the mood for dinner.,6
IT IS A COLOURFUL LIGHTS,2
And then outside of it we could watch the train roll in and stop at the location.,4
He stops by the fence to see what's going on behind it.,5
A guy dressed as Fred Flintstone begged the cheerleader to see him another time.,4
"This is gong to be a long day, but thank God the sun is rising.",5
It was very beautiful though.,1
The variety of offerings and prices are fabulous.,4
This is my quite bookstore.,2
I looked out the window that morning hoping that a good view of the city would brighten my day.,3
The protesters marched in silence to get their point across without violence and harsh words.,1
"The riders were pedaling along, eager to get to the meet up and start the race.",2
A close up shows the circles.,5
That night we all went out to celebrate me finishing my first ever marathon!!,3
"But there was the ocean, and it was not crowded, and the water was so blue.",3
I loved the lady who played the guitar.,4
"In Asia, there are many beautiful landscapes that can't be duplicated elsewhere.",2
Sheet music was pulled out and placed on the stands.,5
His mom was so proud of him.,2
"""Okay everyone, it is time for the reception to to end, and everyone say Goodbye to the honeymoon bound couple.""",3
One picture that stood out was of this really cool wall mural.,1
"It was dry, taking and reading stuff.",1
"It was a charity event in frigid water, but some people know how to celebrate under challenging conditions.",5
"The couple is changing vows and their parents, relatives overjoyed.",5
Afterwords he went to a park to reflect on his day by looking at public art.,1
IT IS A HOLLYWOOD,2
Her mother carefully placed the ring on her finger.,2
Two people are holding big drum sticks to make some noise.,2
I also take time in drawing things.,1
One guy got lost from the group while he was goofing around.,5
lastly we will take a lot of pictures of the moments.,4
When rappers get together in large groups it's difficult to judge but someone always wins.,3
So we ventured out and saw the sites of the city.,2
The road also lead to a fancy castle looking building.,2
It was a beautiful day for him.,2
A airplane model is hung from the ceiling.,2
As the night went on everyone started to goof around.,2
The girl is running down the street.,1
The other friend is dressed as the devil and looks ready for the party.,1
We made cookies last night.,1
A biracial couple tried to explain why gay marriage should be legal by reminding people that their marriage was once illegal.,1
And was very happy to be in the field.,3
At the end of the tour he takes the group to the local bar to have a few drinks.,2
People lined the streets.,2
"While they are waiting, people sign the memory frame",3
A woman is being interviewed.,3
IT IS A FUNCTION,1
"However, the old church was equally as interesting.",3
The rabbit was munching grass in the park,1
The surfer is ridng the wave that came in,5
Her favorite picture was of the treeline in her backyard because if offered such great contrast.,3
When he goes to leave he passes many goats in pens.,2
We could see a steeple on a hill.,4
THE TAKE GROUP PHOTO,2
The birds waited for the storm to pass.,1
As a final good bye I began handing everyone at the party free drugs.,2
And Grandpa loves all the entertainment.,1
The trip to the resort made for a jawdropping vacation!,2
We took my daughter to see the ocean.,4
"It is now our opportunity to imbibe the mood, music, beverages and friendship we have shared together over the years.",4
"I always took the red ball, it was lucky for me.",1
"But there was one man, dressed in devil horns, who was a little worried about what the king's intentions were.",2
That guys asked me out for a date tonight.,5
We ventured through the streets that were packed with people.,2
Now the chicken is in the story dry pan.,1
Finally got back to the bodega where I met up with my neice and her favorite adopted child for a wonderful cat dinner.,2
The mayor came to watch the parade.,2
He had a great time on the hike.,2
The new exhibit at the museum is an eclectic piece of artwork representing diversity.,2
"Gina was going to have a party so to make things easy, she organized all the pots she would need on the stovetop.",5
get readied the guiter by brother,2
Father was happy with their food choices.,2
We made a lot of progress today.,1
Our music director dressed up like it was Saint Patrick's Day.,5
The double decker bus drives downtown.,2
They have lots of work to do.,3
On Saturday morning people walked along the street marveling at the cars that were lined up,2
"Some mornings, I come across a little old man who tends to these gardens.",3
Better to drive home in the morning,3
Then I climbed up an even taller hill,2
"Screw the mess, I'm going out to eat.",5
The beautiful server stopped by.,3
The two girls are fighting over who suppose to give grandpa birthday presents.,5
My husband finally finished the renovations on the kitchen.,2
I stopped at the store to warm up with hot chocolate.,5
Some of our guests came with a tractor it was a huge success,4
IT IS A BUILDING,2
There was also 3 faces of angels close together that looked to be asleep.,5
Guests decorated the newlywed's car with nice ribbons to commemorate the special day.,2
"Before the show, the band relaxed in a well furnished room by the fire.",2
In this apartment we start our story.,3
The dog was ready to go.,2
We're at a costume themed concert.,4
There was a guest speaker in my science class this morning.,4
Another associate got lost and an employee had to show him where to go,2
Cousin Jack has it figured out:cartoons!,5
Once the task was done they all said their good byes,2
He started to understand there were twenty sites on this road.,2
THEY ARE CYCLE RIDE,2
The follow up act is rehearsing their performance,3
"When it was time to leave, we got lost again, because we couldn't remember which way we came from!",1
The cucumber salad was really good.,2
Coming up for a peek!,2
The bride and groom were so happy as they turned to walk down the aisle.,5
"But, sometimes, you just decide to take a picture right back!",2
The photographer was taking portraits of couples with different racial backgrounds.,3
"For my mother's birthday, I set up a photo booth with strange props including this puppet.",2
The family celerated fathers day together.,1
Every soldier wants to hang out with us.,2
"Even on the merry go round, Tommy spun me around before we got on even more rides.",3
"Every year, the snow fall begins around the same time.",2
My favorite are the simple humble gravestones.,2
On the street we saw what was the start of the annual parade.,3
IT IS A SKY FIREWORKS,2
There was a bike race today.,1
The other two who are lesbians is having too much fun as if no one is around.,5
He had a great time on the hike.,2
"He was taking a trip into town, he wanted his hair to be in shape.",2
There were pictures and artwork on the walls.,1
"The horn sounded, and the race began, and let me tell you, it was a loud horn!",3
Here's Sarah messing around with the camera.,2
The dog was ready to go.,2
Once I was at the top I felt I was ready.,3
I looked down the  aisle to find the product that I wanted.,4
It was a pretty diverse conference.,2
Isnt the colors used by this beachfront area beautiful?,3
"Being a bit tipsy, Dave realised he could use some coffee.",2
"The teachers got together with the students, and each had a lot of questions.",3
"Dad always looks so happy with my mom , his wife.",1
This place is for family fun for all families.,3
The male actor was friends with the female actress,2
The fireworks finally began.,1
I was sad that we had to leave.,2
IT IS A WHITE BUILDING,2
Hopefully the players on our team don't make a lot of mistakes today.,2
After eating we went down to the water where I pulled back my hair to get some sun on my forehead.,3
Bride and groom waited to take pictures afterward so they sat and kissed.,2
This guy had buckets.,1
The speech given by Silverstein was one of the best speakers I have ever heard.,1
She liked to have fun with her designs and make weird ones.,1
"Today, the lake was very reflective.",1
Mary admired the pinball machine in the trunk of the monte carlo.,4
IT IS A FESTIVAL,2
We got to ride the rides.,2
We visited his memorial grave.,5
The main presenter gave a short speech.,2
After we left we went to look at the water.,3
They danced as the music played.,4
They loved their delicious cake and could not stop eating it.,1
We talked to the people who were boating but we got bit by the bugs,2
We took a tour with them and looked at the beautiful castes in the area.,4
I love to show my dance moves!,3
"It then progressed to yellow, livening up the party that night.",1
These inspirational images brought a new sense of pride throughout the school.,3
"First, he started with some homemade cake frosting.",3
They painted posters diligently.,3
we went on a bridge,4
Besides trees the sights in a forest come in a plethora of shapes.,5
They each got to choose a book.,1
The space in the building makes me feel really strange and odd.,3
He took a beautiful pictures during the trip.,0
Everyone lined up for the big event.,3
The display was far more extravagent than years prior.,5
This wonderful organization leaves happy faces.,5
A happy couple commemorate the moment with happy smiles.,1
The assistants gave him plenty of time to relax.,3
Then we all sat around the fire and told stories.,5
"In Ana's art portfolio, first you will see a back, and white painting of her mother.",3
The houses docked for fishing boats.,1
The tatoos looked real and if i gotten them permanent they would of looked amazing.,1
The closer you get to it the larger it is.,3
IT IS A ART,2
There were many creative costumes in the costume contest.,5
He had a great time on the hike.,2
Once all the speakers were finished they agreed to answer our questions.,3
i bumped into this guy  i know and we just started talking next thing you know im hanging out with a rad group of people,2
There is a lot of interesting architecture in this little town.,5
The friends dance and live it up as they enjoy the party.,2
Everyone danced and had a great time.,2
I see a precious cat through the window.,1
And was very happy to be in the field.,2
Then every one has a taste of the now blacken man Mellow,2
The family gathered together for a photo at the restaurant.,2
He put on the performance with a great amount of passion.,3
The boy finally arrived at the park with his mom after a long drive.,2
a baby boy was playing with his toys on the floor one morning,3
I am really proud of myself for making such classy appetizers.,2
THIS FOR A FIRE WORK DIFFERENT,2
Becky went over to Cindy's house for a Single Ladies Valentines Day Party.,3
It looked beautiful on the bridge.,2
Red Hollywood signs light up the whole street.,1
My mom preferred the white car.,5
There are people in the streets in celebration of a specific event.,4
The light shines off the old buildings showcasing their beauty.,1
They saw many statues.,1
It was a beautiful day for him.,2
"Ah, cheers to a good time with good friends.",4
ONE GIRLS OF LAST RUNING,2
Later they went swimming in the pool to be cooled off.,1
The sun suddenly was blocked with no light coming through the stained glass window.,2
Some pictures were hard to capture though.,2
She felt so much better after the change.,2
THE GIRL WATCH THE SEA,2
My mom let me have a new job when I poured the batter for my cupcake.,3
Flowers are organized into an interesting shape.,1
Time to take her for a spin and show her off.,4
it was magical to walk out on the field,2
The bagpipers are the most fun part of the parade.,5
The snow blankets the countryside.,5
We bought more tomatoes than we expected.,1
Newere prototype trains that will hopefully replace the old ones.,3
The entire house has been regurnished and completely remodeled inside.,3
The NY Museum of History has an exhibit on the development of humans.,5
We called some friends to help,2
A Canadian flag waved proudly in the breeze on a street corner.,1
this girla very modern,2
His collection was large and growing.,2
my son is learning how to appreciate cars.,2
We had a quick outside lunch.,3
"They had all gathered together in celebration, sharing their hand crafted trinkets.",2
Then dad helped mom with his dressing.,4
The truck brought all the food.,2
I was so excited about the candle sale.,1
It's fun walking around with him and listening to him talk about architecture.,1
The couple ordered some dessert to end the meal.,1
I went downtown this evening to catch a local street band playing.,2
at last it was my turn to graduate,2
This firework is a special mixture of red and blue,2
Everyone was excited and ready to go.,2
IT IS A PLANT,1
IT IS A POT,2
The kids had the best time at the parade.,5
