output.sentences,ethnic
My pictures from the car turned out blurry especially because of the rain.,1
This picture of Grandpa's favorite granddaughter shows how much fun the kids table really was.,1
In town there a very strange shop.,1
IT IS A TRACTOR,4
A young girl's hair is wet because she just finished swimming.,1
I like that pyramid one.,1
"A berry hangs on a piece of tall, green grass.",1
He started by cutting up some ham.,0
Looking at them all lined up I was amazed.,1
this is a woman posing,4
These were perhaps melting snow people.,1
"They don't make them like this anymore,that's for sure.",1
we are connecting in love,1
He had a great time on the hike.,1
"Finally, a more typical wall art piece finishes the tour.",1
IT IS A BROWN DOG,4
It was a pretty day outdoors.,1
"There was no train on our day at the beach,",2
People wore some simple costumes.,1
He had a great time on the hike.,1
This is the old house of the old town mayor.,1
Everybody looked really happy.,1
There was a candle sale at the crafts shop.,1
Everyone is working hard at organizing the graduation ceremony on Friday.,1
I went to the party with my female friends.,9
There were lots of people in attendance.,1
Susan wanted to remember this day for ever so she hired a photographer to take pictures.,1
She viewed a seahorse at the aquarium and enjoyed it.,1
"She discovered another photo, this one far more recent, and decided to scan that one too.",1
I was biking to the gathering where we had a race.,1
His mom was so proud of him.,1
it was full of old houses from the 50's.,2
The sun beats down on the runners in the last leg of the race but the sounds of people cheering in the crowds carries them on to the finish line.,1
We sat on the beach and watched the waves roll in.,1
His mom was so proud of him.,1
A group of friends gathered to celebrate the end of a good day.,1
The next stop on the tour was a large wheel adorned with lights and is known for being one of the world's most extravagant Ferris wheels.,1
This one was of people swimming in the lake.,1
These homies enjoyed spending this quality time together.,1
I roleplayed as a little kid from that time period.,0
Hopefully this measly letter of achievement will suffice.,0
The trees were covered in a large amount of snow.,1
o man its broken   i cant see an  image,0
Especially when I have flowers in my hair.,1
"After we listen to this video,we will all have a question and answer period.",1
The midnight blue firweorks had a nice gold center,1
"In time, the sky looked lit.",1
Then he headed to the movie theatre to reward himself for his hard work.,1
One wonders if the wheel pattern of the Ferris wheel was influenced by the pattern of the bicycle wheel and if the artist intended viewer's to make the connecton.,1
Serve with a light sprinkling of cheese and a glass of white wine for optimal presentation.,1
Running through the cemetery is a small stream that is partially frozen,1
One of them discussed the nuances of advanced writing.,1
they went on a sightseeing ride with friends,1
This woman makes an outstanding jewelry with found recycled items.,5
"He wore his fedora golfing, his favorite sport.",1
His aunts and uncles even set up a special speech.,2
Some friend and I decided to attend a woodworking class.,1
At the end of the night they all had a good time.,1
Several of the aunts brought photo albums filled with memories.,1
"They finally reached the city, stopping to take in the beautiful skyline.",1
"After popping the ball, they got a new one and returned to the playland.",1
Then I got to visit an indoor greenhouse where a lot of the plants get their start.,1
Archibald has opened a new restaurant. He will be head chef.,1
OTHER MAN JOINING IN THE PROTEST,4
We needed some gas so we stopped at the next town,1
While waiting for the games to begin we enjoyed some drinks with one another.,1
The soldiers saluted to the preacher.,1
We climbed some crazy places.,1
I saw some signs and checked them,1
It was a beautiful day for him.,1
The lead and the main singers lastly walked up on stage and the people are penitently waiting for the concert to start.,5
He's a little older so it's pretty hard to do,1
The whispers from the Colonel's Spring rang loud in my imagination and I walked into yesterday.,1
We listened the school music programs playing in adjudications.,1
We always start Thanksgiving doing family poses.,1
Margaret loved cooking parties with her friends.,1
A gang of bikers rode down an alley.,1
"The second car was white, and was applauded as it begin slowly driving by spectators.",5
The fireworks began at 430,0
THEY SING A SONG,4
On our vacation we took a tour of the Devil's Volcano.,1
We will refurbish the old cottage,1
Waterfalls surrounded them in every direction.,1
"After the speeches, the graduate could barely contain her excitement as she had her moment receiving her diploma.",1
We took our first vacation selfie on the monorail.,1
He had a great time on the hike.,1
My mother and grandmother were pleased at everything I accomplished.,1
I watched dozens of people give the students advice before they handed out diplomas.,9
"Then, they return to play.",1
We light the candles.,1
Gradution day is finally here.,5
"Dad is firing up the grill, and cooking our feast!",1
"They set out these rings for sale early and I always buy several, never forgetting to congratulate the craftsmen on their ingenuity.",1
i dont want to live any more.,4
We finished with some amazing dessert.,1
A males trademark for love is to give a female the ring.,1
A couple smiles at their wedding reception.,1
The team is ready to take on the world with success.,1
IT IS A BUILDING,4
"At last, straight up chocolate--I recognized it--and I would be safe with that.",7
The trails were rocky provided you went off them.,1
"When we were visiting Nebraska, my family went to Henry Doorly Zoo.",1
"As we were walking down the street, we saw the most unique street lamps.",1
"when it was done, we were happy",1
His mom was so proud of him.,1
"The event coordinator didn't seem to care about the crying children as he screamed out ""the smurfs are only one of societies evils and you shall worship these idols no more""!",1
Some couples even sang karaoke.,8
A group of people play volleyball.,1
IT IS A BUILDING,4
"By the time the reached the place, the bird had flown away.",1
The couple danced at the reception.,1
Finally the moment where they are joined in matrimony.,1
We lined up white and red cups in preperation to serve plenty of drinks.,1
The girl was glad she could leave the graduation.,1
"Even into the early morning, the party was still raging and was great fun for all who went.",1
We're very excited to be a part of the music and festivities!,1
And we can't forget to mention: there was a ton of food!,1
Many of the people were related to him.,1
"I guess they started building a house, but decided to stop",8
Everyone in the town decided an evening on the rides looked perfect,1
HE HAD A LOT OF FUN,1
IT IS A STREET,4
Everyone was taking pictures of the event as it unfolded.,1
"Warming up they all stretching, attempting to get their head in the game.",1
I love seeing my children interact with others.,1
"As the boat continued down the river, the passengers saw buildings and decided to leave the boat.",1
IT IS A GREEN LEAVES,4
It is graduation day for new recruits.,1
"He needs to look good for his pictures, so he takes a trip to town for a quick shape up - and takes a pictureof that as well.",1
They also did a mike check for sound.,1
THE MAN WAS STILL,4
The minister proudly confirms the couple as man and wife.,1
The kids were in the park,1
They decided to go to Cozumel for a week.,1
Today she would receive her college diploma.,1
So many people came it was a lot of fun.,1
I used to hear strange stories about people that lived in building,1
This is a time we will never forget!,1
Occasionally you will find a caboose among the engines.,1
At night you could see a ferris wheel.,1
It's always fun to go to this competition,1
We sent the weekend at this gorgeous beach.,1
The glasses they gave to me its pretty cool.,9
We agreed it was the worst trip we had ever experienced.,1
You can see natural rock formations that go on for miles.,0
"Her best friend, Petra, is her maid of honor.",1
"Once the kids bounced their energy out and could sit still, there was a face painter.",1
The running started for the race.,1
The people skipped the sign at the stadium,1
I woke up as my train pulled through the woods.,9
His car looked so beautiful it made me jealous.,1
IT IS A FOOD,4
Pumpkins make everything look more seasonal and fall -like.,1
Police were in place for crowd control.,0
This is a modernly sharp looking restaurant,7
Good day with sun shine.,4
"When the groom and bride finally met the moment was one that they would always remember.,",1
"Evertime we leave it is a hard goodbye,",1
The dog was ready to go.,1
My mom bought a party hat for me to wear for my birtday.,1
I put all of the ingredients together.,1
Comicon is when everyone dresses up as their favorite comic characters.,1
Everybody stops to take a picture,1
IT IS A FALLS,4
Yesterday the singer play his classical guitar graceful in the concert,5
And was very happy to be in the field.,1
Frost still covered the grassy terrain.,1
This is the toold we will be using tonight.,5
It was a wild night for my friends and I.,1
Here comes that crazy rolling float again.,1
We played lots of different games.,1
We found a statue at a church.,1
Once the dish was completed I immediately wanted to go and make the recepie myself.,1
His mom was so proud of him.,1
The relator even left us some fresh flowers in the kitchen which was really nice.,1
"I have spectacular friends, who decided to come to my city and do an athletic event with me.",1
"The group decided to hit up this new, trendy restaurant they'd heard so much about.",1
This week it was time to go to the beach.,5
This is how heavy the mist was.,1
"When Gail finally got them to stay still and say cheese, the photographer snapped up his chance!",1
The whole congragation followed him.,1
"I mean, who would, with all of the wild attractions such as this oversized wizard hat!",1
A picture of dad's hand as he gets ready for the symbolic joining of palms ceremony.,1
We could see the display in the gallery from the window.,1
she looks like dora,9
THE WATCH THE MATCH,4
"There are many different trains, setups, and designs.",1
"Catching many fish, the fisherman considered the day a success.",1
These sister love the new baby.,1
The three of us together though caused some trouble.,2
Annual car show is about to begin.,5
John and Teresa paired up for a picture to remember the occasion.,1
It was a movie about males being friends with females.,1
I wonder what they do here.,0
All the rides were fun but the Ferris wheel was always the best for her.,1
Trick or treating couldn't get any better when they were together.,7
IT IS A ANIMAL,4
THE ARE IN PARTY,4
IT HAS A SEA,4
The staff showed great enthusiasm.,1
I love the old sign.,1
I looked at this dessert and am pushing my friend to sample it.,1
The lake is absolutely gorgeous today.,1
"Once upon a time there a service called ""flickr"".",8
This painting has a very artistic view to it.,9
NO MODE OF TRANSPORT,5
And was very happy to be in the field.,1
Finally the sun peeked out of the clouds at the end of the day.,1
Finally the ceremony is underway.,1
just a few more adjustments on this bike,5
the cast was prepared for the final scene,9
We store many things in the top drawer,1
We also took time for a hike.,1
IT IS A TREE,4
We went out to sit by the water.,1
"Every Autumn, the family gathers at the lake.",1
"The desert was a simple glazed cake, garnished with an exotic blossom.",1
The trees before winter reallly hits.,5
He vows and expressed the love at me.,9
It'll be a great time with friends.,1
The dog was ready to go.,1
They loved to view the sacred and stayed there all day.,0
they told many stories about my father,1
That day we met a lot of people.,1
They threw their hands in the air.,1
Overall everyone had a lot of fun.,1
The dance commity spent hours decorating for the dance.,1
There was a cool mural.,1
so she rode around in her tiny car,1
I recently went on an amazing vacation.,1
The mom shows her love by touching the baby's heels,1
Before we left this location we took lots of pictures.,1
I relaxed while watching the horses graze.,1
It was a very good time and I am so taken by visiting this dam.,1
The head of the organization gave a welcome speech,1
And was very happy to be in the field.,1
Maybe we shouldn't have ate so much because the ride we took went upside down!,1
The dog was ready to go.,1
"To ring in the New Year, we decided to spend the day at the beach.",8
"There were marks, which cued the bikers on where to proceed.",1
The wife and her family are happy as they take a portrait together.,0
The peace didn't last long once people started gathering.,1
"Non-alcoholic drinks were provided, but a couple male friends snuck in some beer.",4
They acted out like fruit.,1
"To the left a winged angel, picking flowers turned to notice.",5
I visited the sites near by.,1
One of the sisters helped as well.,1
We did lots of stuff in the pool.,1
My friends and I went to the county fair.,1
The water began to rise after the rain.,1
It must be light snow it did not stay on the trees.,1
People at the protest are not scared of the police.,1
A statue garden was eventually added.,1
They also made a large amount of true southern potatoes.,1
"Hours passed, and the hills and trees disappeared, giving way to green fields and fresh farmland.",1
He and his grandpa spent the day and celebrated.,1
I left my girlfriend's dorm at around noon.,9
The female living in the apartment had a shelf full of cups.,1
Fairs are known for their salty food and fun rides.,1
My brother is so happy for this next step.,1
She believed everyone in the world should visit this location and the white building with the tall tower was her favorite.,7
IT IS A EYE,4
Stream ride is very relaxing,7
"They were having such a good time, they didn't make it to the movie.",1
"Hey dad, you look like you could use something to drink.",1
IT IS A SUPER PLACE,4
As the family said there congrats to the bride and groom you could tell how happy ever one was,7
I was happy to see everyone.,1
It was magnificent for the fourth of July.,1
IT IS A JAIN WELL,4
We will be taking the local busline this time to get to the pier,1
The dog was ready to go.,1
I am always so excited to visit ruins.,1
The dog was ready to go.,1
A little girl is touching this pinkish red light.,1
The mayor went down the line to shake hands with people,1
All the top racers received flowers.,1
Children played and had fun while waiting see their parents again.,1
There was spirit in the house.,1
His mom was so proud of him.,1
They ate lots of ice cream.,1
This will make a perfect wallpaper.,0
Around her angry cronies were caught by surprise.,0
"Lastly, at the moment of departure, I had my picture taken.",1
Even the uptight host of the show ended up having a good time.,1
The cars disappeared under the snow.,1
He went on to finish the inning but the crowd was furious with him.,1
IT I S A BLUE LIGHTS,4
We got to pick the kind of beer we had.,1
i went to a rally today to supprt these people,1
The second was a car I did not recognize.,1
There were many guests to witness the award ceremony.,1
"What the heck kind of competition is this, anyway?",1
While there we came across a reenactment.,1
While mom is busy at work lets check in on daddy,1
The bride posed for a wedding picture as the leaves fell around her.,1
It was a great time with friends.,1
I guess I'll sit down with my brother and sister and eat.,1
Our class has alot of diversity .,1
I was visiting my hometown while i was on vacation and decided to pass by the town i grew up in.,5
We had a cake to celebrate.,1
THE PICTURE IS BEAUTIFUL,1
We saw many things in nature including a praying mantis.,1
The restaurant had a nice view of the lake.,1
"With our shopping trip over it was time to take our son's lead, so we went to the pier and relaxed.",1
"The nation's capital, Washington, is a city of monuments.",1
His mom was so proud of him.,1
The candle was burning intensely.,2
The place was better than any hotel I'd ever been to with beautiful scenery which included some unique plants.,1
Next to the trees and the sherbet shop there stands regal looking building.,1
The kid who thought he would fail gets his diploma!,1
"Eventually she had an entire garden of beautiful, pollution fighting plants.",1
I volunteered to take the school kids on a field trip,1
A hand has red material in the center of the palm.,1
But he hung these plastic spiders everywhere that scared the hell out of people.,5
IT IS A PAINTINGS,4
IT IS A FATHER AND CHILD,4
"Richard didn't care, as he was just there for the food.",1
The couple enjoyed a light breakfast as they watched the surf.,1
They mingled in the room and socialized.,1
The highlight of the visit to the castle was to sit upon the throne of the king.,1
We earned a lot about the history.,1
Suprisingly we were all able to perform the sport well!,1
He stops by the fence to see what's going on behind it.,1
IT IS A RIVER,4
"This is gong to be a long day, but thank God the sun is rising.",0
Our sisters were so surprised at how everything turned out.,1
I went to a restaurant where there were spilled seeds on the floor.,1
A photo of an antique car was of particular interest to both.,1
The sister was beautiful.,1
"The riders were pedaling along, eager to get to the meet up and start the race.",1
He felt uncomfortable in his costume.,1
My sister was in the kitchen tasting the cake that was at the party when I was married,1
went to friends party event to enjoy,1
That night we all went out to celebrate me finishing my first ever marathon!!,1
IT IS A MAN,4
"The museum contained modern paper arts, which were beautiful!",2
His dad was trying to teach him to swim and told him to kick his legs.,1
I loved the lady who played the guitar.,1
"In Asia, there are many beautiful landscapes that can't be duplicated elsewhere.",1
The Catoctin 50K Run is an annual event that is very important to its region.,7
Sheet music was pulled out and placed on the stands.,1
The bride to be got some awesome gifts.,1
The room was decorated with clouds on the walls.,3
Afterwords he went to a park to reflect on his day by looking at public art.,5
For a while we meandered in the garden.,1
And there was plenty of garlic.,1
A friend offered a sip of some ails.,1
I also take time in drawing things.,1
Our trip to Disneyland: Tiblisi started off with several rounds of Vodka we brought from home.,8
A baby girl wearing female clothing looked in a curious manner into the distance.,1
Once the party started the group loosened up.,1
Sometimes come here to went and to take a picture of this grand scene.,5
We enjoyed the groups better though,1
IT IS A FOOD,4
"It's not just the houses, the trees and yards are lit up as well.",1
A airplane model is hung from the ceiling.,0
IT IS A GARDEN,4
"What about you, son?",1
She finally wakes up and runs home.,1
THE ARE SOME PROPOST,4
"While they are waiting, people sign the memory frame",1
The rear of the band was the school mascot.,1
IT IS A FUNCTION,4
The finale was so exciting with so many colors.,1
The rabbit was munching grass in the park,9
When he goes to leave he passes many goats in pens.,1
"As the whistles sounded off, dozens of bikers began, peddling with all their might.",1
The school was proud of this graduating class having the most diversity in its history.,1
Our vacation trip has begun,1
IT IS A MAN,4
IT IS A BLUE ADD,4
THE TAKE GROUP PHOTO,4
The birds waited for the storm to pass.,1
He spotted a cirque that might be perfect.,1
THE MAN SOME DOING,4
I decided to go to this party at night under the lights.,1
Susie was happy for everyone.,0
There was a short presentation by a teacher.,1
There were people of all races there.,2
Outside you could see a line of hungry ready to eat costumers.,1
"But there was one man, dressed in devil horns, who was a little worried about what the king's intentions were.",1
There are some beautiful buildings that have alot of details from the past.,1
There were figures of people in the lobby.,1
The baby kicks the ball on the field.,1
Families gathered around to to watch in kite carts.,1
It was a beautiful day for him.,1
The dancing finally came to an end and everyone flooded the streets to talk about the wonderful parade they had just seen.,1
"He met Becky, his Aunt.",1
Finally got back to the bodega where I met up with my neice and her favorite adopted child for a wonderful cat dinner.,1
"We had to drive a long way to get there, but the destination was stunning.",1
He picked these yellow flowers for me,1
"Inside, we even saw a statue of a dog.",1
The halloween party would be held at Burien Community Center.,1
get readied the guiter by brother,9
The photos were wonderful; so many people came to celebrate Luke.,1
Then we went inside and it was even more scary.,1
They think the best time is to have tickets for there favorite team and to watch them play.,1
She and I sat next to each other in the stands.,0
They have lots of work to do.,0
Other neighbors started helping so the other two could take a break.,1
On Saturday morning people walked along the street marveling at the cars that were lined up,1
Chad was a great business man.,1
The final product was a delicious casserole.,1
An image of Sleeping Beauty and Prince Charming were shown in the stained glass.,1
IT IS A SEA,4
I hope the weather will remain this pleasant for the full ten miles.,1
IT IS A SOAP,4
I stopped at the store to warm up with hot chocolate.,1
Lastly they say the reefs and the fish that live inside them.,5
Before stepping outside I admited the glass inside the atrium with it's beautiful array of rainbow colors.,1
"This time, the parade started late.",1
IT IS A BUILDING,4
Yesterday was a special event.,1
St. Jermaine is hidden in the back.,1
IT IS A SUPER BOAT,4
The dog was ready to go.,1
IT IS A BIG BIRD,4
In this apartment we start our story.,1
Everyone hung out and danced until morning.,1
Even waiter joined in to watch the game,7
"She thought that we all went overboard on the gifts, certain that she would have a very spoiled little girl.",1
THE CAR WAS ACCCIDENT,4
Cousin Jack has it figured out:cartoons!,1
It was finally over.,0
They shine in the night with spectacular light!,1
I love to spend my Sundays in the park.,1
"OK, let the race being.",1
The photographer was taking portraits of couples with different racial backgrounds.,1
THE TAKE GROUP PHOTO,4
IT IS A COLOURFUOL CUPS,4
The family celerated fathers day together.,1
And of course you can enjoy the impressive architecture.,1
The whole gang gathered dressed up in our gowns.,1
"Even on the merry go round, Tommy spun me around before we got on even more rides.",1
"Every year, the snow fall begins around the same time.",1
A piece from the past.,1
The roofs were different on each building.,1
They took hours to do.,1
IT IS A KITTER,4
There are even racing cars for fun inspiration.,1
They saw their lovely granddaughters there.,1
A man talks into a microphone.,1
one of the guys was super drunk and tried to kiss her,1
I'm on my way to my schools' play.,1
Jonah hated getting ready in the morning.,1
THE PICTURE IS BEAUTIFUL,1
THE MAN WAS SMILE,4
"It's because when someone is graduating, everyone is so excited.",1
It's Halloween and we are having a family oriented party!,1
"The teachers got together with the students, and each had a lot of questions.",1
This place is for family fun for all families.,1
Even with tge police presence they are still out there protesting.,0
I like the bunny banner,1
The bride and groom are smothered in cake.,1
One friend read his notes to the interviewer.,0
His mom was so proud of him.,1
The picture is of a lizard.,2
"The shadows were lengthening by the hour as we at last entered the street that went past the still lovely flowering bushes, the one that would lead us to our gate and home.",1
Hopefully the players on our team don't make a lot of mistakes today.,1
At least it's a bit better on this street.,1
After eating we went down to the water where I pulled back my hair to get some sun on my forehead.,1
The city has many things to see.,1
So glad to be a part of something that supports Israel.,1
I have no words,5
During my trip i visited a criminal organization.,1
She looks ready to party,1
We visited his memorial grave.,1
IT IS SOME VECHILE,4
The main presenter gave a short speech.,1
The dog was ready to go.,1
The man owned pens and paper.,1
"He ran with the kids in  the math class that he teaches, though it was really hard",1
The people admire the cars that they see.,0
The town has many talented students.,1
He had a great time on the hike.,1
That day they also guarded the hot air balloons.,0
The Ferris wheel glows in the night sky.,1
"It then progressed to yellow, livening up the party that night.",1
The honor guard stand to attention to line the path for the coffin.,1
They painted posters diligently.,1
Lisa was the Jock of the group.,5
THE PICTURE IS BEAUTIFUL,1
A man dressed in red holds a baby dressed in a Christmas outfit.,0
IT IS A BROWN GOAT,4
The bird was going to eat seeds off of the ground there was a flood.,1
The trail led to some beautiful sparkling water.,1
Not sure I've ever seen those before,5
THE TAKE GROUP PHOTO,4
The waves seem to be picking on the building supplies on the ship.,1
"We're in Vegas, let's party!",1
They handed out balloons.,1
A happy couple commemorate the moment with happy smiles.,2
"During the class, they learned to make syrup.",1
I looked at the beautiful statues the restaurant keeps in the windows afterwards.,1
A few of the guys look kind of confused.,1
Her cake really shows her funny and odd personality.,1
Someone is hungry so they go to the fridge.,1
