output.sentences,ethnic
He was welcomed and got comfortable very soon,1
The person went into the really cute bakery.,1
It was a wonderful celebration of Nick's achievements.,1
The visitors team was just as pumped as the home team!,1
This multi legged creature is scary to the little girl,1
"At the beginning of the school year, university students always have some things they need to shop for.",1
"When I rode the ferris wheel I felt absolutely terrified, but once I pctured myself as one gumball amongst a sea of others, I felt a calm within me.",0
It was a gorgeous day in Egypt.,1
His mom was so proud of him.,1
Yesterday we went to visit the aquarium.,1
They built a dinosaur out of the snow.,1
This game of basketball is hard for me.,1
I could not wait to ride the ferris wheel!,1
The transformer played to the crowd.,1
We loved the tour and its beautiful scenery.,1
"One woman was so impressed with the decor for the meeting that she exclaimed ""wow!"" as we waited for it to start.",1
IT IS A LIGHT,4
The cemetery looks lonely and cold during the winter.,1
"The lead singer did really well, but he was nervous too.",1
The rioters hold signs and shouted their messages.,1
Snow will bring things together in such a fashion as making two floors appear as one.,1
He was going as fast as he could.,0
The area revolves around fishing in the river.,1
Some of my new friends.,5
His mom was so proud of him.,1
"On a dreary night like this, the man was happy to have so much money.",1
It was nice to see how well the town blended with the marina.,1
Tommy and Susan had a blast,1
A guardian perched above the building stands watch.,1
His friends came over and they enjoyed over dinner and conversation.,0
They party as if they were drinking for Oktoberfest..,2
People told their success stories.,1
"People were swimming, walking, and just enjoying the weather.",1
What a great time they spent with thier friends at the aquarium.,5
My sister received a lovely bundle of flowers.,1
IT IS A SEA,4
The fireworks were dazzling.,1
IT IS A TALL TREE,4
It was a long drive there on an empty gravel road with little to see.,1
The mommy monkey was napping with her child.,1
The dog was ready to go.,1
The atmosphere was warm and friendly the entire party.,1
People were very excited about the game at the stadium.,1
The low illumination of the lighting made the furniture glow.,7
We celebrated our success and ate a piece of cake.,1
The train and stage were made similarly.,1
IT IS A BIRD,4
Our vacation to the sea was simply amazing.,1
We explored the local region.,1
It was time to go out partying after the wins.,1
Another room is filled with other party goers.,2
He had a great time on the hike.,1
He gathers all of his ingredients.,1
Many trees are replaced by buildings .,1
Television reporters interviewed civilians in support of the march and recored a riveting speech delivered by an onlooker.,7
The archaeologists uncovered what today we would call a living room.,7
Its only when you get a closer look that you see the lightbulb attached to the uniform.,5
Her grandmother blew out the candles and everyone cheered.,1
They enjoyed catching up and sharing stories.,1
Let's get this party started.,5
Man my camera is not working right.,5
THE PICTURE IS BEAUTIFUL,1
The young girl was visiting her aunt during summertime break and they went to the local fair.,1
Beji got a stuffed animal for christmas.,1
Many people arrived in pink to support the annual breast cancer awareness run.,1
"At the wall, people stopped to read.",1
His sister sneaked into the photo while I was taking it.,1
And was very happy to be in the field.,1
The hands of the female were covered with cake.,1
The cook made this food,1
I wish I was closer this time to the cars.,1
"Many parents attended the happy occasion, seeing their grandchild for the first time.",1
We visited the pumpkin fields.,1
The model had very fine attention to detail.,1
It is done in the impressionist style.,2
Those sailboats in the harbor are kinda' cool.,1
who wants to die to.,4
Next year our oldest is playing in a band and might even get to be a part of the parade.,1
this is a couple,4
"After the ceremony, the bride and groom took pictures to remember their special day.",1
The day started quickly.,1
"Some Halloween party goers dressed in simple attire, unconcerned about winning prizes.",1
There was some cool art for sale.,1
"While there, I see two men jogging on the sidewalk.",1
The child is in the parade.,1
It gave me hope that I had friends at the bike church.,1
All the people loved it.,1
"When the tides are high, sometimes they reach the fence.",1
"But to her, the rural landscape only came with dilapidated architecture and a lack of excitement.",1
We went walking in the cold,5
Inside were some of the best historical relics still in tact.,1
The rest of the vegetables paled in comparison to the leek!,1
"Norm sits, waiting eagerly for his moment.",1
The male started banging.,1
There were a lot of people there.,1
Man this bike race has been brutal.,5
we invited her sister and her boyfriend along to enjoy in the fun the two of them are  basically inseperable,0
Mom was having her food brought to her on a flight.,1
We went to a museum.,1
a man is snmiling,4
At the end of the day the kids got ready to go home and end their holiday.,1
The music on Joey's playlist was cheesy but that didn't stop anyone from dancing.,1
Driving through London was a treat with father as a passenger in our car.,1
THE ARE DANCING IN THE STAGE,4
IT I S A IMAGE,4
Big sis and little bro thought it would be funny to make a puke face during their kiss.,1
I WAS WALKING AROUND THE SHOP LOOKING AROUND,1
IT IS A BLANK,4
The murals on the wall stole the show at this year's exhibit.,1
IT IS A HOUSE,4
I heard a soft tune and noticed that music had started playing and there was a pianist playing in the corner of the room.,1
The dog was ready to go.,1
Thank you guys for serving in the military.,0
IT IS A BUILDING,4
The barbecue master was doing an excellent job grilling.,1
"Afterwards, his wife had a party at their home to celebrate with their son.",1
The city was not much to look at from the outside.,1
The gym was lit festively.,1
Mom wanted to get a picture with the girls.,1
The gang drew a lot of graffiti.,1
IT  IS A SEA,4
The water front homes were so beautiful.,1
My taxidermist friends posed for a picture at the party.,1
They were grateful for all who helped.,1
Jenny wanted to be a witch for Halloween.,1
And the sunlight really made the natural colors pop.,1
"We closed the door of the circuit breaker, and went upstairs to head outside.",1
there were many historic buildings,1
They always rode on all the rides until their stomachs were spinning.,1
The smiles of the newlyweds.,1
The day was ended by a gorgeous sunset before we all headed home.,1
He discusses the third piece of art with his friends.,1
Everyone had a great time at the beach.,1
the trees where falling apart the wind was so hard,4
I stopped for a while to take photos of a local hotel.,1
A husband and wife decided to go on a hike.,1
The guy was laughing about a nearby protest over something stupid.,0
We had our fireworks in the local place of july month.,9
I hope the rain goes away today for the fair.,5
"She sees that they guy before him is doing well, and almost gives up hope for her man.",1
IT IS A BUILDING,4
"I got motion sick after riding the spinner, and my daughter threw a wet towel on my face as I lay on the sidewalk miserable.",1
His mom was so proud of him.,1
Durring one of my morning walks I found these lovely flowers.,1
All of the attendees enjoyed the evening of music.,1
It had a bounce slide that was much fun.,1
One was a shaped like a panda.,0
"There were a lot of people ready to video record the game, including the mascot.",4
Many buildings would not have been built without the help from camels.,1
We had a great time that night,1
We strolled at a slow pace and enjoyed all the statues and beautiful buildings.,1
This soldier's house pays tribute to his favorite team.,1
And boy aren't there a lot of finishers in sight!,0
"Finally, Manny won something and his frown turned upside down.",1
They spend their male days bonding together.,2
"She was so passionate about the project, I decided to see if I could find something similar, that I could surprise her with at our locale store.",1
Military planes from previous decades often included multiple contrasting colors.,1
"Since we're in CA, we got great views of the water too.",1
THE MAN WAS SMILE,4
Her children were on the computer.,1
The trophies were on the winner's table.,1
An organization is selling freebies in the park.,1
There were a lot of runners that dressed up.,1
IT IS A GRANDPA AND GRAND CHILDREN,4
IT IS A RED COLOR CAR,4
My friends at the party dressed up too.,0
The best costume was the red priest.,1
What do you think thoes new signs posted all over the hotel are for? my guest is as good as yours who knows Ashleyreplied,0
The singer was incredible.,1
We saw the exhibits for the hiking and mountain climbing equipment.,1
His mom was so proud of him.,1
"His friends were surprised, but were excited for the king.",1
"If there are kids, the idea involves a lot of sprinkles!",1
One of the nicest thoughts she had was that her mother in law was a huge support to her too.,1
The students gathered to take photos of their work.,1
The family enjoyed the perfect day.,1
The kids loved everything about it.,1
IT IS A STONE GROUND,4
The zombies are goulish,1
One solitary shoe was left in the field to signify the journey of a thousand steps.,5
they loaded their tanks with puppies and waged war on the parade,1
She was sad and lonely knowing he would never come back to her.,1
A community gathered for a special event.,1
And the fans had a really good time.,1
I wanted to stay there forever.,1
The same guy in the green shirt now fell asleep in a car.,0
THE GIRLS THE PHOTO,4
The car was clean.,1
We let him cut his own cake.,1
"As the truck left, it seemed to jerk out of the driveway.",1
The pig is very happy that he is not baccon.,1
The older brother found the most eggs.,1
"The hearts tear easily, so one must be careful.",1
"The reception was gorgeous, with lots of delicious food.",1
They had a Jewish ceremony.,1
She loved traveling and was amazed as she looked at the vintage buildings.,7
He saw the bust of Dan Marino.,1
Our trip to the fair was amazing,1
One of our musicians had a sore throat.,5
this movie poster is the hottest one ive ever seen!,1
"The sound of shoes hitting the pavement responded to their cheers as the racers finished, out of breath.",1
Each hoping to pull ahead to pass the finish line first.,1
I loved seeing the light sparkle in the eyes of my children.,1
The man checked to make sure the camera was in focus.,1
Cindy wrote a poem and made us all read it out loud.,1
The dog was ready to go.,1
"By the end of the night, I was wiped, and it was time to go home.",1
Ready to go to the picnic!,1
The dog was ready to go.,1
"Last night, we were excited to have some fun.",1
"While I was cooking, they were smoking and drinking on the balcony.",1
We were treated to a magnificent reception.,1
From where we sat we could see this whimsical and athletic-looking monument in the center of the beautiful park.,1
The students had eyes.,1
We were travelling and met a famous footballer so of course we had to get his autograph.,1
I tried to take a picture of my friend in the race.,1
The baby ate dinner.,1
Today was graduation day.,1
Each son made sure to pose with his mom.,1
the whole family posing,4
Mark was dissatisfied by dinner.,1
We saw statues and they were beautiful!,1
THE GIRL WAS SEEING IN THE BEECH,4
After the parade was over we enjoyed a bonfire on the beach.,1
The pigeon and Uncle bert seemed to make each other very happy,1
The two men painted the wall in their favorite colors for their marriage to each other.,1
The wide leaves of a tree provided shade as we ate lunch.,2
This flamenco is just hanging out.,5
"We were stellar, and we saluted the group of veterans after our performance.",1
I took a trip to get some sweet treats.,1
Their plans to take photos and stay at a local hotel went perfectly.,1
"Say what, you handsome hunk of man you?",1
"Turns out he was on time off from his schedule as a pilot, and he even introduced me to some o fhis friends!",1
This is my entry for the scary costume contest.,1
There were different colors like yellow.,0
We made amores on the grounds.,2
The dog was ready to go.,1
There were a bunch of papers left behind.,1
The girl laughs and makes jokes.,1
THE ANIMAL WAS BLACK,4
"The couple enjoyed their free time together, despite their friend's antics.",1
The walk and talk took a while and the couple stopped for a rest near one of the docks.,8
Even the bikes are covered in snow.,0
While the couple next to them gets to know each other a little better,1
"This holiday season, we decided to set decorations for a Christmas party",5
I cannot believe how much it snowed!,1
my sister sitting on a bench,1
You can research a lot of people online.,1
My partner felt the same way.,1
I'm so excited to be here at this concert finally seeing my favorite band live!,1
Today was the day that the piglets were born.,1
They started playing on the stage.,1
Afterwards they trekked the snowy surroundings.,0
Then the vice principal spoke.,1
There was also a group of kids dressed as zombies.,1
The party was not very fun as you can see by the fact that most of the guests are forcing a smile in these photos.,1
His mom was so proud of him.,1
A family spends time together at the beach.,1
The Girl Scouts had a fundraiser bake sale!,1
I could see my house in the distance.,1
Everyone is so happy to see the newlyweds.,1
And was very happy to be in the field.,1
What happened to the picture I took it's not here.,5
The store had a message saying they were closed for the party.,1
His mom was so proud of him.,1
THE SIDE OF THE CAR,4
In the crowd wielding away to the trance music with plow up swords.,1
"In the final seconds of the game, the two team members clashed and it was getting really exciting.",5
"Sally's dad, Vic, was proud of his daughter.",1
"Yesterday, my grandparents had us sit and watch a slide show.",1
He had a great time on the hike.,1
They were not able to finish and will be back tomorrow.,1
The house appears quaint. thought Judy.,1
This weekend we took a photo shoot of the male and female wedding.,1
IT IS A GRASS PLACE,4
A angled shot happened a night.,1
and her we are today almost finished with construction,0
The person with the best costume will win an awesome prize.,1
There are lots and lots of fireworks.,1
"A beautiful, serine, ocean view can be ruined by humans.",1
"Alice came dressed as her favorite character, a Disney princess.",1
"Afterwards, we have a bonfire at the house to end the day.",5
The bicyclists lined up at the starting line.,0
I just received my diploma.,0
After eating they played games.,2
The is the parade we went to on our vacation;,1
He talks about the good old days.,4
The mother board is bent,1
It was high time I spent a day out with friends.,1
His mom was so proud of him.,1
The woman went to the party with some students,4
His family drinks beers plays cards at the kitchen table.,1
"Luckily, they were equally drunk.",1
Memories that will last a lifetime.,1
"The turkey came out of the steaming oven, filling the air with warmth.",1
My very handicapped son was starting the 5th grade.,1
The event was gathering lot of people,1
The bride danced with her father as they shared a poignant moment.,2
They go and gather the medical charts.,1
A delicious looking fruit kabob taunts me with its colors.,1
I wish we could go back in time and experience it firsthand.,1
The food and drink could only be described as delicious.,1
The olympics of pipe bikes was held indoors.,0
"On cool days, it was easy to find restaurants to warm up",1
And a tasty bowl of chili.,1
He started walking towards the entrance before school started.,1
They listened to a quick briefing that was read by Bishop Hayward.,7
It was a beautiful day for him.,1
Some of the costumes are grotesque and scary.,7
the heavy snow last night still evident on the spring branches of a tree,7
He finally got a photo of the father while back from duty.,0
Hannah was the first in her family to graduate college and everyone wanted to share in her joy.,1
"Suddenly, for the first time she stands the rest of the way up!",1
My tired friend took a seat next to a male.,1
They even made us show them what we learned!,1
ONE BUILDING IS ON THE ROAD,4
I pass by an especially large and colorful window display that has ten separate panels and is shaed like a big archeway.,1
Over all it was so much fun.,1
The berries made a nice pop of color against the snow.,1
We still looked through some of the stuff to see what we could find.,1
3 people had a hat party.,1
All the players were very good sportsmen,1
Seems like the pond is a little dead this year.,3
The sights we saw were beautiful.,1
He had a great time on the hike.,1
People love to travel by air lifts to see a magical fairground east of the beach.,1
The best players of the tournament received applause.,1
Looks like some more people are piling in to see the view.,7
It was a pretty tipsy night.,1
The family was gathering together in the living room after eating.,2
Some kitties like to lay around like fluffy pillows.,7
It was rush hour now.,1
"Along the sidewalk of the church, there are always yellow flowers growing.",1
The dog was ready to go.,1
THE TEMPLE WAS VERY NICE,4
The players got in a fight because they were drunk.,1
"Afterwards, she showed me the academy.",1
His mom was so proud of him.,1
The hopscotch was still there on the playground,1
THE ROADS ARE COVERED WITH SNOW,5
"My friend, Josh, posing in front of the temple.",1
"We both have a ton of passion for history, so we knew our vacation needed to include ruins we could peruse together.",1
"But it wasn't an option, I was determined.",1
Is that a Rolls Royce.,5
IT IS A WATER,4
His mom was so proud of him.,1
His mom was so proud of him.,1
His mom was so proud of him.,1
The bridge is amazing and you can see how great it is from far away.,0
The cyclists soared in the air when they hit a big bump.,1
"Inside the house, the family stayed warm and cozy.",6
The city was busy talking and hearing.,1
I was asked to take the shot of the roller derby team as they gathered for a difficult victory party.,7
"I awoke early the next morning, before the sun came up and started researching what I needed to learn in order to make my craft",1
"The water ahead looked very choppy, so they braced themselves.",1
The marble under this window is marble.,1
We heard the water from the sea over the hill and I ran to take a picture.,1
This was a surprise party for the new parents.,1
Susie loved her Lego gifts.,1
I love the beauty that you can find outdoors.,1
"My family decided to take an exotic vacation in China, and one of the location we liked the best was going to Inner Mongolia with the kids.",1
Some had their cars buried and stuck in the morning.,1
The speaker talked about the importance of donations.,0
IT IS INSIDE OF THE HOUSE,4
We visited the remains of Father John at the crematorium.,1
Some of their paintings were graphic.,1
As she exercised on the ball she followed the pictures.,1
He took pictures of the side of it.,1
Greg has become an expert in nodding at people who are pitching businesses to him.,1
IT IS A BUILDING,4
The car looked super cool.,1
One on looker looks a bit worried about her meat being burned.,1
"There's beautiful vistas and if animals are not your thing there's beaches to lay on and waves to surf, as one can see from a distance.",1
And was very happy to be in the field.,1
We danced on the floor all night.,1
The band is wearing blue hats today.,1
Then it was time to go home.,1
A hearty breakfast to start the day.,1
Overall I'd say our summer trip was very successful.,1
We could see the finish line just ahead.,1
To end our day we visited some vendors that sell pigs.,1
Until they stumbled upon a primitive sundial made by the indigenous perverts of the area.,1
"One of his brothers looked on as he played with his toys, wondering if he had ever been held like that.",2
John was not going to pass on the steak smothered with mushroom sauce.,1
The hotel was so stylish and it had 5 stories,1
IT IS A INSIDE OF THE HOUSE,4
IT IS A STONE,4
Near our house we have a fence that also acts as the road's gaurdrail.,1
The airplane sat in the snow.,1
Time to hug a tree!,1
All the candles on display shone brightly and seemed to wish our little girl every happiness.,1
As the vows were recited the bride & groom couldn't help but smile.,1
I feel excited when I'm getting ready to eat.,1
He posed with a male hair stylist and his other friends.,1
The fight ended in a explosion.,0
The parade was lively.,1
His mom was so proud of him.,1
Yet the view from the back yard was priceless.,1
There were so many seafood options to pick from.,1
a nice old lighthouse that still works,1
Today was Halloween and I had to work at the office.,1
The chefs take a lot of pride in how they arrange their food.,1
The party was for both men and women.,1
We also ordered a bottle of wine that paired very well with the food.,0
the whole ceremony took about 30 min.,2
I found a peaceful memorial that I found so beautiful.,1
"After they ate the burgers, the campers roasted marshmallows on the fire.",1
"Despite withstanding the test of time, the headstones' names weathered and eroded like a forgotten memory, unable to reflect the name once etched.",0
IT IS A BOAD RIDE,4
There was even a cool restaurant on the way.,1
The princess tried to lock herself away in it.,1
"Maybe people wore hats that resembled a turkey, peacock, and some other birds were included.",1
"I was eager to test my new camera, but couldn't figure out how to zoom.",1
Yet the people played in the streets by the thousands.,1
"She has several daughters, who enjoyed playing with mine.",1
It doesn't hurt to have a pretty girl next to you.,1
The drummers were playing music.,1
It seemed as if I wasn't going to be able to find anything.,1
THE PEOPLE ARE SOME DOING,4
The people quit their day jobs to support rainbow rights and go on a parade,1
Jim entered a bike race.,1
"My hubby and our new son, Michael.",1
Its a good way to make sure the soldiers are remembered by having a parade.,1
THE CAMERAMAN IS READY TO CATCH ALL THE PERFECT MOMENTS OF THIS HAPPY EVENT,1
She boils the pasta in the pot.,1
She dreams of someday sitting on the sidelines and watches as he runs on the field. Her worst fear is him resigning.,1
They all drank lots and had a great time.,1
The structure towered high over the forest and was evident of an ancient civilization.,2
THen we took another picture at a statue and looked down at the camera.,1
The man had a friend name Jivus.,1
Coach knew that all they really wanted was to hold hands in a circle,1
"There were foods from others, including finger sandwiches, set next to the cake on the table.",1
Our guests wore kimonos.,1
My dad and I couldn't be prouder.,7
Three of us made it to mile 15.,1
"Most of Andrea's anxiety was forgotten, however, when she first laid eyes on the beautiful palm trees that adorned the soft sandy beaches of the island she'd call home for the next week.",1
Many people are there enjoying the day.,1
They avoided gun fire because of this.,1
But it was the perfect little black dress,1
The racers in the marathon were all in attendance.,1
The kitchen was their favorite room.,1
The game that night was basketball.,4
It snowed several inches over night.,1
They sat down to enjoy drinks and food.,0
Today's experiment involved making a normal solution.,7
The man reading the card paired together with the girl and danced.,2
Later today we will be going to the Museum of Sculputres which has an amazing outdoor exhibit,1
The little boy had a wonderful day.,0
"I am no longer a kid, but I still love to fly a kite, just like when I was a kid and experiencing the fun for the first time.",1
"Picture of my camels, bet you dont own a camel.",5
Aunt Shelly is even coming all the way from North Carolina.,1
This bride and groom picked the perfect church for their traditional wedding.,1
"""I should have just slept at home"", she said to the camera crew.",1
Across the street I see some vibrant vegetables and the colors and smell begged me to go and buy a bag of them.,4
After which he finally ended his journey at the State Fair grounds.,1
Even  was so excited he when we got to the park  he immediatly took the ball out and began to kick it around,0
These lion statues seem to ward them off.,1
There was a very competitive ladies costume contest.,9
they walked through the town and loved all the things they saw.,1
Some of these mementos touched my heart.,1
There were lots of pop culture references dotted around.,1
Everyone is gathered around the table having a great time.,1
The sights are impressive and exciting.,1
I met many people on the mission.,1
Not a guest was dissatisfied.,1
There was plenty of food,1
The female then meets a man and smiles at him.,1
He started flying around the pine needles to obscure his location.,7
I wore a black dress to match the event.( No Image provided),1
"From the start, the fans of the other team were devastated.",1
The dog was ready to go.,1
"This recipe comes from a page in a book called: ""I Love to Cook!""",1
Taking a break by the ocean.,1
We were read for an adventurous day out when we arrived at the next location.,1
Then we went to see the house that our great great grandparents built.,0
They played some unique tunes on the electric guitar.,1
"This picture of a man on stilts looks like a giant exotic insect, with the Ferris wheel behind it as a sort of strange trap.",1
These guys sure have helped alot with the move.,5
Let us raise our glass to Mom.,1
"This giant sailing vessel carried wealthy people that wanted to travel the worlld in style, like this female.",1
