output.sentences,ethnic
Steve pretended to be annoyed at the singing but was happy to be surrounded by close friends and family.,1
People even decorate their trucks and toss candy out the back!,1
"Suki still felt alone, nonetheless.",1
"The smell of a delicious meal is wafting through the air, ready to entice guests.",1
The group of people were having a good friendly chat.,0
My favorite statue had asian influences.,1
Everybody get together it's picture time.,5
Sometimes i found by turning my head i could find a spot easier.,1
What kind of museum has a lion throwning up?,1
He's happy and blows out his candles in excitement to eat his cake.,1
Three more dogs were waiting as well.,1
IT IS A BUILDING,4
"Over time, a lot of fireworks exploded.",1
Awww...one tired little one.,1
The outside of the church is  very detailed,1
They looked nervous and excited.,1
i think that it is the best site ever.,4
The cheerleaders are excited.,1
This looks Like a yummy treat,7
"His wife was sunburt from the sun, they spent the rest of the honeymoon in pain.",1
"His friend had some other friends with him, too.",1
"They're smoking a cig, enjoying the rock star life.",0
The gardens were unbelievable.,1
Even those in uniform started to cry.,1
He is outgoing and loves all of his family.,1
Noni loves to get lots of kisses from him.,1
this is a river,4
They carried Jed around the room.,1
My friends and I are going to start the walk together and we have taken a 'pink day' picture to commorate the great moment.,1
The dog was ready to go.,1
The guys playing the game yells yay as the game ends and they take the win.,0
An odd fish looking picture is painted on a wall.,1
A man brought a large crucifix to show his devotion,1
A barbershop quartet performed classic songs like Yankee Doodle Dandy.,1
The cowboy costume was creative.,1
"As the day ended, Grandma and her grandson enjoyed the beautiful sunset.",2
"at last, he took a picture of the crescent decor",1
The decor in the restaurant was yellow but they had pink-colored spotlights shining bright into the street outside.,1
Man standing on stage.,1
They have live music for the ear.,0
A man walked in the desert alongside a huge building.,3
The train toy was geared to go,1
Kids are easily amused.,1
Looks like one of these lovely ladies will be next!,0
Although you could walk down almost any street and see beautiful carvings above many of the doorways.,1
The boy posed for graduation pictures.,1
Their ridingball popped but it was quick and easy to repair.,0
THE MAN GIFTED IN THE WIFE,4
"Don't worry, Dad, it's going to be OK.",1
His friend Ceasar and Cleo brought some games with them to play,1
Jake was setting up for the equipment for the program.,1
The seals on the beach are just fun to watch.,1
The mini Tardis walked down mainstreet.,1
This is a picture of one figurine we found at a museum that had a very interesting history.,1
The TV reporters talked to the protest group before the event started.,1
Even the kids joined in .,0
One of the booths had a wheel that you could spin and win a prize.,1
My mom gave an embarrassing speach and made the graduate stand for it.,1
It was the morning of the Macys parade in NYC.,1
The unique building have beautiful lights lit up around it.,0
All the young kids were bored at my party.,1
hope of treasure and bounty in this tiny island village,9
"Upon finishing the 5k, Tom and the rest of the racers head over to the food tents to eat after a satisfying exercise.",4
The bridge looks cool as the sun sets.,1
After the young lady leaves the store she heads to the embassy.,0
"When the first whistle blew, the youngest children began to run.",1
We got to look at the cool mountain range.,1
It definitely made for fun conversation.,1
"We rented bikes and had a lot of fun riding and especially enjoyed the sight of the bridge, backed by ominous stormy grey clouds.",1
Along with the chance to try to catch butterflies.,1
"In the end, the recipients posed together for the event picture.",1
I was happy everybody was able to show up.,0
The weather was great.,2
A Family went to an amusement park,1
On a walk dow Hollywood BLVD I saw the star of my least favorite actor.,1
Motorcycles were allowed in the race only to transport the volunteers.,1
IT IS A FESTIVAL,4
Some of the Natives showed off their beautiful tattoos to commemorate their heritage.,1
THE MAN THROW THE BALL,4
"During graduation, some students wear traditional and cultural costumes.",0
people watched the music performence,1
The kids had fun playing dress up.,1
It was a wonderful sight to see the final set of fireworks.,1
The Golden gate bridge always leaves me in aw and I am overwhelmed by the hugeness of it.,1
The artist who did the statues of old art was very unique.,0
Learning how to play guitar.,5
The river had nearly frozen over along the back of the cemetery.,1
The hike into the woods was greeted with a small waterfall.,2
The snow was very heavy when we navigate it.,9
"Once I set the appetizers out, I wanted to eat them all, they just looked so amazing!",1
It was time for the kids.,1
IT IS A SEA,4
People were standing around chatting all day.,1
Becky went downstairs to start unloading her truck as one of her apartment walls starting to change color.,0
We gave out awards at the ceremony on Monday,7
Then Ted showed off his jumping skills.,9
The rest of the night they were in lock up.,1
W all felt as proud as if we had created a space station and shouted out yeah.,1
THE WIN THA ONE GIRL,6
Sometimes the lights are too dark.,1
Aunt Cheryl does not know how to use a camera correctly.,1
IT IS A RED LIGHT,4
They watch their favorites which is the polar bears.,1
And some fireworks looked very strange on my camera.,1
We then went to the beach and took pictures.,1
The Malevich sign quickly grabbed my attention.,1
"When it came time to open gifts I received hotwheels and several new cars, it was a great birthday.",1
Among the other games that they played was hide and seek.,2
IT IS A CYCLE RIDING,4
And was very happy to be in the field.,1
"Traditional buildings in the city are cool too, although he prefers the modern ones.",2
It is very satisfying,1
The church was a place of many gatherings.,1
THE MAN IS CUTING IS VESITTABLE,4
They house is made up of several cool designs.,1
It was a beautiful start to their summer vacation.,1
Those who walk through the gardens often enjoy butterflies.,1
She continued running even though she felt pain in her feet.,1
The groom with his mother look so happy.,1
"At a Halloween party, a man came dressed as a king, but was carrying a chain saw.",1
I watched them as they would arrive.,1
Youtube had a set for videos.,1
My buddy gave a  speech.,1
Everyone is arriving to see the concert,1
IT IS A GROUND,4
This friend had recently been on the news reporting about a local male teen who was kidnapped and then found and was okay in the end.,1
They even learned how to fish.,1
So did the bride's mother.,1
"Cousin Mary thought she was so slick, filling her water bottle with vodka.",8
The family and friends shared many laughs.,1
The wind was good enough to launch the kite in the sky.,1
He could see the top of the big hill ahead.,1
We went back to the same location hand in hand a year later,1
The man begin to tamper with the colored tubes.,0
He had a great time on the hike.,1
He was celebrating another dog's birthday.,1
A few girls from the scchool nearby are helping planting flowers,1
The wildlife is plentiful so keep your eyes peeled as you travel through.,1
We went out for dinner at a delicious restaurant.,1
Our hotel. room on vacation overlooked the beach.,1
After they enjoyed their dinner the children helped clean off the wheel shaped table and the mom and dad joined the children in the park for some more family fun.,1
We have been waiting for this event for too long.,1
THE WINDOWS WERE SMASHED,5
"Seeing all the marks on the walls reminds me of the people who live in the city, and the marks they leave for other to find.",1
Mom taught baby brother how sand castles are built.,1
We would all skate in a line together,1
Our fancy dress party was on tonight.,1
"The weather was looking a little rough, so we were going to cancel our tour initially.",1
Some days she almost felt like she was in an office building cubicle.,1
He got caught up looking at vintage pottery.,1
I first stopped to read the park map.,1
We colored them with many different colors.,1
Only to have a guy riding a jet ski ruin my stream of consciousness.,7
He lives on an island in the Southern Hemisphere.,4
The guests are all taking pictures,1
This reporter did a live interview of the sport of fishing.,1
The traditional people were the jigs.,1
Time for registering my classes.,1
My experience was great.,1
THE TAKE GROUP PHOTO,4
I had never been so sad at some where so nice.,1
The space is lovely near the garage.,1
The market is colorful and welcoming in all kinds of weather.,1
"Next, cows are seen on a lonely farm",0
"I must have had too much beer 'cause I see a big, yellow, flying fish.",1
Street vendors were ready for each purchase made by those who avoided dad's shop.,1
I make posters for my display.,0
He would invite his friends to go for boat rides with him.,1
"In different parts of the world, the check points to get in are pretty extensive.",0
"Along the way, a few guys had to perform a bit of maintenance on their bikes.",1
THE ARE IN MARIGE,4
The adults talked about their neighbor who always wore a blue cap.,1
"Before the start of the concert, the children in the band were goofing around.",1
As I walked back to the house I noticed how peaceful it was with the snow covering everything.,1
It is Jack's turn now!,5
Here is the acitivity complex.,5
The snowman was a very fun Christmas decoration.,1
THE BOY WRITE THE ROAD,4
Greeting everybody I am glad you all had me out here today.,5
They had pastel colored nightgowns.,1
"Then we made signs to advertise the play that would be hung, letting people know the location had been moved.",1
The whole town was off to the beach and had their bikes ready to go.,1
The man liked to kayak by himself.,5
I found a way to crawl through a tight entrance cave.,1
Kids sat next to the Easter bunny and smiled.,1
Sometimes when you are in the spur of the moment you melt things and damage others.,1
We all met up for a weekend ride on our bikes.,1
"Suddenly, she was very aware of the randomness of her thoughts.",1
We visited the facility to get to the parking through the entrance.,1
In the city stands many idols to the founders of the nation; champions of freedom and justice.,1
"The hall wasn't wide, but this was only to be her wedding in the USA, and back in her country there would be a lot more guests and plenty of space for the crowd.",1
"The drums brought down the house for the finale, the audience cheering as Jay and Rico played.",1
"It had a view that was nice, of the lank.",1
People shoveling snow all wrong!,1
IT IS A BLACK AND WHITE IMAGE,4
We ate lunch at a cafe,1
"With their interest piqued, the keepers taught the kids even more about the animals.",1
And at the end of the day he went to go testing his amazing skills and was awarded for being the best dog of them all.,5
Some visiting family were attending this.,1
"After this, we ate lunch at a nearby park.",2
Further on in the gallery you can view this medieval painting showing a riot in the streets.,1
"But, it was the most touching to see the both of them exchanging vows.",1
There were several people at a party.,1
Then a man swinging a tree by its top.,1
"But, the one with the frog was the funniest.",1
One had a question though.,1
IT IS A CAR,4
"The food's not ready, which is a problem.",1
"Some of the newer additions are interesting to say the least, the creativity of the community center is just one of the aspects that will make you stop and think.",1
I love the beautiful decorations.,1
We can get a unique shot of the church.,1
We excitedly cheered them on!,1
Many people payed their respects as the line moved along.,1
Betsy even painted the walls!,1
The secrets were in ruins.,1
they are announcing somthing,4
The crowd gathers to mourn and pay tribute to the mayor,1
The carnies brought a carousel for kids to ride.,1
Everyone is having a good time.,1
people keep coming from different places to attendt to the event,1
"Once night fell, we looked at the capital building and left.",1
"This dental clinic was in an area of extreme poverty, and was always busy.",1
Nearby there was a really cool hole by the ocean.,1
Their style is surreal.,1
after living there they moved furniture,1
A person skies down a mountain.,1
They were preparing the fishing boat.,1
I visited many stores known only to the locals.,1
Detroit has alot of blight,0
"In the distance, there were green pastures.",2
The pantry is well stocked.,1
My friend thought that more people would like our unique t-shirt designs.,1
Some of the ugliest parts of the city are vacant lots.,1
Cheerleaders in the front perform coordinated cheers.,1
I decided to give it a try but got a bit scared when I saw the snow hanging from the cliffs.,1
I wanted to go to this store because they were having great deals.,1
The gate blocked our way to the building,0
People milled about in the hours before the race began.,1
Each winning team got a nice trophy.,1
IT IS A WHITE BUILDING,4
All of the parents were so proud of thier graduating students.,1
IT IS A VAN,4
On our way out we stopped by a cool sculpture at the foot of the volcano.,1
We ended our lovely meal with dessert and grapes.,1
its so bright out,5
The house was built on a hill.,1
they removed the passenger safely,1
"Sitting on the sofa, Harold thumbed through a photo album remembering the good times.",1
I repositioned and tried to take another picture but this time the water line was crooked.,1
We spent the time picking up shells,1
I finally remembered I parked in the parking garage.,1
i like to swim,5
"Yesterday, there was a lot of weddings.",1
My twin girls had their first birthday.,1
IT IS A GOD,4
She had the largest smile on her face while her dad was walking her down the aisle.,2
People gathering in the street,1
Some eels come close to the glass for a better look.,1
"Hear the pops and cracks, the show has begun!",1
She insisted that we take a nice picture of the two of us to hang in her office.,2
"When they got out of the water and climbed onto their bikes, Chris wasn't too far back.",1
Check out how luxurious this hotel is.,1
I wasn't sure that at 44 my heart could take being up so high in the air.,1
Each male takes many shots.,1
Instead of rolling mountains and sandy beaches all I got to see was come mounds of termites by my camp.,1
All kinds of different costumes were worn by the students as they arrived and started to mill about.,1
The horses were part of the culture here.,1
IT IS A BLANK,4
IT IS A BATHROOM,4
"When he returned from war, the couple made the most of their time together.",1
Here's me and my boyfriend holding on to each other.,1
THE PICTURE IS BEAUTIFUL,1
"It was a chilly morning, but we stopped by the shore to collect some seashells.",8
To be able to spend time with his girlfriend was nice.,1
This English style buidling would soon be all white under the heavy snow fall coming our way.,1
"As the boat tour continued, the clouds finally lifted to reveal the beautiful blue water.",1
Crowds of people lined the streets.,1
The neanderthal mask had grey hair.,1
Now they have to wait until the game starts.,1
The audience was very into it.,0
"The view was spectacular on this trail, and it was a shame when I turned, and headed back.",1
They are announcing winners,5
The next piece is an ancient artifact.,1
This truck had a smurf in the pick up.,1
This picture is taken on a cloudy day.,1
The band is here setting up.,0
But I was also going to be taking this trip without my reading materials as well.,1
Walking through the park is one of my favorite things to do on a nice spring morning.,1
IT IS A INSIDE OF THE HOTEL,4
It was a quiet morning in the house.,1
THE MAN WAS RUNNING,4
Finally our founder takes students' questions.,1
The people we meet where very friendly and nice.,1
The high school had a pep rally.,1
The person skied between trees.,1
I got creative and put a pumpkin on the statue.,1
The presents were on the patio.,1
It was amazing to have viewed the windows from the inside.,1
"First a book was read to the children, activating their imaginations.",1
Mushrooms love to grown in tree stumps.,1
I found the wheel that we lost,1
Where every you travel each experience will be something new.,0
The view and their time were wonderful.,1
He drew a lot of diagrams to explain his theories.,1
Marla noticed how poorly John is doing tonight,3
THEY ARE CYCLE RIDE,4
Their grandmother lived in a manor nearby.,1
"The parents had to wait around sometimes, but they still had a great time.",1
there HE IS THE KING HIMSELF,0
The snow cover the streets and cars.,0
It was very beautiful.,1
The first speaker approached the podium to begin the conference.,1
We then took another ride in a nifty looking car.,1
"Tragically, her husband died shortly after.",1
Security was there to make the event safe.,1
They are full of ancient carvings so detailed and interesting.,1
The dog was ready to go.,1
The lights on the balcony not only decorate it but also serve as a guide to the staircase.,1
At night the males biked together through the streets.,1
It was beautiful and sunny.,1
We decided to go out for an evening concert.,1
Grandma had fun watching them play.,1
I looked around at the stalls and looked at some bracelets for sale.,1
"A slow, straight pitch resulted in a stolen base.",1
A CROUD WAS WAITING FOR THE RACE TO START,1
Not getting discouraged I proceded and had a salad before the main course.,1
"Tourists can also enjoy water skiing, which can be fun or scary.",1
"Years ago, he did a number of black and white photos that are still famous to this day.",1
There were many statues inside but my favorite was the one of buddha.,1
IT IS A WAVES,4
Once the team left the ground it was time to play.,1
My boyfriend showed up after he said he couldnt make it.,0
The soldiers represent individuals who overcome division in their communities.,1
"When we removed the old roof we found rotting wood, but a sturdy base to rebuild a new roof.",1
IT IS A PROTEST,4
Her and her husband visited the beach every year.,1
Police closed off the roads for the procession to begin.,1
They had a cake made especially for them.,1
Ending the day with dinner was a good plan.,1
"Sadly, when she went back to the bread, it had fallen flat.",1
"A light, powdery snow blanketed the village.",1
The race was very competitive; things were neck-in-neck.,1
My girl and I went to Las Vegas together.,7
Some were loosing some clothing.,1
THEY SING A SONG,4
We had four guitars and numerous singers present.,1
The female had a great costume.,1
"He hadn't realised a friend from last summer was out with him, until the wind pushed them close.",1
The wait to get in is long.,5
The guy who crossed the finish line first was excited to complete his first marathon so well.,1
Dad gets lost in a book.,7
I really like the face that I carved on this pumpkin.,1
The father was happy with his gift.,1
His mom was so proud of him.,1
The gallery is small but has lovely paintings.,1
A friend came over and joined him in plucking out a new sound.,1
IT IS A DANCE,4
We saw a lot of flamingos over there.,9
But mostly I played a game where was pretended to be taking stuff away from my friends.,1
Lola and Jaime are having a groovy party at their pad.,1
"We learned pottery during the first month, and a bunch of other crafts followed.",1
THESE ARE CLASS MATE,4
The local population was filled with beauty and a grateful attitude.,1
Our favorites were the red and green.,1
lights at night equals a busy night.,1
And tried his best to convince everyone to buy in.,1
The family arrival at the restaurant for the family reunion.,0
This building is really old.,5
The visit to the zoo was a nice trip.,1
Relatives had come from all over the world to attend this wedding and they got to see each other.,7
I helped with this section.,5
"Indeed, he ended up making the nest which Barb later took outside and used for hiding some of the Easter eggs.",1
The ride through the mud was pretty messy.,1
The parking lot needs to be snow shoveled.,1
everyone is getting ready to leave for  the night,4
Everything was so colorful that day.,1
I saw a stick and then realized it was a knife.,1
There were peole who wanted to sign up to learn to do crafts.,2
We had to take a class picture.,1
He spent a little time to read her plaque which provided a small history lesson.,0
The annual festival was already underway.,1
The sheep were excited about it too!,0
To conclude our visiting day at the school all kids received well deserved special trinkets and treats.,7
I hope this is a good spot for tonight.,5
We have all gathered for a family tradition,7
The craft store sold a lot of feathers for it.,1
Lets mark this brush to find our way back.,5
Family members scramble to photograph the even and hurriedly show off their pictures.,1
The little girl awoke ready to be pampered.,0
This depicts John the Baptist baptizing Jesus.,9
He had many photo albums full of firework pictures.,1
He had a great time on the hike.,1
He had a great time on the hike.,1
IT IS A ROUND LIGHTS,4
He even gave a presentation of a paper he wrote.,1
IT IS A BUILDING,4
The two girls smile while sitting on a couch next to someone in a costume.,0
The police officer didn't catch me,1
"We spent the day together and enjoyed my prepared meal early, after which we went out to a concert at night.",1
Wealthy people enjoy private parties.,1
People were sitting under the tent because it was hot.,7
The two women hold a conversation at the table.,0
Jenna and Katy had been best friends since first grade and were finally graduating from Junior High School.,1
I will cut the cake with my husband and dance.,1
I watched how they handled the flag in a careful way during the unfolding ritual.,1
A group of three people stand around posing for the camera while smiling.,0
We prepared for the opportunity by setting up a camp to wait for darkness to come.,6
A shirtless guy walks on the beach.,1
His female family members contained a daughter and two grandchildren.,1
Everyone had a lot of fun.,1
The keyboardist focused on the keys as he was playing.,1
He had a great time on the hike.,1
I got to try some local specialties as well,1
She tried to recycle as much as she could.,1
"In general, the right to protest is extraordinarily important to our society.",1
The jumbo tron sporadically captured people enjoying the game.,5
The game was brutal.,1
It was fun with people on the sidelines cheering us on.,1
It was a beautiful day for a baseball game.,1
He had a great time on the hike.,1
All the cars were stopped and people started taking pictures of him.,7
The bride and groom did the vow exchange,1
The picture did not display.The dog came out of the car and took one sniff and they realized he was hiding drugs.,1
next they decorated a tree,1
There is also a beautiful steady stream that flows slowly through the woods.,1
Old cars participate in the parade to support the reason behind the parade.,1
"Uncle Rodney is in rare form, as always.",1
IT IS A PLAY GROUND,4
We always have fun together,1
We love it so much we even tend to have our family parties there.,1
IT IS A MEETING HALL,4
There was also a parade.,1
It was a good day.,1
The planes stayed put.,1
We are laying down that's why you can't see us.,5
IT IS A DRINKS,4
She then got to a charming old farmhouse.,1
It was a good day for us females to get together as we ate dessert.,1
The marching band plays their favorite fight song.,1
"Her daughter gets the present ready,",1
The night of the event was crazy.,1
One person dressed up as spongebob squarepants.,1
He had a great time on the hike.,1
His mom was so proud of him.,1
We had a great time.,2
With all the marchers gone onlookers stream home still excited from what they've what they've shared.,7
There are awesome sites perfect for taking photos and collecting memories.,0
It was party time!,7
Her dad was nervous.,1
"Since we were bored, we took a lot of pictures.",1
The dog was ready to go.,1
We went on a camping weekend.,1
My son was able to run the trains using the remote control.,1
The neighbors helped each other out by digging out cars.,1
Some of her friends did not think she was funny.,1
Not everything at the carnival are costumes some are also had made craft baskets,0
Some chose to wear some silver princesses outfits.,1
These two will forever remember this day.,1
He's accompanied tonight by his son and daughter-in-law.,1
"We had to sort all the pills, and a young male helped.",1
The rowing participants were ready in their boats when the bell rang to start.,1
The sky was so blue as we watched our kites flying,1
We went back to the hotel and discussed our exciting day.,0
My sister Jolene was there.,1
"The left the airport with spirits high, never to be seen again.",1
His mom was so proud of him.,1
Baseball icons wave to passersby and fans.,1
The city quickly assessed the situation and ran the repairs efficiently.,1
A couple of signs advertise.,1
The store had plenty of fresh baked goods.,1
We had a fire in the backyard.,1
T\\\\\I totally enjoyed the museum and thought it was worth a mention.,1
The marching band waited to get on the field.,1
THEY ARE A MAGIC MAN,4
Everyone there was wearing white.,1
"There is so much artwork to see, literally everywhere.",1
Babies make strange faces for no reason.,0
Grandpa and Grandma opened presents from all of us.,1
"Meanwhile, Minnie is laughing behind Donald's back.",1
The dog was ready to go.,1
THe neighborhood was really nice.,1
The pub also had ice cream in homemade waffle cones!,1
Just before the meal the chef's assistant brought out various micro-brew refreshments to cleanse the palate,1
There is a lot of paper on this display.,0
