output.sentences,gender
"Though they had a beat up vehicle and a small apartment, they were content because they had each other.",0
Their friends all gathered to play with them.,0
The car show featured some amazing entries.,1
"Afterward, they went exploring a bit.",0
It's not something that you see everyday.,0
The architecture was truly unique and was amazing to look at in person.,1
"You could even find cliffs surrounded by water, undisturbed by man.",0
"The theme park was so fun,",0
THE GIRL WAS SMILE,1
"While in Paris, we attended a lecture for college.",1
Seeing the seafood market was amazing.,0
"The speaker took a moment to pause, thinking hard, then chose to drop his speech notes.",0
IT IS A WONDERFUL PLACE,1
THE HOME IS THE VERY NICE,1
Families come to the park to enjoy the music.,0
Take her for as many rides as her stomach can handle,0
We were in a strange land filled with new animals.,0
this is a marching band at the parade,0
"He drove past the same old grey buildings, seen day after day, all a blur past his rearview mirror.",0
And they watched the skies eagerly.,1
It was an epic day.,1
"Dad dances with his daughter,",0
"When I went to get my bike ready for the morning ride, it was completely covered and stuck in the snow!",1
His mom was so proud of him.,0
There is a wonderful seating area to sit on wooden benches and observe the wonders of nature.,0
The sights we saw were creepy and cool.,0
"I was taking a walk in the park, and I decided to walk across a bridge I had not seen before.",1
They were thinking it would be fun to put his head in a vice.,0
John's wife was happily pinning the achievement badge to her husband's shirt.,0
The girl admires the ring.,0
"Mandy is with him, enjoying the sunset.",0
The scenery was incredible.,1
The gentleman in the hat was planning to have a good day touring the space center.,0
A group of musicians played near flowers.,0
The statue is a symbol of our town.,1
We all had a blast listening to everyone else.,0
The rest of the family was excited.,0
"Today's topic is Service to the community, to learn about the importance of volunteer work.",0
Today there was a woman selling fruit at the market.,0
They learned a lot.,1
And also a funny looking striped fish,1
however as you can see he speaks with the public  happily and freely,1
The forest is extremely peaceful.,0
This picture of the male is well loved.,1
"And then slowly an eruption of green and orange, entalged in one glorious mess.",1
"After several pictures, they both nailed the jump for the photo on the beach.",0
"Suki still felt alone, nonetheless.",1
Everyone kept warm around the purpose smurf built bonfire.,0
Everyone got to work cutting and and coloring.,0
They then checked the beach to see if it was a better option than the mansion.,0
My favorite statue had asian influences.,0
THE PAPER IS THE WRATING,1
The last thing i noticed was a busy millipede scurrying by.,0
He's happy and blows out his candles in excitement to eat his cake.,0
It was a great night for everyone.,0
He is so happy he got legos.,0
Everyone walked in tradition garb.,0
We hiked all the way down to the beach and the dogs loved it.,0
IT IS A VIOLET COLOR LIGHTS,1
The last pen held an auburn haired alpaca with a Mona Lisa smile.,0
"Over time, a lot of fireworks exploded.",2
"I loved traveling with my girlfriend, even with her picture phobia, and finally figured out some sneaky ways to get her picture for my memory book.",0
We are having a wonderful time at the st. patties parade!,0
The girls are surprisingly good at bowling!,1
IT IS A BLACK AND WHITE PHOTO,1
The outside of the church is  very detailed,0
i think that it is the best site ever.,1
They all looked their best at the military meeting.,0
This looks Like a yummy treat,0
They are remembering past founders with monuments,0
This was a life event that I will never forget.,1
"Cara finally switched to soda, but only after getting a bit drunk.",0
Walking out of the church is the newly married couple.,0
the males hung out and watched tv.,0
IT IS A CHURCH,0
it was a nice chance to reinvigorate out love life.,1
The water was beautiful so I took a picture,1
There are lots of innovative ways to participate with your friends.,0
Noni loves to get lots of kisses from him.,0
Lots of people wore superhero costumes to run in the race.,0
He had no trouble blowing out candles and loved the number five,0
I am leaving this place soon.,0
I watched with pleasure as the winner crossed the finish line.,0
The water pressure at some installations is inadequate.,1
An odd fish looking picture is painted on a wall.,0
Everyone in his graduating class smiled at his accomplisments.,0
Looks like its time for Mr. Plow to get to work.,1
There was a meeting.,0
"As the day ended, Grandma and her grandson enjoyed the beautiful sunset.",1
Our second grade class made a chart showing what color shirt to wear to support awareness for violence against women.,0
"No one, it turned out, gave it much thought.",1
His girlfriend got him to pose too.,0
Skiing has always been a wonderful activity for my family to do together.,1
A man walked in the desert alongside a huge building.,1
The dog was ready to go.,1
IT IS A BED ROOM,1
As I put on my gear I get more excited.,0
Fun bouncy house and lots of games for my kids and their friends.,0
"Secretly though, she wished she was the one dancing with Bill.",1
The day started well with both arriving at the church together and on time.,0
My cousin is one of the graduates up there.,0
And was very happy to be in the field.,1
"At the center, the students palyed back up while the Senior citizens took their turns at Karaoke.",0
"Don't worry, Dad, it's going to be OK.",1
The seals on the beach are just fun to watch.,0
The happy couple was excited to visit the White House.,0
"We passed beautiful palm trees, and grazing cattle, and other California sights to see, but no houses with kitchen gods.",0
He walked down the aisle.,0
"Luckily, it didn't appear as if anyone was decimated in the crash.",0
Then I saw a few crabs walking up to claim their turf.,0
SHE TAKE A PHOTO,1
"Other people were bad at remembering the USSR flag, but they thought they had it close enough.",1
"When she saw it vacant and with a sign posted she sighed and wished she had not, because it was so much nicer in her memories.",0
These two girls were having fun at these festivities.,1
"Upon finishing the 5k, Tom and the rest of the racers head over to the food tents to eat after a satisfying exercise.",0
Were on family vacation.,0
After the young lady leaves the store she heads to the embassy.,0
"When the first whistle blew, the youngest children began to run.",0
He had a great time on the hike.,1
It will get you back to the frivolity of the street and civilization.,0
There was a lovely restaurant that I ate it.,1
We got to look at the cool mountain range.,0
He also remembered this sweet gay couple that gave him a dozen roses.,0
There was standing room only.,0
On a walk dow Hollywood BLVD I saw the star of my least favorite actor.,0
It was halloween at the student dorms on campus.,0
IT IS A TREE LIGHTS,1
A family beach vacation is unbeatable.,0
"Smile on her face,on this perfect day.",1
"I caught up with my friend David, who had work exhibited at the opening and talked to him about his day.",0
Learning how to play guitar.,1
Our family reunion was so much fun.,1
"Even though she visited the store without any intention to buy, she could still play the instruments.",0
"The couple were looking for a new place to live, they hoped to find somewhere near the water.",0
A nature scene is shown with a mist and pine trees.,0
Who knew flags could fly in the snow?,1
We started drinking wine and then it really turned into a party,0
We posed for a picture together.,1
People were standing around chatting all day.,0
IT IS A WALL,1
Becky went downstairs to start unloading her truck as one of her apartment walls starting to change color.,0
The children loved the attention from Papa Smurf.,0
Sure hope it doesn't rain.,1
This is the finished product of all the boards after they were put together.,0
Sometimes the lights are too dark.,0
Our van has taken us all over.,1
"The water, with its Asian archintecture added, was a fun and unusual attraction.",1
The Malevich sign quickly grabbed my attention.,1
"When it came time to open gifts I received hotwheels and several new cars, it was a great birthday.",0
"Luckily, the ceremony had a relaxed feel as it was by the local lake.",1
It was a nice family get together,1
The sun was rising on a beautiful spring morning.,0
Bob starts his island vacation today!,0
"Once it started, it was a beautiful display.",0
"Traditional buildings in the city are cool too, although he prefers the modern ones.",0
"They had a blast, getting to know each other better.",0
One notable part of the tour was the beautiful scuplture of icarus.,1
Our first day started by motivating all kids by singing songs all together.,1
The landscape and architecture are breathtaking.,0
Now it is time for studies.,0
"Some people display classic techniques, while others are more freestyle in the methods they use.",0
Many generations were represented.,0
AND SHE WOULD LIKE THAT CAT,1
She presented the powerpoint with finesse.,1
On my first turn I got a space.,0
IT IS A GROUND,1
The four friends hadn't seen each other in months.,0
Martha wraps up report.,1
Three friends set out on a adventure,0
The final opportunity to imbibe in the company of friends was not wasted.,2
This friend had recently been on the news reporting about a local male teen who was kidnapped and then found and was okay in the end.,0
They all came together for an important cause,0
"Cousin Mary thought she was so slick, filling her water bottle with vodka.",1
The family and friends shared many laughs.,0
"Upon closer inspection, I discover that the chairs look upon a singing stream.",0
We even met some sheep and got to pet them,0
Baby decided to taste her first snail & enjoyed it.,0
"Add the softened vegetables to the rest of the ingredients, making sure they are mixed well.",0
He was celebrating another dog's birthday.,0
The cake was so delicious that she used both hands and ended up with blue icing all over her face.,0
This party is filled with all kinds of characters.,0
The wildlife is plentiful so keep your eyes peeled as you travel through.,0
Once all the ingredients of her famous spicy soup were in the same pot and the spice was added the kitchen was thoroughly fagrant with the delicious smell.,0
THE WINDOWS WERE SMASHED,1
My sons were very excited to see what was under the tree in the monring.,1
Politicians getting voted in by voters,0
I always shooked and looked to see if it was snowing.,0
J-Smoove has been practicing and watching the movie 8 mile for months to prepare for this moment.,0
Now the real show is about to begin.,0
Mom taught baby brother how sand castles are built.,0
The teens are thrilled to graduate.,0
Some days she almost felt like she was in an office building cubicle.,0
The dog was ready to go.,1
My other sister decided to lay in the freeway.,0
This ride has been here for more than 80 years.,1
It is Halloween and my friends are all dressing up.,1
We furiously pedaled closer to cross the bridge.,0
We colored them with many different colors.,0
The guests are all taking pictures,0
I shook the soldier's hand,0
THE TAKE GROUP PHOTO,1
There were all kinds of statues.,0
"The reception is already in full swing, with Julia and Mike looking so happy and in love.",0
I bought them with for her in a very cute setting with a little teddy bear.,0
"Just as everyone predicted, Johnny came in first place!",1
THE TAKE GROUP PHOTO,1
IT IS A BLUE ADD,1
I had never been so sad at some where so nice.,0
I decided to redo some things in my house.,0
"So, the televison was turned off and the food fight chilled.",0
IT IS A BOY,1
The market is colorful and welcoming in all kinds of weather.,0
"Next, cows are seen on a lonely farm",0
"I must have had too much beer 'cause I see a big, yellow, flying fish.",1
Street vendors were ready for each purchase made by those who avoided dad's shop.,0
The visit was spent at the lake fishing.,0
The sparklers were lit a lot and brightened the sky immensely.,0
having a relaxing time with friends with beer,0
It is Jack's turn now!,1
Tim and Lisa went back to the place they went on their honeymoon for their anniversary.,0
Her sister brought her baby with her.,0
THE BOY WRITE THE ROAD,1
I marvel at the beauty and simplicity of the design.,1
I went on walks along the beach.,1
The choir is singing songs about Christmas.,0
The dog was ready to go.,0
Every time festival arrives the streets are packed with kids.,0
The night time sky was glowing from the flames.,0
I found a way to crawl through a tight entrance cave.,0
The cheerleaders beamed with pride as they rooted the team on.,0
We continued on with our vacation by riding bikes through the city and mountains.,0
My wife set out snacks for Tom's Bachelor party,0
The yellow car crashes as he tries to get out of the green car's way.,0
The drinks were o ice,0
In the city stands many idols to the founders of the nation; champions of freedom and justice.,1
The bride and groom move over to cut the cake.,1
Tulips are one of the magnificent varieties of flowers.,1
The pastor leads the ceremony.,0
It was a great day to visit a roman building.,0
"The drums brought down the house for the finale, the audience cheering as Jay and Rico played.",0
He had a great time on the hike.,1
She liked to go out a lot with her friends and boyfriend.,0
And at the end of the day he went to go testing his amazing skills and was awarded for being the best dog of them all.,0
They came across some farming equipment and thought the back drop made for too perfect a picture to pass up.,1
"The cathedral's gold-colored ceiling, looming high above, was elaborate.",0
Then a man swinging a tree by its top.,0
It was their 10 year Highschool reunion and many of these alumni still dressed like edgy teens even into their late 20s.,1
IT IS A COLOURFUL LIGHTS,1
Some people tried to hide from her camera.,0
We saw the street artist drawing a flower today.,0
We decided to have our family reunion at the bowling alley.,0
"We hit some traffic as we were crossing the bridge to get downtown, but we were able to see them when they started since the view from the bridge is one that can't easily be beat.",1
"If you have to catch up on work, you have an are to get things accomplished.",0
It takes all kinds of people with special styles to have a really fun dance experience.,1
Standing to attention as the casket is brought out of the church.,0
A normal morning starts as the couple eats their breakfast.,0
SHE IS A MUSICIAN,1
One member gave a speech to all the people present.,0
"Inside, they found lots of broken down machinery.",1
IT IS A ANIMAL,1
"Forests are decorated by the shapes of leaves, insects and flowers.",1
The people rolled down the hill.,1
I began the day with a hike in the woods.,0
The flood dries up to reveal an envious walrus.,1
Many were in the house drinking beer.,0
IT IS A SNOW RIDE,1
THE MAN WAS SMILE,1
We met the family.,1
The white team fought hard,0
His mom was so proud of him.,1
He quickly shook hands with the presenter as they exchanged pleasantries.,1
They were fun to watch.,1
"This dental clinic was in an area of extreme poverty, and was always busy.",1
"More than anything, he liked sharing his hobby with the younger generations.",0
after living there they moved furniture,0
A person skies down a mountain.,0
"The ""tourist"" seems to be loving her attire and the whole crew as well!",0
They were preparing the fishing boat.,0
Detroit has alot of blight,1
I just graduated an am already in a severe depression.,1
"""Ew, nope! Still gross!"" the girl exclaimed, clearly in dislike.",1
There was this really cool forgotten city.,1
The grounds keeper at the headquarters kept well trimmed trees.,1
Cheerleaders in the front perform coordinated cheers.,0
"Afterward, they set up tents to sleep at the farm overnight.",0
I wanted to go to this store because they were having great deals.,0
there are cars on the street,0
Each winning team got a nice trophy.,0
"In the meantime, we should hustle so we do not miss the guy selling cotton candy.",1
They now are playing the song over and over to get it down pat.,0
It seemed that everyone enjoyed it.,0
Their clothes matched their cars.,0
She was excited to start her day.,0
We watched as a woman in stilts passed us,0
Grandpa packed up and took one last look down the hallway filled with other makeshift apartments.,0
Frank jacked up his caddilac.,1
The house was built on a hill.,0
It is nice to have them all in the same room to share all our favorite moments of life.,1
"There guys sunning and hanging all over the park, one male had a tat above his pec.",0
The sun shown on the deep red paint as we pulled up to the quaint little farm house.,1
Her white friends loved her unique baked goods and each wanted a photo with the genius baker.,0
IT IS A PLACE,1
"We had a hard time finding the store, because all of the buildings looked similar!",0
Kids were also watching the bike race.,0
we're graduating from college today!,1
Then the main speaker rounded up the day.,0
Today we will explore the wonders of the forest trails.,0
An abandoned building sit's beside an aging walkway.,0
There is nothing in this frame.,0
The whole town was proud of the skills they showed as they led the way down the street.,0
Instead of rolling mountains and sandy beaches all I got to see was come mounds of termites by my camp.,0
"Good grief, Pa, look at that mess!",1
"Everyone thinks they know how to dance, but the don't.",1
"I've always seen this bridge in shows and movies, but in real life it's much cooler.",0
The male with me has eaten 4!,0
We had a good time and shared some laughs.,0
THE PICTURE IS BEAUTIFUL,1
To be able to spend time with his girlfriend was nice.,0
The fireworks show ended in a sky of red sparkling lights,0
"As the boat tour continued, the clouds finally lifted to reveal the beautiful blue water.",0
Everyone had a good time and reconnected to much of the extended family.,0
Now they have to wait until the game starts.,0
A woman in a striped shirt stands in the office.,0
This truck had a smurf in the pick up.,0
Her Mom bought her a big cake.,1
Philippine Nanny just has a new boy to watch in her home.,0
All of his employees like him.,0
But I was also going to be taking this trip without my reading materials as well.,0
Walking through the park is one of my favorite things to do on a nice spring morning.,1
This gave a whole new look to the drawers.,0
IT IS A COLOURFUL LIGHTS,1
"My safety checks are complete, time to roll.",0
It was a beautiful day for a hike  close to the ocean.,0
Finally our founder takes students' questions.,1
IT HAS A BOAT,1
IT IS ALSO A SEA,1
The town was very large though.,0
This tree was so cool and I loved the way it was bent.,1
She was glad to see the Capitol.,0
She convinced the whole crowd and everyone left.,0
Custom restaurant menus are beneficial to the business.,0
They bought the special HD fireworks.,0
Helping is fun but no eating your brush though,0
The sheep were happy to be outside on a beautiful afternoon.,0
THE MAN  SOME DOING,1
We even got to read  a historical statue.,1
This wall is just cool looking!,0
Church let out around 9pm.,1
there HE IS THE KING HIMSELF,1
These kids volunteered their time to spruce up this school.,0
The streets were full of people protesting.,0
"They stayed at cheap motels, for a few different nights.",0
The torch was lit and the fire was burning.,0
"While we were there, we saw some amazing artwork at museums and in cathedrals.",0
Near the end of the safari we saw a deer.,1
All the people were gathered to play games and race each other.,0
My friends and I threw an awsome diner party!,0
"Another group of teenage girls saw the fun and decided to join in, even if they weren't dressed for it!",0
The played a lot of games.,0
The water looks pretty in these photos.,0
After she grew up she moved away from the house and a sign was posted there.,0
The fans got a little wild.,0
IT IS A BUILDING,1
"While the animals stay within the bounds of nature, the sky has voted on serenity and beckons to the people.",0
It brought many a number of people together.,1
They stayed and talked with the other people for hours.,0
I find it boosts my ego and helps me perform better.,0
The dog was ready to go.,0
I saw my neighbors at the door.,0
We decided to go out for an evening concert.,0
They made for some really beautiful pictures.,0
this is a city's historic statue,0
We went to a location where we could enjoy the peaceful morning.,0
A CROUD WAS WAITING FOR THE RACE TO START,0
"Flashing the group's symbol for ""you will be dead in 2 minutes"" the happy inductees were ready to embark on their final adventure.",1
"Years ago, he did a number of black and white photos that are still famous to this day.",0
None of the judges looked impressed.,0
IT IS A BUILDING,1
I was very excited before graduation.,0
The vacation spot was the most beautiful place they had ever gone.,0
Here is a bright pink firework,0
The guy on the bicycle is really good in doing tricks on it.,0
IT IS A PROTEST,1
Dad knows how I feel about watching too much tv so it was off most of the time I was there and he insists he doesn't watch it much anymore.,0
The halloween parade had a lot of people dressed in costume.,0
They had a cake made especially for them.,0
Though she was in the middle of nowhere she still had a few modern comforts from home which included a watch and a satellite phone,0
THERE WAS A PICTURE OF A BUS THAT THEY RODE IN TO GET TO THE LIBRARY,0
The cops were ready in case there weren't any peaceful protesters.,1
they played music nice and soft and quietly,0
The trip would be a total of six days and four nights but when Gary saw his room he never wanted to come home.,1
Stacey loves planning the 4th of July party.,0
And was very happy to be in the field.,0
Today was my little girls Happy Birthday.,1
I really like the face that I carved on this pumpkin.,0
She put things in her mouth.,0
"Next, a gothic lady came on stage and began to sing an song.",0
"Despite the pollution in the city, there is still nightlife.",1
The fair board had added whimsical directional signs to assist people in finding their way.,0
It was a relaxation day at the pub.,0
We went to a museum and saw a replica spaceship.,0
But mostly I played a game where was pretended to be taking stuff away from my friends.,0
"We learned pottery during the first month, and a bunch of other crafts followed.",0
BROTHER FRANK IS THE LIFE ALL ALL FAMILY REUNIONS,0
The parade started and the mayor drove by waving to the crowds.,0
"It was a job, but we got the pumpkin to orbit for a moment and watched it sail and plummit.",0
We found the gravestone that we were searching for.,0
We decided to make extra treats so we spent time putting sprinkles on cupcakes.,0
"Indeed, he ended up making the nest which Barb later took outside and used for hiding some of the Easter eggs.",0
We have a tv to watch the news on.,0
The ride through the mud was pretty messy.,0
I saw a stick and then realized it was a knife.,0
They are standing at the alter,0
Gemma told Dan about the sex change operation.,1
Uncle John was the one who help us hunt for the Easter eggs in Grandpa's backyard.,0
This is a great picture of my grandparents.,0
We removed the dirt by picking it up with a shovel,0
The band finally booked a gig.,0
The soldiers received plenty of praise and honors.,0
Each had a story of a snow globe.,0
The dog was ready to go.,0
THEY PEOPLE IN ROAD,1
They had drink and toasted one another.,0
"After the grand parade was over, every one did their part to clean up.",0
IT IS  A STONE,1
He had a great time on the hike.,1
She had to get ready for the awards ceremony.,0
We could spend all night admiring the skyline.,0
The woman shares a secret with the guy at the party.,0
He even had permission to ride to school.,1
As she traveled nearer to the hill top of the trail she paused.,0
Wealthy people enjoy private parties.,1
There was even a plane writing in the sky.,0
Check us out in our new neighborhood.,1
they visisted a fun location,0
The excitement grows as indistinguishable multi color bursts fill the sky.,0
A group of three people stand around posing for the camera while smiling.,0
This week we are taking a vacation to another country.,0
His female family members contained a daughter and two grandchildren.,0
"There was one woman holding a baby tightly, wishing she didn't have to go.",0
She tried to recycle as much as she could.,0
"In general, the right to protest is extraordinarily important to our society.",1
Some windows also have saints prints on them.,1
"Some of the people are wearing costumes, most of them in very festive hats.",0
Today we went to the Easter charity event to benefit endangered animals.,0
We went to the golf game,1
Today at the fair I saw a new food that I just had to try; Beer battered cheese on a stick.,1
This is our room on the boat for the next week.,1
"When we wrapped up our date on the boardwalk, we saw male dressed as Elvis singing.",1
It was a beautiful day for him.,0
We even danced for a bit,0
They stopped at the station to get gas.,0
What a great day.,1
the kids played with the ball.,0
IT IS A PLAY GROUND,1
IT IS A BIRD,1
IT IS A MEETING HALL,1
IT IS A BUILDING,1
It was a good day for us females to get together as we ate dessert.,0
The night of the event was crazy.,0
"The DJ introduces, for the first time, Mr. and Mrs. Robert and Ashley Smith.",0
We took photos of the amazing scenery,0
"Even though our husbands had fish that they had caught and the rest of us ate, the kids didn't seem to want to try it.",0
Mom was so happy to celebrate this milestone.,0
I hate baseball but my husband dragged me.,0
And is eaten off of paper plates.,0
