output.sentences,gender
Ya'll shoulda been there because it was LIT with the cover songs.,0
Before they all rested and watched the waves roll in.,1
Why won't she put me down.,1
"The current was not so very hard to ride and we got to land and docked beneath a large, overhanging tree.",0
THEY PEOPLES ARE SOME WATCHING,1
The fireworks colors were amazing.,0
Sue surprised Josh and ran over to sit by him.,0
The soldiers gear up for the presentations,1
"If people see a sign that says ""sale!"" they will buy it right off the mannequin.",0
In town there a very strange shop.,0
People gather in costumes.,0
IT IS A TRACTOR,1
Ah! Good times with friends,1
Several amazing bands entertained the crowd.,0
And are staying in this small house to be alone on the land,0
He started by cutting up some ham.,0
Cousin Sue searched hard for those Easter eggs.,0
This last firework was kind of faint so I was unable to capture it with my camera.,0
this is a woman posing,0
These were perhaps melting snow people.,0
And was very happy to be in the field.,1
THE PICTURE IS BEAUTIFUL,1
You can tell this house was refurnished completely.,0
He had a great time on the hike.,1
It was a pretty day outdoors.,0
and yellow and purple fireworks,0
Jack serves his meal to family and friends.,0
"Rick, being the mature twin, appropriately hugged everyone as his brother stared evilly.",0
All of the students who graduated were very excited.,1
"We weren't sure where to have dinner, but we just happened to see a food truck as we were looking for a restaurant.",0
The boys were on mobiles.,0
The baby seemed to like it.,0
someone finally ate some of  the nasty casserole,0
Be sure the ingredients are mixed well together.,0
But the race must go on for the runners.,1
There was a festival with a lot of people.,0
Many different cultures were represented,1
It was a special celebratory night for us.,0
She only hopes to be a basketball player one day.,0
I went to the party with my female friends.,1
Friends join the man in the booth.,0
They all raced as the food was put out.,0
He had a great time on the hike.,0
The woman was a sea monster.,1
It was a perfect day on the farm near the mountains and sea.,0
I was biking to the gathering where we had a race.,0
And Spike sure loves Sparks.,1
The bakery's menu was written on the blackboard.,0
They reevaluated their idea.,1
That night there was a beautiful sunset over the docks.,1
It was true love.,0
His mom was so proud of him.,1
These homies enjoyed spending this quality time together.,0
It was a beautiful day for him.,0
"In the middle of our vacation, we managed to get in a great bike ride.",0
Searching for the man who stole my bike. I was tipped off that he ran passed those bushes out front.,0
The photographers were really hiding my family.,1
"If the cowboy does his toss right, neither he nor the calf gets hurt.",1
He uses witchy green light and glass ware and art work with a demonic motif.,0
The midnight blue firweorks had a nice gold center,1
Then he headed to the movie theatre to reward himself for his hard work.,0
Lovable and hot sunset,0
IT IS A ART,0
Running through the cemetery is a small stream that is partially frozen,0
IT IS A LIGHT,1
IT IS A HAND,1
At the end they did this amazing duet.,0
guests got souip as entree,0
His aunts and uncles even set up a special speech.,0
My eyes couldn't believe how beautiful the countryside was.,0
as the night went on everyone started to lay around.,0
Several of the aunts brought photo albums filled with memories.,0
"They finally reached the city, stopping to take in the beautiful skyline.",0
I discovered that even the simplest things can have a lot of heart and hold true beauty.,0
Then I got to visit an indoor greenhouse where a lot of the plants get their start.,1
Our visit to the local pond had us feeding these ducks.,1
They had a lot of unique shops.,1
OTHER MAN JOINING IN THE PROTEST,1
We had taken a trip to see the pillars on the amazing house,1
She lived in a very nice house.,0
It was a beautiful day for him.,1
The is a bunch of seagulls in the water by the bridge.,0
"It looked like a nice snack, with berries.",1
"It was the weekend, and two friends decided to go out.",0
THEY TAKE GROUP PHOTO,1
The bride feels amazing and it shows!,0
He walked to the top of a bridge and met and befriended a human lady.,0
There was support among the group to start raising money for the helpless.,0
We saw places that could seat a 1000 people.,0
"Shelly and her daughter Cassandra went on a lot of rides together while Gerard, the father, took lots of pictures.",1
A large storm must have passed through last night and buried the trees.,0
A student begin to take pictures of two other students.,0
I admired oil paintings of rivers.,0
There are many people sitting on the couch.,0
He had a great time on the hike.,1
It was a beautiful day for him.,1
We have just arrived at the beach as the first day of our vacation.,0
I got closer to this post and it almost looked like it was part of nature.,1
Her hair was swept over her eyes.,2
This straight on shot is my favorite picture of my favorite bridge.,0
The seas were calm that day.,1
Soon the senior dancers were grinding across the floor when he switched it up to some 1960's rock and roll.,0
We loved taking pictures by the large fountain.,1
She became a flag holder instead.,1
But we kept keeping.,0
"Dad is firing up the grill, and cooking our feast!",0
There weren't enough candels at Publix for a one hundred and third birthday so they didn't use any but they did still sing the birthday song.,1
His mom was so proud of him.,1
There are so many bright colored items for sale.,0
He taught my brother how to carve that year.,0
We had the table set for tonight.,1
Most of the damage to the wrecked vehicle appeared to be in the rear.,0
"As we were walking down the street, we saw the most unique street lamps.",0
"Over the weekend, we went to a rodeo.",0
They sped through the city as fast as they could.,1
A few students refrained.,1
My beautiful grand baby had plenty of fun in the water and sun.,0
"The event coordinator didn't seem to care about the crying children as he screamed out ""the smurfs are only one of societies evils and you shall worship these idols no more""!",0
Some couples even sang karaoke.,1
The city is always alive with people.,1
So many of the buildings looked so similar that we got lost.,0
One of us wanted to get a picture by himself.,0
A group of people play volleyball.,0
The cyclists made their way through town.,0
the next contestant wasn't as good,0
All of the people driving in the night had an important place to go.,0
Two little children play in the mud.,0
It looked like the perfect pasta dish.,0
The dog was ready to go.,1
"Even into the early morning, the party was still raging and was great fun for all who went.",1
and many opportunities to collect candy.,0
"In the next room, a banquet table awaited its guests.",0
"Together, with a little bit of effort they drill through the very ice and down into the watewrs below.",0
"Warming up they all stretching, attempting to get their head in the game.",0
He is eating in the photo.,1
People are playing a basketball game.,0
I am not a fan.,1
IT IS A GREEN LEAVES,1
The fireworks are getting ready to explode.,0
The kids were in the park,0
It was next to the house with the sheep where you took photos.,1
And then its time for the dance party.,0
I baked a cake for the party.,0
we all can't wait to scare the town!,0
So many people came it was a lot of fun.,0
They look like they're having a fun day.,1
The vehicles were lined up at the car show.,0
"The monks, after filling their bellies with food from the kind villagers, left the banquet and traveled down a long stone stairway.",0
The dog was ready to go.,1
the time for the race to begin was fast approaching.,0
We sent the weekend at this gorgeous beach.,1
We agreed it was the worst trip we had ever experienced.,0
"Don't worry, Little Man, 'cause I've gotcha.",1
It was freezing cold but I doubt he even cared.,0
"Once the kids bounced their energy out and could sit still, there was a face painter.",0
They wonderfully hit it off.,0
we all got drunk at the end of the night,1
Every picture we took was fuzzy because of the lights,0
I woke up as my train pulled through the woods.,0
This ship is going West.,0
It takes different stages of running to win the race.,0
"At the memorial, there were a series of head statues.",0
One lake in WA is a great spot for beginners.,1
Police were in place for crowd control.,1
Parade ended firework time.,1
I LOVE TO SKI,0
I ended their day with them taking a selfie.,1
Some of the students were driving nice cars for the homecoming parade,0
My mom bought a party hat for me to wear for my birtday.,0
"I decided to shape a new pinata, designed to look like a happy, striped kitten.",0
The view from our hotel on top of the hill was spectacular.,0
The statue was a beautiful work of art and history.,0
At certain points the participants had to carry their bikes.,0
the police came right away,1
"My other friend got her back on track, and we talked more about restaurants and menus.",0
The beautiful green flowers were cut from a yard close by.,0
"I checked the stove, brought my teetoling friend to get me home safe, and hit the bar, cause tonight I carouse and drink to my heart's content.",0
Yesterday the singer play his classical guitar graceful in the concert,1
The guys at the protest were holding signs to express their grievances,0
Last year we remodeled an old building to use for our organization.,0
After the ceremony her friends gathered around and wanted to offer her flowers as a gift.,0
They were intricate and incredible.,1
Some kids took shelter from the sun inside the claws of some construction equipment.,0
The man races through the mud during the day.,1
The yellow car appeared to have a slight lead.,0
I like to dream about the future when looking at the stars.,0
We started by visiting the cathedral.,1
We all sang and took pictures.,1
"One set of ruins had decaying steps, which we climbed as far as our tour guide allowed us to go.",0
The photographer is taking pictures for her picture.,0
This week it was time to go to the beach.,0
It is always fun to set at the window to watch teenagers go by.,0
The whole congragation followed him.,0
The Founder of the organization was happy about the wonderful turnout for the event.,0
A picture of dad's hand as he gets ready for the symbolic joining of palms ceremony.,0
Later she modeled a bright red formal with a more joyful style.,1
We could see the display in the gallery from the window.,1
she looks like dora,1
"When it was time for the party to end, I was told each helmet signifies their Derby name.",0
His mom was so proud of him.,1
There is nothing more fun then taking a stroll the dinosaur land at the end of a long day.,0
The caution tape prevented the crowd from getting through.,0
"Catching many fish, the fisherman considered the day a success.",0
This current home is up for sale because of some very sad memories that happened here.,0
The environment was absolutely serene.,1
His mom was so proud of him.,1
His mom was so proud of him.,1
And she was waiting for the moment that the fireworks would start.,0
The scavenger hunt list contained yellow round flowers.,0
The man was getting ready for the big race.,1
They spent a lot of time taking pictures.,0
And was very happy to be in the field.,1
THE BOY WAS CYCLING,1
This should provide excellent opportunities for tourism when it is finished.,0
I wonder what they do here.,1
Tonight was the annual Halloween party.,0
Trick or treating couldn't get any better when they were together.,0
"It looks like we have time for eating before the show, said Johnny.",0
look at the go in the water having lots of fun.,1
I love the old sign.,0
This painting has a very artistic view to it.,0
IT IS A BUILDING,1
"The old buildings were very beautiful, inside and out.",2
People sit at a sidewalk cafe and enjoy their time.,0
One biker even fell into the mud!,1
"As the ducks walked along, the baby decided to cross the street.",0
The finale fireworks display is always breath taking.,0
We all gathered around.,0
One of my students in town has alot of talent.,1
"Finally, in the door!",1
On my way home I drove by a row of run down houses.,1
IT  IS A NICE  PLACE,1
After the meeting we were treated to a party with music.,0
It was a real treat to see the band play.,0
Each of them eating and enjoying this exotic cuisine broke the ice.,1
"The desert was a simple glazed cake, garnished with an exotic blossom.",0
"No matter what I do, it's still too far away. I won't make it in time.",1
"Of course, who isn't after a lot to drink?",1
"Halloween is a great time to throw a party, especially a costume party, no telling who might show up!",0
Finally he was able to get it flying so the kids could enjoy it.,0
There was a gift shop but it was closed during the time that we were there.,0
THEY RUN THE ROAD,1
The CEO started the meeting.,0
The dog was ready to go.,1
We were washing the shirt before the race.,0
On the other side of the bridge the cattle graze in the fields of this farm.,0
This man won a shirt as a gift from the other players.,0
My mom and I had to think about safety when we got into the plane.,1
The dog was ready to go.,1
The girl laughed with everyone when she realized this fact.,1
IT IS A BULLET,1
"once downstairs to safety, the lush greenery comforts your eyes.",1
His wife was very adventurous.,0
"I felt happy as I arranged the shift I would work, while I sat down with a cup on the house.",0
The audience was really listening to her.,0
A great play stymied the other team.,1
There was a lot of interesting architecture in the area.,0
I took a picture of this tree with this growth on it.,0
"To the left a winged angel, picking flowers turned to notice.",0
The terrain was rugged and rocky on this day.,1
The single ladies quad were ready for a girl's night out.,0
"Walking the dogs, everyone is happy to get ouside.",1
"I visited a new town, and found the people to be really nice.",0
I want the black one with the spoiler.,1
I wound up taking the train to the party.,0
The played for the tennis team when they were younger,1
The bride looked beautiful as she waited at the entrance of the church.,0
We tried to take a nice picture with both boys.,0
Yesterday we decided to visit the museum for the first time.,0
They spent days at the beach and exploring the pier.,0
It was a really intense race.,0
The players played their favorite bagpipes.,1
And was very happy to be in the field.,1
The weather was really nice for sight-seeing.,0
All shapes and sizes of dogs compete in the dog show.,0
Fairs are known for their salty food and fun rides.,0
Clair loves taking the bus rather than driving so she can look out the window and discover new things.,0
IT IS A EYE,1
"I revisited a place where I once walked, and talked about our perspectives with my exboyfriend.",0
Submitting black and white pieces for sale at the gallery is a great way to make extra money off your artwork.,0
We hoped the rain would stop before our trip to the market.,1
Let's go take a look.,1
His mom was so proud of him.,1
"Hey dad, you look like you could use something to drink.",0
"Around the corner, we saw a wondering pig in the village.",0
I waited expentantly excited in a crowd.,0
Like Jared and Tony who are the go to photographers at these get togethers.,1
"At the event, during the photo op, the minister stands in the middle.",0
THE ARE SOME DOING,1
It was such a great well spent night with friend.,1
One raft had the numbers of a clock.,0
"Yellow was the color of the shirt Sonia's brother wore, and for once a tie!",0
A little girl is touching this pinkish red light.,0
"At dinner time, pet owners are served fresh pizza.",0
The view of these ruins with the ocean behind was breathtaking.,1
By bus we got to see the marvelous city and it's bustling atmosphere.,0
He screeched to a halt as he completed the course.,1
Of course a trip to the grounds of Fox Manor is a must.,1
The views were spectacular with a picture perfect view of a golf course and the adjacent river.,1
Today is my graduation.,0
I went to hear a lecture today.,0
It was dissapointing to see all the trash left by the crowds that watched the day's events.,0
He got the right clothes for the mood and found some great recipes and catering company and tables for the affair.,0
We saw spider man taking a kick break on the bench.,1
The guests left the party.,1
Today was a fun family gathering.,1
"All the rice , It is absolutly amazing and so very tasty nom nom nom.",0
They had a view of a parade route lined with odd sights.,1
We steamed the fish.,0
The school's mascot was in the rear of the parade.,0
"What the heck kind of competition is this, anyway?",1
The rides where perfect for smaller children.,0
they are making funny oses for the camra,0
We had a great time.,1
I am not very good at taking pictures of people.,0
Our class has alot of diversity .,1
Carl is always drunk.,1
We were successful in hitting the second ball to dislodge the first ball.,0
The fun run was a huge success.,0
We saw many things in nature including a praying mantis.,0
A man takes a picture of the pretty rock formation.,0
"It  was such a good choice, the waves and the rocks and the sky were all so beautiful!",0
My first trip to this beautiful country,0
The family had a fun time getting together.,0
My friend brought his camera equipment.,1
We then went on to the awards.,0
some of the people in the parade are playing bagpipes.,0
The bathroom makes you want to vomit and I've thought about it but I don't think red was a popular color for bathroom fixtures in any time period.,0
The ruins were built very high.,0
Inside the kids were sitting around the table talking.,0
Before finishing his last errand at the bank.,0
My wife and I were enjoying a small party with a few friends.,0
The crowd loves the performance - thumbs up all the way!,0
The couple enjoyed a light breakfast as they watched the surf.,1
They stared back at him absorbing the news.,0
I love mountain climbing and being out doors,0
And then outside of it we could watch the train roll in and stop at the location.,0
"Before long, however, things are ready.",1
"Two women, who had recently joined his friend group, invited their own friends along, much to Jason's dismay.",2
Our sisters were so surprised at how everything turned out.,1
I went to a restaurant where there were spilled seeds on the floor.,0
The line began to stretch for as far as my eye could see.,0
Their resort had the pool and many other lovely amenities.,0
The sister was beautiful.,0
He felt uncomfortable in his costume.,0
"But there was the ocean, and it was not crowded, and the water was so blue.",0
It included all types of ghoulish delights.,0
The Children really enjoyed this ride.,0
As I laid on the sand to relax I could see some planes flying.,1
The trolley was fun and we felt like we were in a movie.,0
Let's meet the general.,1
There was a lot of kayaking before I went home.,1
"It was a charity event in frigid water, but some people know how to celebrate under challenging conditions.",0
this is a event,0
The kids watch the rockets blast into the sky.,0
We went on a bus tour one day.,0
Partners in hope have joined to restore the medical center.,1
Two people are holding big drum sticks to make some noise.,1
And there was plenty of garlic.,1
School spirit says a lot about the crowds.,0
I even saw someone dressed as Jerry from the Spicegirls.,0
Once the party started the group loosened up.,1
"Finally, everything is added to a slow cooker bringing out the intense flavors of every ingredient for a delicious meal!",1
The road also lead to a fancy castle looking building.,1
The dog was ready to go.,1
Some unexpected guests arrived.,0
This baby is the cutest thing.,0
The crowd stands in respect watching the royal event.,0
It was a beautiful day for him.,0
"Once across, we continued on our journey.",0
IT IS A GARDEN,1
"What about you, son?",1
She finally wakes up and runs home.,0
SHE IS A BEAUTIES,1
"As always, there were some walkers that chose to wear costumes to create a point, or just to have fun.",0
Here's the dorm where I'll be staying.,0
They all had a lot of fun that night.,0
My favourite time of the year halloween.,0
Last but not least I found this picture of an unnamed cat which I'm sure never belonged to me.,0
The school was proud of this graduating class having the most diversity in its history.,0
THE GIRL WAS HAPPY,1
IT IS A MAN,1
These are the kinds of panels people love.,0
Uncle Rob brought his classical car.,0
While on vacation I visited a beautiful church.,0
I think this is the end of the parade.,0
There was a vast amount of modern flowers.,1
Oceans capture the largest quanties of water.,0
If you look closely you can see everything is stitched together.,1
"I hate all of them, why are they fake smiling we all know what really happened.",1
I decided to go to this party at night under the lights.,1
"Even when we don't participate, we love to watch the people sing.",0
Swings are the scariest ride at the fair.,0
We took my daughter to see the ocean.,0
Many of those people helped in recruiting.,0
"It is now our opportunity to imbibe the mood, music, beverages and friendship we have shared together over the years.",0
Joan Wanowski and her daughter Brenda were arrested for the suspected murder of Joan's husband Gary with knives from an antique place setting because he would not fix the television reception.,1
That guys asked me out for a date tonight.,1
And lots of rides for us to ride.,0
The bride and groom look happy to be spending their lives together.,0
One exhibit featured a mock ship's office set up with an antique typwriter.,0
It was actually much harder than we had anticipated.,0
"Inside, we even saw a statue of a dog.",0
Now it's time to dance!,1
"Put your vegetables in a pan, take care that they are chopped uniformly.",0
Everyone else brought out their little ones as well.,0
Then we went inside and it was even more scary.,1
THE TOWN IS VERY QUIET,1
The buses run with flags in the windows today.,0
The concert was finally starting.,0
We got closer and saw it was still occupied.,0
Finally the show has started. we've been waiting a while.,0
The water was getting heavy,0
"Some mornings, I come across a little old man who tends to these gardens.",1
It had a sleek futuristic design.,1
The rules are simple - follow the arrow suspenders until you find the socks.,0
They posed for pictures and made the children laugh.,0
"Stepping back, we could see the whole building and how massive it was.",0
Yu Yan   told Sean that they should take him to the theater tonight to see his favorite band playing.,0
IT IS A BIG BIRD,1
It looks like it is too early for the crepe myrtles to be blooming.,0
IT IS A CYCLING IN RAIN,1
While traveling in Australia we saw the famous opera house,0
THE CAR WAS ACCCIDENT,1
Another associate got lost and an employee had to show him where to go,0
He started to understand there were twenty sites on this road.,0
He thought the meal was amazing.,0
It was finally over.,1
IT IS A BLACK AND WHITE IMAGE,1
We caught some lunch in a nice tavern.,0
"But, sometimes, you just decide to take a picture right back!",0
Now that the party is over I hope the couple enjoy a long and happy life together.,0
A lady was talking to my uncle and a male coworker at the grill.,0
And of course you can enjoy the impressive architecture.,0
They joined in a moment of matrimony.,0
"All in all, it's a great place for a relaxing night out.",1
The two little boys loved it there.,1
A piece from the past.,1
My favorite are the simple humble gravestones.,0
Someone got excited and started a song and then everyone started to sing.,0
Everyone applauded the couple.,0
IT IS A GARDEN,1
"There is, of course, a ton of preparation to get ready, but there are always volunteers that know how to plan the event.",0
Of course we sampled all we could of the local cuisine.,0
He had a great time on the hike.,0
We enjoyed watching the sun set over the the city.,0
The woman was preparing for the party by cutting the cake.,0
We are enjoying a healthy and delicious dinner together.,0
She had so many stories of the buildings she had lived in.,0
It's Halloween and we are having a family oriented party!,0
A group of college kids decided to go to the lake.,0
The teachers let them get away with it.,0
He had a great time on the hike.,1
The store Spinns was a hit.,0
"Sitting in the crowd, her family cheers when it's her turn.",1
IT IS A SNOW,1
I love satellite tv.,0
The dog was ready to go.,1
His mom was so proud of him.,1
"The shadows were lengthening by the hour as we at last entered the street that went past the still lovely flowering bushes, the one that would lead us to our gate and home.",0
The sad tired of walking and decided to go to her parents.,0
This guy had buckets.,1
he said the temple was a perfect location,0
The speech given by Silverstein was one of the best speakers I have ever heard.,1
"If you havent watched your back, youll be surprised how a wave can come onto a surfer and knock them over.",0
I have no words,0
During my trip i visited a criminal organization.,1
Beside it was a goat that grazed contentedly in the grass.,0
The whole event was fun fast entertainment!,0
THE TAKE GROUP PHOTO,1
We got to ride the rides.,0
We visited his memorial grave.,0
Harold flipped the page to a picture of his male sibling and his female girlfriend.,0
The sun was out and two lonely chairs waited for people to come sit down on them.,1
The wedding cake was tasty.,1
They danced as the music played.,0
THEY SAVE THE BLACK MANS,1
A perfect day on the walking path under the train tressel.,0
The romantic couple poses for pictures.,0
Some of them where made at night in various lights.,0
They painted posters diligently.,1
Today is the German Festival.,0
The trail led to some beautiful sparkling water.,0
The people races for the mud day.,1
