output.sentences,ethnic
"On the way home, some artistic looking photos were taken for Instagram.",1
First we signed up in what seemed to be a ballroom.,1
The dog was ready to go.,1
The team was rabid in line.,1
here comes Smokey the Bear.,1
The fixtures here are so modern and fancy.,1
Lets sit down before the show starts.,5
They were very excited at how pretty they looked so they decided to look inside.,0
The racer had perspective interviews.,1
A picture of a birthday card my kid made for me.,5
The couple enjoyed spending time together.,1
Somethings I've photographed are entirely undescribeable.,1
There were thousands of people in the crowd.,1
This was one of my favorite pieces that I saw.,1
Afterwords he would talk and mingle with guests.,1
Tarboro are marked heavy.,1
He had a great day and slept well that evening.,1
They pull up in the limo completely drunk and falling over. The bridesmaids go what the heck!,1
ONE BOY SITING IN HIS HOUSE HE DREAM,4
Someone had to stand to give a speech that was embarrassing.,1
The understone to these rallies can sometimes have tension.,1
And was very happy to be in the field.,1
Some outfits were really wild.,1
The jets were the most impressive.,1
The Japanese female students say bye by showing the peace sign.,0
Over all this was a wonderful experience.,1
"It's beauty was clouded by the seclusion that came with it but to her, it was home.",1
"Fire trucks arrived on the scene,Stay back the fire man told every one",0
Then the karoke began and we all had a go singing long into the night.,1
On the walls were pictures she had painted.,1
"In particular, the collectors loved the classic cars.",1
"Glad i wore my helfmet today, I just hit a rock.",5
"Our office at work has the latest equipment, but once I got home I was happy to hang with my own laptop and low-tech gear.",1
Tonight his parents were celebrating 50 years of marriage and he made sure their song was moving as they danced in the spotlight.,4
My friend is drunk at the party.,1
THEY PEOPLES  ARE ION TREE,4
My parents arrived and we showed them the farm.,1
"Naturally the trees provided a canopy of shade, breeze and something pleasant to look at when we were not perusing ancient historical artifacts.",1
IT WORKING IN 24 HOURS,4
"At closer glance, you can see how each of them appeal to different tastes in women.",5
It's relaxing for the whole team when the manager is happy.,1
He had a great time on the hike.,1
They all sat waiting patiently for their turn.,1
"He didn't win but he rode well, finishing just after the winner.",1
Proud of the teenagers who came out to clear the land.,1
"So clearly when the paper read ""smurf bonfire"" they meant it literally and now I have to explain to Betty and Jenny why burning smurfs makes some people happy.",1
Aunt Julie Ann wore her special fourth of July shirt for the special occassion.,1
The dog was ready to go.,1
The promotion in Vegas is straight poker.,1
"We ran rushed through the trees, arms outstretched to keep from falling.",1
The boys were ready for the game to begin.,1
The stingray makes an appearance.,5
THE PICTURE IS BEAUTIFUL,1
His mom was so proud of him.,1
She rode the ferris wheel and could see all of London,1
He had a great time on the hike.,1
a band plays live music for the occasion.,1
"As we saw the picture of the presenters wedding, and heard about how she nearly died on her honeymoon trip, we all felt a little ridiculous for the silly laughter.",1
It passed by some beautiful canyons.,1
setting up for a party,9
The rocks ashore were pretty.,1
"Man i dont even think i can begin to describe to you the amazing time we had, the first thing we did was hop in the  van wich we decked out for the trip",0
Today we went to view and tour the new car.,1
The lights were bright.,1
HOUSE IS VERY NICE,1
IT IS A PLAY GROUND,4
IT IS A SNOW,4
It was a cold and snowy start to the race.,1
Dad likes playing the piano.,1
IT IS A SEA,4
"People arrived before sundown for the fireworks display, which was to take place hours later.",1
She then got a coffee at the nearest location that served drinks.,1
IT IS A OFFICERS,4
We were asked to stand up and become part.,1
We lined up to walk into the temple,1
Mary found paper in the shredder.,1
"When we arrived in the town, we were blown away by the gorgeous view despite the absolutely terrible weather.",9
All of my cousins have come to my house,1
Sprinkles are added for an additional delcious texture.,2
this is the side of a brick bulding,4
"After we ate, the boys played a ball game against each other.",1
"We wanted a shot of the single girls holding red roses, and other guests.",1
"Without these brave men, how could you feel safe in this country?",0
He made it through the crosswalk safely and made it on time!,7
The  bride and groom exchanged their vows with a sweet look at each other.,1
THEY WENT TO SEE SOME STING RAYS,1
"Wow, the band was amazing.",1
THE MAN WAS ANAGRY,4
They were in awe of how big it was up close!,1
His mom was so proud of him.,1
And theres a spot where the kiddos can make their own products to sell to the customers.,5
We noticed several different kinds of bugs on the plant and wondered which ones were bad.,1
"To me, this house looks a lot like a fixer upper.",1
The kids all sat around in a circle and congratulated him one by one.,2
"Meanwhile, more cars were getting stuck in the snow as well.",1
The sunset was beautiful and we will probably do the same thing tomorrow.,1
"Water in streams or rivers appear separate from the snow element, despite being the same element.",1
"There were carvings, made by locals, which were intricate and often in the shape of exotic animals.",1
Thrills and spills at the rodeo!,1
Sam & Linda are happy to be able to see some water animal views,1
"Not rain, just racists. Time to go either way.",1
This was definitely a hat goofy event.,1
We visited the bakery before Halloween and notices some cute cookies like the smiley pumpkin one.,1
There were alot of fun things to do there,1
All the kids are no old enough to drink,1
We were excited to be there.,1
The Queen's guard assembled for the royal procession.,7
Accompanied with the bowl were two vases that also had similar designs.,2
Halloween is a wonderful time to get the kids involved and get their imaginations running.,1
A cultural theme party was thrown the other night.,1
IT IS A KITCHEN,4
There is no picture in this or any frame so I guess I am called upon to use my imagination.,8
"The team of women had a great season, filled with motivation.",1
The coworkers rallied together one morning to take a stand.,1
They had alot of speakers ready.,1
Mom and dad had a livey conversation at dinner.,5
"Next, he felt rebellious and broke the rules of the no trespassing sign.",1
The tubes react as you pass.,1
The sound of the storm and the rain on the water is soothing.,1
They play traditional music and do traditional dances,1
There were plenty of platform games for all participants.,1
But my little brother was mad so we had to go home.,1
IT IS A INSID E OF THE HOUSE,4
Then David arrived with his award too!,1
"Momma, can I just stay in my wagon!",1
Then they talked for a while.,2
Everyone enjoyed the walk along the water.,1
The firemen showed up and got to work on the demolished car.,1
This weekend we visit a park.,1
"Wearing matching shirts, two of them cycled from their basketball game.",1
"""Hey Alan, Whose your favorite rapper?"" asks Gary.",1
And the berries produced were sweet and juicy.,1
There are many different kinds of headstones in a graveyard.,1
The festival had many concessions and had a beer booth.,1
My favorite discovery was the ancient pottery.,1
She felt like she was watching the birth of a star.,1
She was our key note speaker and she pulled out the original presentation for the meeting.,0
Then she saw how cute and cuddly he was!,1
There are dignitaries here as well and they are respectful in their saluting and observance.,1
The magnificent white cake looked so delicious,1
"On the table, there was a tall pitcher of lemonade.",1
"So that's what I did, and my pictures looked normal, and the county officials were even impressed!",1
Santa came to our Christmas party this year.,1
Her bridesmaid was inside waiting on her.,1
"When all had spoke, the microphone returned to the mail speaker.",1
Jim brought his new girlfriend who had no problem fitting in and played along.,1
THE MAN IN  CYCLE,4
Three men sit in a room chatting while sipping off of their drinks,0
It was amazing to be outdoors.,1
Others I would sit on the porch with my grandma and enjoy the weather.,1
the dogs were loving he sunny day.,1
we saw exhibits on frederick douglass,1
THE COLORS COULD BEEN SEEN FROM MILES AWAY,1
After it was cooked we enjoyed drinks and conversation.,1
They started giggling over the silly moment.,1
They liked their pictures taken a lot.,1
He had a great time on the hike.,1
The party yesterday night lasted many hours.,1
We could see the stadium where we were going to watch a soccer game.,1
"Mom, Dad, son and I waiting to watch the light display after arriving.",1
"Wow, it really flew off the shelves!",1
He also invited his girlfriend to the party!,2
Many tourists visit the city.,1
"The bigger the event, the more preparations have to me, each table set with acoutrements suitable for the occasion.",1
I want to win that muppet monster,1
"Some of us rode with helmets, others did not.",1
His mom was so proud of him.,1
Curious about the statue of a rabbit on this property we decided to take a closer look.,1
Four others were celebrating her birthday at the restaurant with her.,1
Afterwards they sort out all of the photos that were taking a day before.,0
He felt glad to have his hair cut since he would see his boss that night.,1
The first person to drink.,1
Biker babes are everywhere around here!,5
so her uncle and  i decied to rent a party boat and  spend the day  out at see,0
They are wife and husband after the ceremony.,1
Many personnel came out for the official unveiling event.,1
The yellow one was ok.,1
IT IS A BEECH,4
even tho the trip was a littlt expensive it was so worth it in the end it was the best decision we made,7
Then one of us lied in the middle of a forest on the path,0
Yet not excited enough to purchase or wear those shirts of course.,1
The voice of the singer was nice.,1
A bird was searching for food.,1
HE DID VERY WELL EXPLAINING ALL THE TERMS TO ALL OTHER PARTICIPANTS,1
then mark stopped by the market to buy fruit,7
Dad and daughter spend some time in the zoo.,9
I pass the same road and same building every day.,1
"When we pulled up to the area, we were greeted by animals.",1
She sampled the local fares and drank a margarita by herself,1
It was a good meal and a good time for Amys grandparents but they retired and slept on the couch.,0
Each of the horses have long eyelashes and a beautiful brown coat.,1
They were mingling and having a good time talking.,1
"As I was riding to work, i saw what was the greatest challenge of my life.",5
Today was the day of the rock concert.,1
And was very happy to be in the field.,1
They went to a restaurant with a painting on the wall.,1
We had a fun time exploring this old building on our walk.,1
They graffitied everything they could.,1
All of the creepy sights made for a very cool experience.,1
In the street we ran into random kids playing music.,1
The player is trying to steal the ball from the other team.,1
IT IS A FOOD,4
WHen it started the speed of those in the race was very fast.,1
They also wore kimonos to embrace the Japanese ways.,2
"They enjoyed each moment, and she couldn't wait to spend the rest of her life with her husband.",1
IT IS A ROOM,4
He enjoyed partaking in this pastime with some of his closest friends.,1
The Christmas festival had finally come to the small town.,1
Then went to the zoo,7
The inspection is completed just in time for the storm to hit.,1
"Religious groups were also welcomed to participate in the festivities, the two friars of the Church Of The Scarecrow would always participate.",1
my sister and my mom,1
The table in the hall had alot of seats.,1
This was clearly the happiest day of Phil's life.,1
A business meeting was being held at a hibachi.,1
The picture showed a rearing red horse.,1
The dog was ready to go.,1
People over to shop at this store.,1
The couple sit together at a picnic table and the man fixes a hand gestures.,0
Now it's time to honor the dead soldiers who gave their lives for us.,1
We were ready to explore the other wings but had to wait for them to open.,1
She was proud that I finished school.,1
"Instead of exploring the building, I continued my walk home, making it in just under an hour.",1
A ride individual flipped off a food store.,1
The event raised money to save lives.,0
IT IS A SEA,4
it didn't take long for team members to join in on the revelry.,1
The fliers helped me rememner the times of the past.,1
WE ADDED SOME VEGGIES AS WELL,1
There was so much food and treats everywhere.,1
We were moved to see ruins from past civilizations as we walked along.,1
The best part was when they all worked together on stage to perform a freestyle.,1
There is food for everyone.,0
ONE MAN OF THE HAND SPEECH,4
"The newspaper wrote about the event (leaving out  the volunteer) and titled it ""Fire Safety Instructor Starts Unsafe Fire"", which sold them some extra prints at Betsy's expense so the experience has hardened her a bit but she says she won't give up on the kids.",1
We retraced our steps back to the rental house.,1
"We all had such a great time , nothing better then food with family.",1
"After so many tremendous displays, we found the finale was still quite amazing.",1
Many people made purchases and left happy.,1
We saw an orange color bird and I took a picture.,1
I'm so glad we're at the kite festival.,1
We had to take another volleyball to knock the other ball off the roof.,1
IT IS A THREE DISK ANTONA,4
Another person's outfit was carnival themed.,1
"Ordered pizza and went back to the hotel to chill and relax for the night, what a day!",1
Do you think she'd dance with me?,1
The motorcycle stood ready to be seen.,0
The sun was setting and it made the building look amazing.,1
"It's not a snake silly, it's the start of a race.",1
They cut the skin off all of the potatoes.,0
It doesn't look too cold from here.,1
He looked around the crowd to see what kind of audience members he would be lecturing this afternoon.,1
The family was outside playing games.,1
The vegetables were sauteed in the pan.,1
IT IS A ROOM,4
My sister was ready to express her feelings during the parade.,1
A male vegan attended a large festival,1
Vendors were on hand to sell different items,1
Aunt Peggy wore her silly outfit as usual.,1
Today at the park I took pictures of a picnic with a lady and her family.,1
I was impressed by the protesters creativity.,2
Someone else brought the tabasco sauce.,1
"Often times they will also dress up as characters from movies, like Beetlejeuce.",1
He had a great time on the hike.,1
THEY ARE VERY CAREFULLY WATCH,4
Then they all left the field for the start of the game.,1
The food was finally done and I served everyone individually.,1
He ended it by writing words above his art.,1
I can remember many stories from the time I lived in that old building.,1
The dog was ready to go.,1
It is very important your parachute is strapped on when you go flying.,1
There were many key interviews that day.,1
My dad couldn't move form that area and looked at those cars for an hour or even more.,5
Its the race time in this series,7
We explored the city while on a boat.,1
The principal spoke and it was boring.,1
A group of girls prepare for a dance off.,1
I expected much more visitors at the location.,1
We like to get the office involved with activities for the holiday,7
I can't stand anyone in there I hope nobody comes outside.,5
I loved seeing the trees.,1
The sight of the ocean is finally visible.,1
ONOTHER BOY DRINK JUICE,4
There was a leaf growing in the ground.,1
We smiled and posed for pictures.,1
And helped them understand if they had trouble.,1
The monumet is visible from my location.,1
It does a great job in blocking the driveway and it difficult in parking.,1
We're going to roast marshmallows over the fire and talk.,1
The exhausted baby takes a nap after viewing all the sites and smells.,1
"Some memorial sites, like this one, are simply peaceful, beautiful and serene to look at and spend time at.",1
THE LOVE IS EXPRESSED,1
They seems to have a lot of fun,7
I was speechless as we prepared to join the other officers on the tarp.,0
AT THE CARIVAL THEY HAD LOTS OF FOOD,1
We noticed someone was growing lovely purple flowers.,1
Dad and I went looking for shells and sea glass for Mom,1
While we ate we washed down the food with drinks.,1
His mom was so proud of him.,1
Tomorrow will be the last day to practice before the big performance.,5
"Afterwards, we raced down the tall slide.",1
Little guy with the binkie in his mouth is having a blast,1
A huge tank awaited its use.,1
There were plenty of treats for their guests.,1
"I was given a reward, despite how I was dressed.",1
I love that these houses have their own history to tell.,1
This city is full of wires,7
Wintertime brought a lot of snow to the family's house.,6
The murals for the class were beautiful.,1
Up close you  can really see the amazing details.,0
The marathon had bicycle riders who all started at the lineup.,1
In the summer time it is popular to have a party.,1
We saw the sea from a pier when visiting a lighthouse.,1
Winter Haven looks like a nice condo complex.,1
My mom made sure to get me a pamphlet that had been handed out to the guests.,1
"The giant smurf was actually a giant bonfire pit, and people were starting the process of burning it.",1
It was the day of the big cycling race.,1
He had a great time on the hike.,1
The panel door of the driver was slightly damaged as well.,1
guy with a flower in his hand,9
I didn't know our weekend vacation was to include traveling on donkeys.,1
Sometime we walk down to the beach and sit for a meal.,1
Faster and faster it whirled until she got dizzy watching it.,1
THE ARE IN PARTY,4
"She will always remember her fun times on her trip, and how cold she was!",1
The beach has something for all ages.,1
The dog was ready to go.,1
"Lets go for a walk, and see what we can find.",7
The tug in blue wished that he hadn't purchased his ugly shirt.,1
This kitty just want's to see what's up there!,7
"I looked across the street, the neighbors across had some trimmed and nicely kept brushes.",5
"Some of the kids are now adults, but others have morphed into donkeys.",1
"This was it, the graveyard my grandfather had finally been laid to rest in.",0
"The wonderful smell of autumn has hit the air, and that means fall has finally arrived.",1
He learned a lot about the visit,1
There was a soccer games.,1
"Well, they're good, but they're no Led Zeppelin!",1
"After a successful event, the planning committee takes a photo.",0
The pantry seemed well stocked.,1
The nearby lake showed some pretty scary signs as well.,1
Hundreds of people tour this temple each day.,1
Those girls look like they could use some ice cream,1
"Everyone was included, even my little cousin Andrew!",1
We had to mold it into a cool shape.,1
The plants were fascinating too.,1
We decided to ski together.,1
A male was riding in the parage past the crowd.,1
A tray of goodies were laid out for the upcoming party.,1
HE WAS TIRED BY THE END OF THE DAY,1
also there were stuff onate with pumpkins in display,4
They all go outside to hang out together.,1
His mom was so proud of him.,1
Sports themed books decorate the shelf.,1
Volunteer parents helped keep an extra eye out for the childrens' safety.,1
IT IS  VERY LONG,4
We check the pressure gauge to make sure they are running right.,1
there was a bike on the trail,1
We toasted to the great life we have after the night,0
We saw a building that was so beautiful.,1
The streets were filled with people and the shops were busy.,1
everyone loved her singing,1
They made a delicious dish topped with cheese.,1
Yesterday we went on a river cruise.,1
They have joined the tour which touring around town by walking,7
Dinner by candlelight was how she wanted to celebrate her anniversary.,1
The flower garden was in full bloom.,1
One of the men is passionate and really wants to get his point accross.,1
This of course requires them to work together as it is quite heavy.,1
I have no idea what that was that just went down the street in a wagon.,7
this is a tree,4
Texas has a lot of war memorials.,1
There were so many stores that were closed.,1
A man stole one of the children from out of a train.,7
THE MAN WAS FIGHT,4
"There were several speakers, one of whom read a children's book to the kids in attendance.",1
It was finally the day to go to the green hill.,1
He smiled ear to ear as 4 long years of hard work were finally rewarded.,1
That's the last time I use someone elses camera.,5
Visiting this majestic building was eye opening.,1
Everyone has taken the knee to pay that all goes well,0
To help make the night better we started a fire so that everyone could enjoy some warmth.,1
This had to be the worst food in the world at this restaurant.,1
IT IS A SEA,4
The could view the scenic shore from where they were.,2
It was a great time watching the fireworks tonight.,1
His son was not very excited to spend time with him.,2
with a lot of force,1
IT IS A CAR,4
The ornaments glowed and reflected light all around the room.,0
THE COOKING IN THE FRIEST,4
My sister had a ride on an airplane that was round trip,7
Family gathered around eager for a wonderful day.,1
He had a great time on the hike.,1
I went to a wedding yesterday and the bride looked so gorgeous.,1
Sculptures in stone can be historic and educational sites on vacation.,1
Look at this scary costume entry.,1
The tourist prepared the locals for what they were going to see.,1
They had a lot of fun at the lake/,2
The male had a ton of fun.,1
The red candy house was open.,1
I moved the glass next to the bottle so I remember the name of this great tasting brew.,1
"The result, when finished will be nothing short of delicious!",1
They were watching and happy at the event.,1
Mom enjoys time in the kitchen with the kids.,1
the team roared in appreciation for the hard effort in playing,7
"The more we drank, the livelier the night became.",1
Some said these birds were a sign of something special.,1
We could go see the beautiful statues in the city.,1
IT IS A MAN,4
"We had a wonderful, fabulous day together.",1
She also has a lot of books to organize.,1
The university graduates were very proud and one of the largest groups,5
The board had an important point to make at the meeting.,1
Then they jump up and down with glee and a helpful adult returns the ball to the children.,8
palm trees surround the resort.,0
IT IS VERY SMALL BOY,4
"I met nice friends on my ride, and we enjoyed a delicious lunch at the end.",1
THE BOY WAS ANGRY,4
The team from NASA has arrived.,1
"Suddenly, he fell and got a booboo.",1
IT IS A LEAVES,4
"But in reality, the male's friend just ran away with some chick named Shanon.",2
The day started out with a car accident.,1
"Although the clouds pretty, I wished that I had sunnier weather.",1
AFTER THE WEDDING CEREMONY LOTS OF PICTURES WHERE TAKEN,1
The whole team was excited,1
The mayor shaking hands with soldiers in line,9
"It's a big family, everyone enjoyed this party",7
IT IS A INSIDE OF THE HOUSE,4
We attended the Festival of the Lanterns.,1
"Yep, I totally regretted it, but I'd do it again.",5
IT IS A CHILDRENS TOYS,4
"The group assembles and Alan says to Gary, ""Thank God, I've been waiting all night for the Electric Slide competition to start."" And Gary, looking defeated, mutters to himself, ""Why can't  we ever do the Macarena?""",1
"We all encouraged him and developed our methods, procedures and work assignments for the group at our bench.",7
The night was warm and slightly muggy and it felt very comfortable beside the glowing fire.,1
The homes and trees were covered in white.,1
Her father insisted that we touch his good luck charm before hugging him.,7
IT IS A HIGH BUILDING,4
The duck enjoyed the statues in the park.,1
IT IS A THINGS,4
The trees were reflecting on the water and it was pretty.,1
The venue was set up like a disco and I waited for my wedding song to start playing.,1
IT IS A WHITE BIRD,4
what an old building,5
He woke up and took a selfie for the start of the day.,1
It was a lot of driving and fun.,1
Preparation of for a major expensive event begins simple with tables and chairs.,1
Must be pretty heavy!,1
"After lunch and taking photos of my favorite local sites, I finally made it to my destination.",1
The cop and the man drove to the protest and destination respectively.,0
They even remembered to get grandpas favorite chocolate cake.,1
"Mrs. Norris was a wonderful art teacher, and she loved inspiring her students to be creative.",1
Their favorite way to end the day was with cotton candy.,1
they have some modern art you can sit on,1
Today is the baby's birthday.,1
The outcome of the game was awesome for these males fans.,1
The couple visited this venue to see if it was the right fit for their wedding.,1
"The second piece he looks at is also abstract, but black and white.",1
"We thanked the hostess, but partied on like it was 1999.",1
There was this one really creey male there that followed me everywhere.,1
Then all of a sudden there was a break in the clouds and the sea became calm again.,2
it was a beautiful ceremony.,2
The Thompsons had a great night.,1
I was taught much at this site.,2
Food galore was on the table.,1
He also put some burgers on the grill.,1
The orange type of spider was on the web.,1
Then we checked out some peaceful walking paths.,7
"When we headed home, the view of the trail was stunning.",1
Let me take a picutre of a picture of Michelle Obama.,5
He had a great time on the hike.,1
Her degree is in political science.,0
